"Zielgebiet ""Regionale Wettbewerbsfähigkeit und Beschäftigung"" ",,,,,,,,Universität Bremen,,,,"Verbundprojekt: Konzeption, Realisierung und Durchführung einer Qualifizierung von Fachkräften auf der Baustelle zur Verringerung der Wissenskluft durch Blended Learning. Teilvorhaben: Arbeitsprozessbezogene Didaktik und Evaluation",,2008,"388.061,00  EUR",PMC Projektmanagement und Consulting,,,,"Verbundprojekt: Konzeption, Realisierung und Durchführung einer Qualifizierung von Fachkräften auf der Baustelle zur Verringerung der Wissenskluft durch Blended Learning. Teilvorhaben: Arbeitsprozessorientierte Lernunterstützung a. Büro- u. Heimarbeitspl.",,2008,"65.370,00  EUR",Arbeitskreis Ökologischer Holzbau e.V.,,,,"Verbundprojekt: Konzeption, Realisierung und Durchführung einer Qualifizierung von Fachkräften auf der Baustelle zur Verringerung der Wissenskluft durch Blended Learning. Teilvorhaben: Bereitstellung der Schnittstelle zwischen Wissenschaft und Praxis",,2008,"25.926,00  EUR",Universität Bremen,,,,"Verbundprojekt: Konzeption, Realisierung und Durchführung einer Qualifizierung von Fachkräften auf der Baustelle zur Verringerung der Wissenskluft durch Blended Learning. Teilvorhaben: Mobiles Lernen",,2008,"176.557,00  EUR","Arbeitskreis ökologischer Holzbau, Regionalzentrum Niedersachsen e.V.",,,,"Verbundprojekt: Konzeption, Realisierung und Durchführung einer Qualifizierung von Fachkräften auf der Baustelle zur Verringerung der Wissenskluft durch Blended Learning. Teilvorhaben: Qualifizierung von Baufachkräften im Kompetenzzentrum.",,2008,"10.507,55  EUR","BAQ-Forschungsinstitut für Beschäftigung, Arbeit, Qualifikation",,,,"Verbundprojekt: Konzeption, Realisierung und Durchführung einer Qualifizierung von Fachkräften auf der Baustelle zur Verringerung der Wissenskluft durch Blended Learning. Teilvorhaben: Weiterbildung zur Fachkraft für ökologisches und umweltgerechtes Bauen",,2008,"143.448,00  EUR",REFLEXA-WERKE Albrecht GmbH,,,,"Verbundprojekt: Künstlerisch, Erfahrungsgeleitet, Spielerisch - Management des Informellen zur Förderung innovativer Arbeit (KES-MI), Teilvorhaben  explorativ-inkrementelle Entscheidungsprozesse",,2008,"0,00  EUR",Institut für Sozialwissenschaftliche Forschung e.V. (ISF),,,,"Verbundprojekt: Künstlerisch, Erfahrungsgeleitet, Spielerisch - Management des Informellen zur Förderung innovativer Arbeit (KES-MI), Teilvorhaben Anwendungsbezogene Konzeptentwicklung und arbeitswissenschaftliche Begleitung betrieblicher Vorhaben",,2008,"0,00  EUR",euro engineering Aktiengesellschaft - Niederlassung München,,,,"Verbundprojekt: Künstlerisch, Erfahrungsgeleitet, Spielerisch - Management des Informellen zur Förderung innovativer Arbeit (KES-MI), Teilvorhaben Dynamisch-flexible Projektsteuerung",,2008,"0,00  EUR",Verein für Ausbildungsforschung und Berufsentwicklung e.V.,,,,"Verbundprojekt: Künstlerisch, Erfahrungsgeleitet, Spielerisch - Management des Informellen zur Förderung innovativer Arbeit (KES-MI), Teilvorhaben Kompetenzentwicklung und lernförderliche Arbeitsgestaltung",,2008,"0,00  EUR",Maurer & Treutner GmbH & Co. KG,,,,"Verbundprojekt: Künstlerisch, Erfahrungsgeleitet, Spielerisch - Management des Informellen zur Förderung innovativer Arbeit (KES-MI), Teilvorhaben Kooperativer Erfahrungstransfer",,2008,"0,00  EUR",KIMA Gesellschaft für Echtzeitsysteme und Prozeßautomation,,,,"Verbundprojekt: Künstlerisch, Erfahrungsgeleitet, Spielerisch - Management des Informellen zur Förderung innovativer Arbeit (KES-MI), Teilvorhaben Situativ-experimentelles Projektmanagement",,2008,"0,00  EUR",Universität Augsburg,,,,"Verbundprojekt: Künstlerisch, Erfahrungsgeleitet, Spielerisch - Management des informellen zur Förderung innovativer Arbeit (KES-MI), Teilvorhaben Integriertes Konzept innovativer Arbeit",,2008,"0,00  EUR",Institut für Sozialforschung und Sozialwirtschaft e.V. (ISO),,,,"Verbundprojekt: Lebenslang gesund arbeiten - demografieorientierte Präventionskonzepte (LEGESA), Teilvorhaben Konzeptionelle Gestaltung von präventionsgerechten Erwerbsbiographien für die Investitionsgüterindustrie",,2007,"404.873,00  EUR",Deutsches Institut für Internationale Pädagogische Forschung (DIPF),,,,"Verbundprojekt: Länderübergreifendes Forschungsprogramm zur wissenschaftlichen Begleitforschung der Ganztagsschulen: ""Studie zur Entwicklung von Ganztagsschule (StEG)"" - 3. Erhebungswelle (DIPF - Ziel 2)",,2008,"840.630,31  EUR",Deutsches Jugendinstitut e.V.,,,,"Verbundprojekt: Länderübergreifendes Forschungsprogramm zur wissenschaftlichen Begleitforschung der Ganztagsschulen: ""Studie zur Entwicklung von Ganztagsschule (StEG)"" - 3. Erhebungswelle (DJI - Ziel 2)",,2008,"794.206,87  EUR",Technische Universität Dortmund,,,,"Verbundprojekt: Länderübergreifendes Forschungsprogramm zur wissenschaftlichen Begleitforschung der Ganztagsschulen: ""Studie zur Entwicklung von Ganztagsschule (StEG)"" - 3. Erhebungswelle (IfS Dortmund - Ziel 2)",,2008,"699.457,41  EUR",IDS Scheer AG,,,,"Verbundprojekt: Management kreativitätsintensiver Prozesse (ManKIP), Teilvorhaben Entwicklung einer Methode für die Modellierung kreativitätsintensiver Prozesse",,2008,"0,00  EUR",Medien Entertainment Management Institut an der Europa Fachhochschule Fresenius - Hochschule für Wirtschaft und Medien e.V.,,,,"Verbundprojekt: Management kreativitätsintensiver Prozesse (ManKIP), Teilvorhaben Entwicklung eines Modells kreativitätsintensiver Prozesse",,2008,"0,00  EUR",IQ-optimize Software AG,,,,"Verbundprojekt: Management kreativitätsintensiver Prozesse (ManKIP), Teilvorhaben Entwicklung eines flexiblen Workflowsystems für das Management kreativitätsintensiver Prozesse",,2008,"0,00  EUR",Westfälische Wilhelms-Universität Münster,,,,"Verbundprojekt: Management kreativitätsintensiver Prozesse (ManKIP), Teilvorhaben Entwicklung eines konzeptionellen Frameworks für die IT-Unterstützung kreativitätsintensiver Prozesse",,2008,"0,00  EUR",x-dot GmbH,,,,"Verbundprojekt: Management kreativitätsintensiver Prozesse (ManKIP), Teilvorhaben Entwicklung eines wissensbasierten Systems zur Unterstützung kreativer Aufgaben",,2008,"0,00  EUR",SPI Consult GmbH,,,,Verbundprojekt: MediNet plus - Flexibilisierung der Berufsausbildung in der Gesundheitswirtschaft,,2008,"228.682,00  EUR",Zentral-Fachausschuss Berufsbildung Druck und Medien (ZFA),,,,Verbundprojekt: Mediencommunity 2.0 - Strukturreform und Plattform,,2008,"454.480,00  EUR",Hochschule für angewandte Wissenschaften - Fachhochschule München,,,,Verbundprojekt: Mediencommunity 2.0 - Wissensplattform der Druck- und Medienbranche für modularisierte Lehrkonzepte in einer Lehr-/Lerngemeinschaft. Teilprojekt: Hochschule München: Wissensmanagement & Kooperatives Lernen,,2008,"201.026,00  EUR",MMB-Institut für Medien- und Kompetenzforschung,,,,"Verbundprojekt: Mediencommunity 2.0 - Wissensplattform der Druck- und Medienbranche für modularisierte lebenslange Lernkonzepte in einer Lehr-/Lerngemeinschaft - Teilprojekt:  Evaluation, Zertifizierung, Transfer",,2008,"75.180,00  EUR",Beuth Hochschule für Technik Berlin,,,,Verbundprojekt: Mediencommunity 2.0 - Wissensplattform der Druck- und Medienbranche für modularisierte lebenslange Lernkonzepte in einer Lehr-/Lerngemeinschaft.Teilprojekt: Wissensmanagement in Lehr-/Lernnetzwerken,,2008,"666.671,00  EUR",Universität Duisburg-Essen,,,,"Verbundprojekt: Music - Innovation - Corporate Culture (MICC), Teilvorhaben Diagnosetool Organisationskultur, Mustersprache und Translationslogik",,2008,"0,00  EUR",Stadt Castrop-Rauxel,,,,"Verbundprojekt: Music - Innovation - Corporate Culture (MICC), Teilvorhaben Impulse für regionalspezifische Diversity-Ansätze",,2008,"0,00  EUR",ic! - berlin brillen GmbH,,,,"Verbundprojekt: Music - Innovation - Corporate Culture (MICC), Teilvorhaben Innovation und Expansion in der Post-Start-Up-Phase",,2008,"0,00  EUR",Fuenfwerken Design AG,,,,"Verbundprojekt: Music - Innovation - Corporate Culture (MICC), Teilvorhaben Kreativität und Flexibilität erhalten und entwickeln",,2008,"0,00  EUR",Stiftung Zollverein,,,,"Verbundprojekt: Music - Innovation - Corporate Culture (MICC), Teilvorhaben Wandel tradierter Industriekultur",,2008,"0,00  EUR",Steinbruchs-Berufsgenossenschaft,,,,"Verbundprojekt: Neue Präventionsallianzen für mehr Gesundheit in KMU der Baustoffindustrie (NeuPraG), Teilvorhaben Netzwerke, Anreize und Transfer",,2007,"564.800,00  EUR",Universität Potsdam,,,,"Verbundprojekt: Open Innovation in Life Science (OIL), Teilvorhaben Analyse und Gestaltung von Open Innovation Prozessen",,2008,"0,00  EUR",Lomapharm Rudolf Lohmann GmbH KG,,,,"Verbundprojekt: Open Innovation in Life Science (OIL), Teilvorhaben Implementierung eines offenen Innovationsprozesses bei einem mittelständischen pharmazeutischen Lohnhersteller",,2008,"0,00  EUR",Klosterfrau Berlin GmbH,,,,"Verbundprojekt: Open Innovation in Life Science (OIL), Teilvorhaben Neue Denkansätze im Life Science-Innovationsprozess für mittelständische Unternehmen ohne eigenen klassischen F & E-Bereich",,2008,"0,00  EUR",hameln rds gmbh,,,,"Verbundprojekt: Open Innovation in Life Science (OIL), Teilvorhaben Strukturierung des Innovationsprozesses in einem mittelständischen Unternehmen unter Berücksichtigung einer Holding-Zugehörigkeit",,2008,"0,00  EUR",Friedrich-Alexander-Universität Erlangen-Nürnberg,,,,"Verbundprojekt: Open-I - Open Innovation im Unternehmen, Teilvorhaben Entwicklung, Implementierung und Evaluierung eines Führungs- und Interaktionssystems für Open Innovation Communities",,2008,"0,00  EUR",Technische Universität München,,,,"Verbundprojekt: Open-I - Open Innovation im Unternehmen, Teilvorhaben Entwicklung, Implementierung und Evaluierung eines Motivations- und Kreativitätsunterstützungssystems für Open Innovation Communities",,2008,"0,00  EUR",Ludwig-Maximilians-Universität München,,,,"Verbundprojekt: PRAGDIS - Präventiver Arbeits- u. Gesundheitsschutz in diskontinuierlichen Erwerbsverläufen, Teilvorhaben Entwicklung neuerer Konzepte individueller und betrieblicher Gesundheitsprävention für Beschäftigte und FreelancerInnen in der Wissen",,2007,"0,00  EUR",Team Gesundheit Gesellschaft für Gesundheitsmanagement mbH,,,,"Verbundprojekt: PRAGDIS - Präventiver Arbeits- und Gesundheitsschutz in diskontinuierlichen Erwerbsabläufen, Teilvorhaben Praxisgerechter Einsatz innovativer Konzepte der Gesundheitsprävention für diskontinuierlich Beschäftigte in der Wissensökonomie",,2007,"0,00  EUR",Technische Universität Dortmund,,,,"Verbundprojekt: PRAGDIS - Präventiver Arbeits- und Gesundheitsschutz in diskontinuierlichen Erwerbsverläufen, Teilvorhaben Entwicklung neuer Konzepte und Methoden betrieblicher und individueller Gesundheitsprävention für Beschäftigte der Wissensökonomie",,2007,"0,00  EUR",Laupenmühlen Druck GmbH & Co. KG,,,,"Verbundprojekt: PRÄWIN - Prävention in Unternehmen der Wissensökonomie, Teilvorhaben Prävention in virtuellen Arbeitsstrukturen und Geschäftsprozessen der Medien-/IT-Branche",,2007,"0,00  EUR",Peperoni Mobile & Internet Software GmbH,,,,"Verbundprojekt: PRÄWIN - Prävention in Unternehmen der Wissensökonomie, Teilvorhaben Präventiver Arbeits- und Gesundheitsschutz in der Projektarbeit",,2007,"0,00  EUR",Universität Bremen,,,,"Verbundprojekt: PRÄWIN - Prävention in Unternehmen der Wissensökonomie, Teilvorhaben Salutogenetisches Gesundheitsmanagement und nachhaltige Arbeitsqualität",,2007,"0,00  EUR",PIXELPARK AG,,,,"Verbundprojekt: PRÄWIN - Prävention in der Wissensökonomie, Teilvorhaben Integration von Aspekten des präventiven Arbeits- und Gesundheitsschutzes in Aufbau- und Ablaufstrukturen von IT-Unternehmen",,2007,"0,00  EUR",Institut der deutschen Wirtschaft e.V.,,,,"Verbundprojekt: Produktiv und innovativ in der Metall- und Elektroindustrie mit alternden Belegschaften (PriMa), Teilvorhaben Analyse und Konzepte",,2008,"0,00  EUR",incon AG,,,,"Verbundprojekt: Produktiv und innovativ in der Metall- und Elektroindustrie mit alternden Belegschaften (PriMa), Teilvorhaben Umsetzung und Erprobung",,2008,"0,00  EUR",Fachhochschule der Diakonie FHdD gGmbH,,,,"Verbundprojekt: Produzentenstolz durch Wertschätzung (Pro-Wert), Teilvorhaben Produzentenstolz und Wertschätzung in der Pflege",,2008,"0,00  EUR",Technische Universität Dortmund,,,,"Verbundprojekt: Produzentenstolz durch Wertschätzung (Pro-Wert), Teilvorhaben Wertschätzung für Leistung, Gesundheit und Arbeitsbedingungen in sozialen Dienstleistungen",,2008,"0,00  EUR",Universität Bielefeld,,,,"Verbundprojekt: Professionalisierung der Kindertagespflege als Dienstleistung (PKDi), Teilvorhaben Untersuchungen in den Regionen Nordrhein-Westfalen und Mecklenburg-Vorpommpern",,2008,"0,00  EUR",Deutsches Jugendinstitut e.V.,,,,"Verbundprojekt: Professionalisierung der Kindertagespflege als Dienstleistung (PKDi), Teilvorhaben Untersuchungen in der Region Bayern",,2008,"0,00  EUR",Institut für Sozialwissenschaftliche Forschung e.V. (ISF),,,,"Verbundprojekt: Professionalisierung interaktiver Arbeit (PiA), Teilvorhaben Professionalisierung interaktiver Arbeit aus der Beschäftigtenperspektive",,2008,"0,00  EUR",Technische Universität Chemnitz,,,,"Verbundprojekt: Professionalisierung interaktiver Arbeit (PiA), Teilvorhaben Professionalisierung interaktiver Arbeit aus der Kundenperspektive - das Unternehmen-Kunden-Verhältnis",,2008,"0,00  EUR",Universität Augsburg,,,,"Verbundprojekt: Professionalisierung interaktiver Arbeit (PiA), Teilvorhaben Professionalisierung interaktiver Arbeit aus der Kundenperspektive - die interaktive Dienstleistungsbeziehung",,2008,"0,00  EUR",Deutsche Telekom Kundenservice GmbH,,,,"Verbundprojekt: Professionalisierung interaktiver Arbeit (PiA), Teilvorhaben Professionalisierung interaktiver Arbeit im Call Center",,2008,"0,00  EUR",AWO - Arbeiterwohlfahrt Bezirksverband Oberbayern e.V.,,,,"Verbundprojekt: Professionalisierung interaktiver Arbeit (PiA), Teilvorhaben Professionalisierung interaktiver Arbeit in der Altenpflege",,2008,"0,00  EUR",ACCOR Hotellerie Deutschland GmbH,,,,"Verbundprojekt: Professionalisierung interaktiver Arbeit (PiA), Teilvorhaben Professionalisierung interaktiver Arbeit in der Hotellerie",,2008,"0,00  EUR",Deutsche Bahn Aktiengesellschaft,,,,"Verbundprojekt: Professionalisierung interaktiver Arbeit (PiA), Teilvorhaben Professionalisierung interaktiver Arbeit und Betriebsklima im Vertrieb",,2008,"0,00  EUR",Universität zu Köln,,,,"Verbundprojekt: PräKoNet - Präventionskompetenz durch gezielte Vernetzung der Akteure, Teilvorhaben Diagnose der Präventionsreife der ITK-Unternehmen, Implementierung und Evaluierung der eingeführten Maßnahmen",,2007,"0,00  EUR",Universität Duisburg-Essen,,,,"Verbundprojekt: PräKoNet - Präventionskompetenz durch gezielte Vernetzung der Akteure, Teilvorhaben Entwicklung und Auswertung von öknomischen Bewertungen der Maßnahmen der Gesundheitsförderung in der ITK-Branche und Erarbeitung von Benchmark",,2007,"277.029,00  EUR",core business development GmbH,,,,"Verbundprojekt: PräKoNet - Präventionskompetenz durch gezielte Vernetzung der Akteure, Teilvorhaben Ganzheitliche Innovationsstrategien in den ITK-Unternehmen durch Integration der betrieblichen Gesundheitsförderung",,2007,"0,00  EUR",Berufsfortbildungswerk Gemeinnützige Bildungseinrichtung des DGB GmbH (bfw),,,,"Verbundprojekt: Präventiver Gesundheitsschutz in der IT-Branche (ITG), Teilvorhaben Entwicklung und Erprobung von Präventionskonzepten für die IT-Branche",,2007,"0,00  EUR",Rhein-Ruhr-Institut für Sozialforschung und Politikberatung e.V. (RISP) an der Universität Duisburg-Essen,,,,"Verbundprojekt: Präventiver Gesundheitsschutz in der IT-Branche, Teilvorhaben Voraussetzungen für die Implementation von Prävention in der IT-Branche",,2007,"268.000,00  EUR",Robert Bosch GmbH,,,,"Verbundprojekt: SIBIB - Strategien zur Steigerung der Innovationsfähigkeit auf Basis individueller Barrierenerlebnisse, Teilvorhaben Entwicklung von Personal und Organisationsmaßnahmen",,2007,"196.559,80  EUR",Technische Universität Berlin,,,,"Verbundprojekt: SIBIB - Strategien zur Steigerung der Innovationsfähigkeit auf Basis individueller Barrierenerlebnisse, Teilvorhaben WAB - Wissenschaftliche Analyse von Innovationsbarrieren",,2007,"421.451,00  EUR",Deutsche Stiftung für chronisch Kranke,,,,"Verbundprojekt: SITE - Schaffung eines Innovationsmilieus für Telemedizin, Teilvorhaben Anwendervernetzung und Verstetigung",,2008,"0,00  EUR",Technische Universität Berlin,,,,"Verbundprojekt: SITE - Schaffung eines Innovationsmilieus für Telemedizin, Teilvorhaben Innovationsbarrieren und Erfolgsfaktoren der Telemedizin",,2008,"0,00  EUR",VDE Verband der Elektrotechnik Elektronik Informationstechnik e.V.,,,,"Verbundprojekt: SITE - Schaffung eines Innovationsmilieus für Telemedizin, Teilvorhaben Provider Community und Standardisierung",,2008,"0,00  EUR",Charité - Universitätsmedizin Berlin,,,,"Verbundprojekt: SITE - Schaffung eines Innovationsmilieus für Telemedizin, Teilvorhaben Schaffung einer Test- und Evaluationsplattform, Initiierung eines Expertenkreises",,2008,"0,00  EUR",FESTO AG & Co. KG,,,,"Verbundprojekt: START - Schnelle Technologieadaption in Hightech-Unternehmen durch Arbeitsgestaltung und Personalentwicklung, Teilvorhaben Arbeitsprozessgestaltung für das integrierte Produkt- und Vertriebsmanagement im Neuheitenentstehungsprozess",,2008,"0,00  EUR",Fraunhofer-Gesellschaft zur Förderung der angewandten Forschung e.V. (FhG),,,,"Verbundprojekt: START - Schnelle Technologieadaption in Hightech-Unternehmen durch Arbeitsgestaltung und Personalentwicklung, Teilvorhaben Entwicklung von Unterstützungsinstrumenten für Technologieadaptionsprozesse",,2008,"0,00  EUR",Voith Turbo GmbH & Co. KG,,,,"Verbundprojekt: START - Schnelle Technologieadaption in Hightech-Unternehmen durch Arbeitsgestaltung und Personalentwicklung, Teilvorhaben Flexibles Führungs- und Wissenstransferkonzept für dezentrale Organisationseinheiten",,2008,"0,00  EUR",WITTENSTEIN AG,,,,"Verbundprojekt: START - Schnelle Technologieadaption in Hightech-Unternehmen durch Arbeitsgestaltung und Personalentwicklung, Teilvorhaben Ideen- und Innovationsmanagementsystem zur Steuerung von Markt- und Technologiediffusion",,2008,"0,00  EUR",Freie Universität Berlin,,,,"Verbundprojekt: START - Schnelle Technologieadaption in Hightech-Unternehmen durch Arbeitsgestaltung und Personalentwicklung, Teilvorhaben Neue Organisationspraktiken zur beschleunigten Integration von Technologie- und Marktimpulsen",,2008,"0,00  EUR",KSW Microtec AG,,,,"Verbundprojekt: START - Schnelle Technologieadaption in Hightech-Unternehmen durch Arbeitsgestaltung und Personalentwicklung, Teilvorhaben Verbesserte Technologieintegration durch anforderungsgerechte Konzepte der Personalentwicklung",,2008,"0,00  EUR",Fachhochschule Koblenz,,,,"Verbundprojekt: Selbstorganisation für KMU-Netzwerke zur innovativen Lösung aktueller Probleme der modernen Arbeitswelt (KMU 2.0) , Teilvorhaben Analyse und Evaluation von Motivation und Partizipation in Web 2.0-gestützten Netzwerkprozessen",,2008,"0,00  EUR",Universität Koblenz-landau Campus Koblenz,,,,"Verbundprojekt: Selbstorganisation für KMU-Netzwerke zur innovativen Lösung aktueller Probleme der modernen Arbeitswelt (KMU 2.0), Teilvorhaben Analyse und Evaluation organisatorischer Auswirkungen von Web 2.0-gestützten Netzwerkprozessen",,2008,"0,00  EUR",Wirtschaftsforum Neuwied e.V.,,,,"Verbundprojekt: Selbstorganisation für KMU-Netzwerke zur innovativen Lösung aktueller Probleme der modernen Arbeitswelt (KMU 2.0), Teilvorhaben Durchführung von Wissenstransferprozessen zwischen Wissenschaft und dem KMU-Netzwerk",,2008,"0,00  EUR",Universität Hamburg,,,,"Verbundprojekt: Selbstorganisation für KMU-Netzwerke zur innovativen Lösung aktueller Probleme der modernen Arbeitswelt (KMU 2.0), Teilvorhaben Engineering/Virtualisierung von Web 2.0-orientierten Dienstleistungen",,2008,"0,00  EUR",,,,,Engineering/Virtualisierung von Web 2.0-orientierten Dienstleistungen,,,,Technische Universität Dortmund,,,,Verbundprojekt: Selbstorganisiertes Lernen 2.0 - Teilvorhaben: Entwicklung und Umsetzung von und für Berufs-Ausbilder,,2008,"127.491,00  EUR",Innung für Elektro- und Informationstechnik Stuttgart,,,,Verbundprojekt: Selbstorganisiertes Lernen 2.0 - Teilvorhaben: Gesamtanwendung und Geschäftsmodelle,,2008,"520.534,00  EUR",Universität Stuttgart,,,,"Verbundprojekt: Selbstorganisiertes Lernen 2.0 - Teilvorhaben: Gesamtkonzept, Potenziale und Anreiz- und Steuerungssysteme selbstorganisierten Lernens",,2008,"248.891,00  EUR",Friedrich-Alexander-Universität Erlangen-Nürnberg,,,,"Verbundprojekt: ServProf - Service Professionalität lernen und leben (Metavorhaben), Teilvorhaben Blick nach Außen",,2009,"0,00  EUR",Rheinisch-Westfälische Technische Hochschule Aachen,,,,"Verbundprojekt: Smarte Innovation - Produktlebenszyklus- und wertschöpfungsübergreifende Innovationsstrategien (S-Inn), Teilvorhaben Agile Entwicklungskonzepte für Smarte Innovation",,2008,"0,00  EUR",Institut für Sozialwissenschaftliche Forschung e.V. (ISF),,,,"Verbundprojekt: Smarte Innovation - Produktlebenszyklus- und wertschöpfungsübergreifende Innovationsstrategien (S-Inn), Teilvorhaben Analyse und Konzepte für Smarte Innovation",,2008,"0,00  EUR",Industriegewerkschaft Metall,,,,"Verbundprojekt: Smarte Innovation - Produktlebenszyklus- und wertschöpfungsübergreifende Innovationsstrategien (S-Inn), Teilvorhaben Sozialverträglichkeit und Akzeptanz für gute smarte Innovation",,2008,"0,00  EUR",VDMA-Gesellschaft für Forschung und Innovation (VFI) mbH,,,,"Verbundprojekt: Smarte Innovation - Produktlebenszyklus- und wertschöpfungsübergreifende Innovationsstrategien (S-Inn), Teilvorhaben export- und zukunftsfähiger Maschinen- und Anlagenbau durch Smarte Innovation",,2008,"0,00  EUR",Universität Duisburg-Essen,,,,"Verbundprojekt: Strategische Allianzen für nachhaltige Entwicklung - Innovationen in Unternehmen durch Kooperation mit NPO's (StratAll), Teilvorhaben Aufbau, Einrichtung, Begleitung und Evaluation einer intersektoralen strategischen Allianz Metalog",,2008,"0,00  EUR",Technische Universität Darmstadt,,,,"Verbundprojekt: Strategische Allianzen für nachhaltige Entwicklung - Innovationen in Unternehmen durch Kooperation mit NPO's (StratAll), Teilvorhaben Der Mensch im Netzwerk - arbeitswissenschaftliche Instrumente für strategische Allianzen",,2008,"0,00  EUR",Trifolium-Beratungsgesellschaft mbH,,,,"Verbundprojekt: Strategische Allianzen für nachhaltige Entwicklung - Innovationen in Unternehmen durch Kooperation mit NPO's (StratAll), Teilvorhaben Managementsysteme am Beispiel regionaler Kompetenznetzwerke",,2008,"0,00  EUR",UNEP/Wuppertal Institute Collaborating Centre on Sustainable Consumption and Production gGmbH,,,,"Verbundprojekt: Strategische Allianzen für nachhaltige Entwicklung - Innovationen in Unternehmen durch Kooperation mit NPO's (StratAll), Teilvorhaben Nachhaltigkeit in Wertschöpfungsketten",,2008,"0,00  EUR","Wuppertal Institut für Klima, Umwelt, Energie GmbH",,,,"Verbundprojekt: Strategische Allianzen für nachhaltige Entwicklung - Innovationen in Unternehmen durch Kooperation mit NPO's (StratAll), Teilvorhaben Strategische Bildungsallianzen und Projektmanagement",,2008,"0,00  EUR",Fachhochschule,,,,"Verbundprojekt: THINK - Theatrale Interventionen im Innovations- und Kooperationsmanagement, Teilvorhaben Kommunikation und Verhalten im Kooperationsmanagement",,2008,"0,00  EUR",Berufsakademie Emsland e. V.,,,,"Verbundprojekt: THINK - Theatrale Interventionen im Innovations- und Kooperationsmanagement, Teilvorhaben Verhaltensbasierte Management-Prozesse und -Instrumente im Projekt- und Kooperationsmanagement",,2008,"0,00  EUR",Bildungswerk der ostwestfälisch-lippischen Wirtschaft BOW e.V.,,,,Verbundprojekt: Talentregion Ostwestfalen-Lippe. Abschlussorient. mod. Nachqualifizierung junger Erwachsener ohne Berufsabschluss in der Region OWL. Teilprojekt: Förderung der Zusammenarbeit reg. Bildungsträger zur gem. Bearbeitung der Nachqualifizierung.,,2008,"215.261,00  EUR",Fachbereich Bau im Handwerksbildungszentrum (HBZ) Brackwede,,,,Verbundprojekt: Talentregion Ostwestfalen-Lippe. Abschlussorientierte modulare Nachqualifizierung junger Erwachsener ohne Berufsabschluss in der Region OWL. Teilprojekt: Implementierung des Nachqualifizierungsansatzes in der Bauwirtschaft.,,2008,"181.719,00  EUR",Handwerkskammer Ostwestfalen-Lippe zu Bielefeld,,,,Verbundprojekt: Talentregion Ostwestfalen-Lippe. Abschlussorientierte modulare Nachqualifizierung junger Erwachsener ohne Berufsabschluss in der Region OWL. Teilprojekt: Koordination.,,2008,"596.668,00  EUR",Deutsche Gesetzliche Unfallversicherung e. V. (DGUV),,,,"Verbundprojekt: Technologieinnovation, Arbeitsorganisation, Qualifizierung, Prävention - systematisches Handlungskonzept für Produktivität und Gesundheit (TAQP), Teilvorhaben Prävention in altersgemischten Belegschaften - Umsetzung, Akzeptanz, Transfer",,2007,"776.629,00  EUR",Christliches Jugenddorfwerk Deutschlands gemeinnütziger e. V. (CJD),,,,Verbundprojekt: Unterstützung-Beratung-Information (U-B-I),,2008,"132.152,00  EUR",Fachhochschule Wiesbaden,,,,"Verbundprojekt: Wachstum lernen - lernend wachsen, Teilvorhaben Lernend wachsen - Management-Modell, Instrumente und Interventionskonzepte",,2008,"0,00  EUR",RKW Deutschland GmbH,,,,"Verbundprojekt: Wachstum lernen - lernend wachsen, Teilvorhaben Wachstum lernen - Betriebliche Pilotvorhaben, Erfahrungsaustausch und Transfer",,2008,"0,00  EUR",RKW Baden-Württemberg GmbH,,,,"Verbundprojekt: Wachstum lernen - lernend wachsen, Teilvorhaben Wachstum lernen - Betriebliche Pilotvorhaben, Erfahrungsaustausch und Transfer in der Region Baden-Württemberg",,2008,"0,00  EUR",