"Nr.p.k.","Finansējuma saņēmējs","Finansējuma saņēmēja juridiskā adrese","Projekta nosaukums","Īstenošanas vieta","Projekta apstiprināšanas datums","Darbības programmas aktivitāte","Kopsavilkums par projekta ietvaros veicamajām darbībām","Projekta kopējās attiecināmās izmaksas","Attiecināmais SF finansējums","Attiecināmais VB finansējums","Projekta īstenošanas laiks (mēn.)","Mājas lapas adrese"
1,"Dabas formu mēbeles","Jāņkalna iela 27, Alūksne, Alūksnes rajons, LV-4301","IK ""Dabas formu mēbeles"" ārējā mārketinga aktivitātes","Alūksne ",25/06/2009,"Ārējo tirgu apgūšana - ārējais mārketings","IK ''Dabas formu mēbeles'' reģistrēts Latvijas Valsts uzņēmumu reģistrā 2009.gadā. Sākot no 2004.gada bijis saimnieciskās darbības veicējs. IK ''Dabas formu mēbeles'' projektē un izgatavo unikālas mēbeles un dizaina elementus no dabiskiem materiāliem. Tiek izgatavoti kā  interjera, tā arī eksterjera priekšmeti. Starptautiskajā dizaina preču un izstrādājumu izstādē ''Tendence'', kas notiks Frankfurtē, Vācijā,  IK ''Dabas formu mēbeles''  plāno izstādīt un prezentēt DABAS FORMU GUĻAMISTABU, pievēršot izstādes apmeklētāju uzmanību Latvijas unikālajām iespējām radīt dziļi dabisku un neatkārtojamu produktu kopumu.","4,461.11","2,185.94",0,2,"www.dabasformumebeles.lv"
2,"MADARA Cosmetics","Rostokas iela 60-24, Rīga, LV-1029","SIA MADARA Cosmetics ārējo tirgu apgūšana","Rīga",23/07/2009,"Ārējo tirgu apgūšana - ārējais mārketings","2009. un 2010.gadā uzņēmums plāno realizēt vairākas ārējā mārketinga aktivitātes:
 1. Dalība starptautiskajā izstādē Natural Products Expo East 2009, kas notiks Bostonā (ASV) no 2009.gada 23.-26.septembrim. Paredzams, ka izstādē piedalīsies vairāk nekā 2100 dalībnieki. 
 2. Dalība 14.starptautiskajā izstādē Cosmoprof ASIA, kas notiks Honkongā no 2009.gada 11.-13.novembrim. Paredzams, ka izstādē piedalīsies vairāk nekā 1350 dalībnieki no 40 valstīm.
 3. Dalība 21.starptautiskajā izstādē Vivanes 2010, kas notiek izstādes BioFach 2010 ietvaros Nirnbergā (Vācijā) no 2010.gada 17. līdz 20.februārim.  Paredzams, ka izstādē piedalīsies 2744 dalībnieki no 50 valstīm.
 4.  Dalība starptautiskajā izstādē Cosmoprof Worldwide Bologna 2010, kas notiks Boloņā (Itālijā) no 2010.gada 16.-19.aprīlim. Paredzams, ka izstādē piedalīsies 2700 dalībnieki.","52,101.74","26,050.87",0,11,"www.madara-cosmetics.lv"
3,"Studija Naturals","Bruņinieku iela 47, Rīga, LV-1011","SIA ""Studija Naturals"" ārējā mārketinga aktivitātes (izstādes 2010.gadā Francijā un Itālijā)","Rīga",16/07/2009,"Ārējo tirgu apgūšana - ārējais mārketings","SIA ""STUDIJA NATURALS"" 2010. gadā SIA ""STUDIJA NATURALS"" plāno sekojošas aktivitātes: 1) dalība starptautiskajā tekstilizstrādājumu izstādē ""MAISON&OBJET""no 2010. gada 22.līdz 26. janvārim Parīzē, Francijā;
 2)dalība starptautiskajā ekstilizstrādājumu izstādē ""MAISON&OBJET"" no 2010. gada 2..līdz 7. septembrim Parīzē, Francijā;
 3) dalība starptautiskjaā dizaina un tekstilizstrādājumu izstādē ""AMBITARE IL TEMPO""2010. gada 16. līdz 20 septembrim Veronā, Itālijā","31,252.00","15,626.00",0,15,
4,"Studija Naturals","Bruņinieku iela 47, Rīga, LV-1011","SIA ""Studija Naturals"" ārējā mārketinga aktivitātes (izstādes 2009.gadā Francijā un Itālijā)","Rīga",16/07/2009,"Ārējo tirgu apgūšana - ārējais mārketings","2009.gadā SIA ""STUDIJA NATURALS"" plāno sekojošas aktivitātes:
 1)dalība starptautiskajā tekstilizstrādājumu izstādē ""MAISON&OBJET"" no 2009.gada 4. līdz 8.septembrim Parīzē, Francijā;
 2)dalība starptautiskajā dizaina un tekstilizstrādājumu izstādē ""ABITARE IL TEMPO"" no 2009.gada 17. līdz 21.septembrim Veronā, Itālijā.","18,595.00","9,297.00",0,3,"www.studio-natural.lv"
5,"TOPDESIGN BALTIKUM","Dzelzavas iela 23-24, Rīga, LV-1084","Piedalīšanās 24.starptautiskajā vieglās rūpniecības izstādē ""КИЕВ ЭКСПО СТИЛЬ 2009""","Rīga",16/07/2009,"Ārējo tirgu apgūšana - ārējais mārketings","SIA ""TOPDESIGN BALTIKUM"" jau sešus gadus nodarbojas ar virsdrēbju ražošanu. Uzņēmuma dizaineri ik sezonu izstrādā oriģinālus modeļus, kas nodrošina stabilu produkcijas noietu, tai skaitā nedaudz vairākpar 90% produkcijas tiek eksportēta. ""TOPDESIGN BALTIKUM"" ir jānodrošina esošā tirgus segmenta saglabāšana un jāapgūst ārējais tirgus ne tikai Eiropas Rietumos, bet arī Ukrainā un NVS valstīs.
 Tādēļ ir nepieciešama ārējā mārketinga aktivitāte - piedalīšanās 24.starptautiskajā vieglās rūpniecības izstādē ""КИЕВ ЭКСПО СТИЛЬ 2009"", kas notiks 17.gadskārtējā modes festivāla ""KYIV FASHION 2009"" ietvaros Kijevā no 2009.gada 23. līdz 26.septembrim.","5,268.42","2,634.21",0,3,"-"
6,"Metālists","Rūpniecības iela 14, Aizkraukle, Aizkraukles novads, Aizkraukles rajons, LV-5101","SIA ""Metālists"" ārējā mārketinga aktivitātes ","Aizkraukle",20/07/2009,"Ārējo tirgu apgūšana - ārējais mārketings","2009.gadā uzņēmums plāno veikt sekojošu mārketinga aktivitāti: dalība starptautiskā izstādē TRANSPORT&LOGISTIK 2009 (starptautiska transporta un loģistikas izstāde) - Baltkrievijā (Minskā).","8,340.30","4,003.34",0,3,"-"
7,"4 Plus","Abula iela 6b, Valmiera, Valmieras rajons, LV-4201","SIA ""4 PLUS"" ārējā mārketinga aktivitātes","Valmiera ",24/07/2009,"Ārējo tirgu apgūšana - ārējais mārketings","2009.gadā uzņēmums plāno piedalīties starptautiskajā mēbeļu komponenšu, pusfabrikātu un  aksesuāru izstādē ""ZOW ITALY 2009"", kas norisināsies no 21.oktobra līdz 24.oktobrim. SIA ""4 PLUS"" izstādē prezentēs savus apses zaru izstrādājumus mēbeļu komponentēm un pusfabrikātiem.","8,983.23","4,491.62",0,3,"www.4plus.lv"
8,"Severstaļlat","Braslas iela 24, Rīga, LV-1035","AS ""Severstaļlat"" ārējā mārketinga aktivitātes 2010.gadā","Ogre ",24/07/2009,"Ārējo tirgu apgūšana - ārējais mārketings","AS ""Severstaļlat"" 2010.gadā plāno īstenot ārvalstu tirgu apgūšanas startēģijas realizēšanu, īstenojot vairākas aktivitātes:
 1)piedalīties 5 metālapstrādes un būvniecības nozares starptautiskās izstādes - ""Resta 2010"" Lietuvā, ""Tubes 2010"" Vācijā, ""Finnbuild 2010"" Somijā, Alihankinta 2010"" Somijā, ""Elmia Subcontractor 2010"" Zviedrijā;
 2)piedalīties 13 biedrības ""Metāls un inovācijas"" organizētās kontaktbiržās - konferences ""Steel Market Focus"" ietvaros Šveicē, konferences ""CIS Metal Summit"" ietvarps Krievijā, konferences ""Eurometal General Assambly"" ietvaros Beļģijā, konferences ""CRU's World Steel Conference"" ietvaros Austrijā, konferences ""Турецкая металлургическая конференция"" ietvaros Turcijā, izstādes ""Wire/Tube Russia 2010"" ietvaros Krievijā, konferences ""EU Steel Forum"" ietvaros Spānijā, konferences ""Mеталл CHГ"" ietvaros Krievijā, konferences ""Steel Business Briefing Steel markets Europe 2010"" ietvaros Vācijā, konferences ""15th Galvanizing&Coil Coating Conference"" ietvaros Spānijā, konferences ""8-й ежеогодный семинар ""Прогноз цен на металлопрокат трубы и лом в 2011 году"" maskava ietvaros Krievijā, konferences ""Ринки металлургического сырья 2010"" ietvaros Ukrainā, konferences ""Steel success strategies"" ietvaros Francijā.
 Mārketinga aktivitātes ārvalstu tirgos sekmēs komercsabiedrības izaugsmi un produkcijas eksportspējas palielināšanos.","98,950.00","49,475.00",0,12,"www.ssl.lv"
9,"Horus Laboratory","Vīlandes 6-1, Rīga, LV-1010","SIA ""Horus Laboratory"" ārējā mārketinga aktivitātes","Rīga",24/07/2009,"Ārējo tirgu apgūšana - ārējais mārketings","SIA ""Horus Laboratory"" ir dibināts 2007. gadā un lai veicinātu aerotermogrāfijas pakalpojumu eksportu uzņēmums plāno piedalīties izstādēs Eiropas Savienībā.","4,168.46","2,084.23",0,3,"www.horuslab.eu"
10,"TOPDESIGN BALTIKUM","Dzelzavas iela 23-24, Rīga, LV-1084","Piedalīšanās starptautiskajā izstādē ""ТЕКСТИЛЬЛЕГПРОМ"" Maskavā.","Rīga",16/07/2009,"Ārējo tirgu apgūšana - ārējais mārketings","""TOPDESIGN BALTIKUM"" ir jānodrošina esošā tirgus segmenta saglabāšana un jāapgūst Krievijas un citu valstu tirgus ne tikai Eiropas Rietumos. Tādēļ ir nepieciešama ārējā mārketinga aktivitāte - piedalīšanās starptautiskajā gadskārtējā izstādē ""ТЕКСТИЛЬЛЕГПРОМ"", kas jau sešpadsmito gadu ir viena no lielākajām un par labāko atzītākā izstāde. 2009.gada izstāde notiks laikā no 22. līdz 25.septembrim.","8,751.00","4,375.50",0,2,"-"
11,"TOASTERS","Lambertu iela 34, Mārupes novads, LV-2167","SIA ""TOASTERS"" ārējā mārketinga aktivitātes Vācijas tirgū","Mārupes novads",24/07/2009,"Ārējo tirgu apgūšana - ārējais mārketings","2010.gadā uzņēmums plāno piedalīties starptautiskajā Frankfurtes mese ""AMBIENTE"", kas notiks Frankfurtē pie Mainas. Izstādes norisēs no 12.-16.februārim 2010.gadā. 2009.gadā izstādē piedalījās 4466 dalībnieki no 86 valstīm. Šī ir lielākā un nozīmīgākā Vācijas reģiona interjera preču izstāde.
 Izstādes ietvaros plānojam prezentēt mūsu inovatīvās Tears Off modulārās tapetes jaunos dizainus, kā arī Baltijas mākslinieku tapešu kolekciju.
 Jaunais produkts ir inovācija tapešu jomā un ir augstu novērtēts jomas nozīmīgākajā dizaina izdevumā ""ID Magazine"" Ņujorkā, kā 2008.gada Labākais jaunais produkts. Kā arī 2009.gadā ieguva pašmāju prestižo ""ADWARDS"" Zelta godalgu industriālā dizaina kategorijā un 1.vietu žurnālA ""DEKO"" rīkotajā rūpnieciskā dizaina konkursā.","11,854.40","5,927.20",0,7,"www.znak-life.com"
12,"COCOCUT","Akmeņu iela 47, Ogre, Ogres novads, LV-5001","SIA ''COCOCUT'' tiešās vizītes pie sadarbības partneriem ārvalstīs","Ogre",24/07/2009,"Ārējo tirgu apgūšana - ārējais mārketings","SIA Cococut dibināts 2008.gadā, lai izstrādātu, ražotu un pārdotu jaunu, inovatīvu produktu kokosriekstu atvēršanai COCOCUT. Paredzēts to izplatīt Eiropas un ASV tirgos, tādēļ 2009.gadā uzņēmums paredzējis veikt tirgus izpēti vairākās valstīs. 
 SIA Cococut paredz tiešās vizītes pie potenciālajiem sadarbības partneriem Vācijā, Lielbritānijā, Spānijā, ASV, Norvēģijā un Turcijā.
 ","7,870.00","3,935.00",0,4,"-"
13,"Baldones veselības fonds- FG","Bieķensalas iela 3, Rīga, LV-1004","SIA ""Baldones veselības fonds- FG"" ārējā mārketinga aktivitātes - dalība starptautiskajās izstādēs Cosmeeting 2009, Francija, InterCHARM, Krievija un Cosmoprof Asia, Ķīna","Rīga",24/07/2009,"Ārējo tirgu apgūšana - ārējais mārketings","2009.gadā uzņēmums plāno piedalīties trīs starptautiskās kosmētikas industrijas izstādēs, piedāvājot savu ražoto produkciju trīs dažādos noieta tirgos.
 Pirmā izstāde - Cosmeeting (Beyond Beauty Paris ietvaros) Francijā, Parīzē. Eiropas skaistumkopšanas izstāde aptver dažādus skaistumkopšanas nozares sektorus un tajā piedalās nozares uzņēmumu pārtsāvji, preču importētāji, izplatītāji un ražotāji, kas ļaus SIA ''Baldones veselības fonds - FG'' popularizēt savu produkciju Eiropas tirgū.
 Otra izstāde InterCHARM norisināsies Krievijā, Maskavā. Izstāde tiek uzskatīta par nozīmīgāko skaistuma nozares pasākumu Krievijā. Tādējādi SIA ''Baldones veselības fonds - FG'' būs iespēja iegūt jaunus kontaktus Krievijas un apkārtējo valstu tirgū.
 Kā trešo uzņēmums plāno apmeklēt Cosmoprof Asia izstādi Ķīnā, Honkongā. Izstāde uzskatāma par nozares svarīgāko business-to-business forumu Āzijas Klusajā reģionā, kurā tiek pārstāvēti visi skaistumkopšanas nozares sektori. SIA ''Baldones veselības fonds - FG'' piedaloties šajā izstādē dibinās kontaktus, veicinot produkcijas noietu Āzijas tirgū.","36,155.00","18,077.50",0,3,"-"
14,"JZ Microphones","Gaujas iela 30, Mārupes novads, LV-2167","JZM911","Mārupes novads",24/07/2009,"Ārējo tirgu apgūšana - ārējais mārketings","SIA „JZ Microphones” plāno piedalīties starptautiskā mūzikas instrumentu un skaņu tehnikas produktu izstādēs: 
 1.127th AES Convention, (09.-12.10.2009), Ņujorka, ASV – Audio Engineering izstāde pulcē industrijas augstākā līmeņa profesionāļus – inženierus, ražotājus, zinātniekus, kā arī entuziastus, kas lielāko daļu laika velta ar profesionālās skaņu industriju saistītās nodarbēs. AES Conventions vienīgie pasaulē organizē izstādes, kas veltītas tikai un vienīgi profesionālajai audio industrijai. AES ir visjaunākās iespējamās informācijas avots un tā ir lielākā profesionālā audio industrijas konvencija pasaulē katru gadu pulcinot ap 20000 augstākā profesionālā līmeņa apmeklētājus;
 2.NAMM Show, (13.-16.01.2010., Anaheima, ASV) – NAMM Show ir lielākā skaņu tehnikas produktu izstāde ASV, kas ik gadus pulcē vairāk kā 1500 dalībniekus un 80 000 apmeklētājus. Izstādē iespējams satikt visplašākā diapazona apmeklētājus – sākot no mūzikas studenta līdz skaņu ierakstu studiju tehniskajiem direktoriem – tādējādi radot maksimāli lielu publicitāti uzņēmuma piedāvātajai produkcijai un maksimāli palielinot eksporta apjomus;
 3.Prolight+Sound (24.-27.03.2010., Frankfurte, Vācija) – ProLight+Sound ir viena no lielākajām industrijas izstādēm Eiropā pulcinot vairāk kā 800 dalībniekus un 30 000 apmeklētāju no vairāk kā 100 dažādām valstīm. Izstādē iespējams satikt visplašākā diapazona apmeklētājus – sākot no mūzikas studenta līdz skaņu ierakstu studiju tehniskajiem direktoriem – tādējādi radot maksimāli lielu publicitāti uzņēmuma piedāvātajai produkcijai un maksimāli palielinot eksporta apjomus;
 4.129th AES Convention, (Rudens 2010., ASV) – Audio Engineering Society izstāde pulcē industrijas augstākā līmeņa profesionāļus – inženieruvisjaunākās iespējamās informācijas avots un tā ir lielākā profesionālā audio industrijas konvencija pasaulē katru gadu pulcinot ap 20000 augstākā profesionālā līmeņa apmeklētājus. Skaidrojam: šī ir ikgadēja izstāde, kas 2010.gadā notiks jau 129. reizi. Precīzi izstādes datumi vēl nav zināmi, bet tos darīsim zināmus tiklīdz tie būs pieejami no izstādes organizētājiem;
 5.NAMM Show, (13.-16.01.2011., Anaheima, ASV) – NAMM Show ir lielākā skaū tehnikas produktu izstāde ASV, kas ik gadus pulcē vairāk kā 1500 dalībniekus un 80000 apmeklētājus. Izstādē iespējams satikt visplašākā diapazona apmeklētājus – sākot no mūzikas studenta līdz skaņu ierakstu studiju tehniskajiem direktoriem – tādējādi radot maksimāli lielu publicitāti uzņēmuma piedāvātajai produkcijai un maksimāli palielinot eksporta apjomus;
 6.Prolight+Sound (Marts 2011., Frankfurte, Vācija) – ProLight+Sound ir viena no lielākajām industrijas izstādēm Eiropā pulcinot vairāk kā 800 dalībniekus un 30000 apmeklētāju no vairāk kā 100 dažādām valstīm. Izstādē iespējams satikt visplašākā diapazona apmeklētājus– sākot no mūzikas studenta līdz skaņu ierakstu studiju tehniskajiem direktoriem – tādējādi radot maksimāli lielu publicitāti uzņēmuma piedāvātajai produkcijai un maksimāli palielinot eksporta apjomus. Skaidrojam: šī ir ikgadēja izstāde, kas norisinās marta mēnesī Frankfurtē. Precīzi izstādes datumi vēl nav zināmi, bet tos darīsim zināmus tiklīdz tie būs pieejami no izstādes organizētājiem.
 ","118,000.00","59,000.00",0,20,"www.jzmic.com"
15,"SKAN- TOOLING","Krūzes iela 2c, Rīga, LV-1046","SIA SKAN- TOOLING dalība starptautiskajā izstādē K2010","Rīga",15/07/2009,"Ārējo tirgu apgūšana - ārējais mārketings","Uzņēmums SKAN-TOOLING ir dibināts un uzsācis aktīvu darbību 1996.gadā. Uzņēmuma ražošanas un administratīvā ēka Rīgā. SIA SKAN-TOOLING ir SIA  ""Rolands Moisejs"" meitas uzņēmums.
 Regulāri ir veikta SKAN-TOOLING ražošanas modernizācija, šobrīd uzņēmums ir viens no mūsdienīgākajiem ražošanas centriem, kas atbilst visiem Eiropas standartiem, ar unikālu konstruktoru apakšnodaļu un vairāk kā 50 cilvēku lielu kolektīvu. SIA SKAN-TOOLING galvenā darbība ir augstas kvalitātes un sarežģītības presformu izgatavošana.
 2010.gadā plānojam paplašināt savu pozīciju Vācijas tirgū un piedalīties starptautiskajā presformu ražošanas, plastmasas un gumijas produktu izstrādes izstādē ""K 2010"", kas notiks 27.10.2010 - 03.11.2010 Diseldorfā.","14,649.71","7,324.85",0,15,"www.skantooling.lv"
16,"Trakais Rotors","Akmeņu iela 47, Ogre, Ogres novads, LV-5001","SIA ''Trakais Rotors'' ārējā mārketinga aktivitātes","Ogre",24/07/2009,"Ārējo tirgu apgūšana - ārējais mārketings","2009.gadā uzņēmums plāno vairākas ārējā mārketinga aktivitātes:
 1) tiešā vizīte (organizē LIAA) pie Vācijas uzņēmumiem 2009.gada jūlija sākumā, kuras mērķis ir izveidot pozitīvus tirdzniecības kontaktus tādējādi uzlabojot Latvijas eksporta bilanci.
 2)  tiešā vizīte (organizē LIAA) pie Spānijas uzņēmumiem 2009.gada jūlija otrajā pusē, kuras mērķis ir izveidot pozitīvus tirdzniecības kontaktus tādējādi uzlabojot Latvijas eksporta bilanci.
 3) tiešā vizīte (organizē LIAA) pie ASV uzņēmumiem 2009.gada augustā, kuras mērķis ir izveidot pozitīvus tirdzniecības kontaktus tādējādi uzlabojot Latvijas eksporta bilanci.
 4) tiešā vizīte (organizē LIAA) pie Lielbritānijas uzņēmumiem 2009.gada septembrī, kuras mērķis ir izveidot pozitīvus tirdzniecības kontaktus tādējādi uzlabojot Latvijas eksporta bilanci.
 5) tiešā vizīte (organizē LIAA) pie Turcijas uzņēmumiem 2009.gada oktobrī, kuras mērķis ir izveidot pozitīvus tirdzniecības kontaktus tādējādi uzlabojot Latvijas eksporta bilanci.
 6) tiešā vizīte (organizē LIAA) pie Norvēģijas uzņēmumiem 2009.gada decembrī, kuras mērķis ir izveidot pozitīvus tirdzniecības kontaktus tādējādi uzlabojot Latvijas eksporta bilanci.","5,777.00","2,888.50",0,5,"-"
17,"TVA","Ganību dambis 36 - 309, Rīga, LV-1005","Dalība 15.starptautiskajā izstādē TRANSTRUSSIA 2010","Rīga",20/07/2009,"Ārējo tirgu apgūšana - ārējais mārketings","2010.gadā SIA ""TVA"" plāno piedalīties 15.starptautiskajā kravu pārvadājumu, transporta un loģistikas izstādē TRANSRUSSIA 2010, 27. - 30.aprīlī, 2010, Maskavā. Šī izstāde tiek organizēta jau kopš 1996.gada un uz doto brīdi ir atzīta par notikumu Nr.1 kravu pārvadājumu industrijā. Apmeklētāju vidū ir pārstāvji gan no Krievijas (no 380 Krievijas pilsētām), gan no Baltkrievijas, Ukrainas, lietuvas, kā arī Somijas un Vācijas.","22,260.91","11,108.19",0,2,"www.tva.lv"
18,"VEF Radiotehnika RRR","Kurzemes prospekts 3, Rīga, LV-1067","AS ""VEF Radiotehnika RRR"" ārējā mārketinga aktivitātes (starptautiska izstāde 2010.gada janvārī ASV)","Rīga",24/07/2009,"Ārējo tirgu apgūšana - ārējais mārketings","2009. un 2010.gadā uzņēmums plāno vairākas ārējā mārketinga aktivitātes:
 1)starptautiskās izstādes International CES, 7.-10.janvārī, 2010, Las Vegasā, ASV apmeklējums. izstādē piedalīsies sadzīves elektronikas ražotāji no visas pasaules. A/s ""VEF Radiotehnika RRR"" plāno nodibināt kontaktus ar potenciālajiem klientiem un sadarbības partneriem sadzīves elektronikas ražošanas jomā, kas ļaus palielināt šo izstrādājumu eksportu no Latvijas uz ārvalstīm.","12,899.24","6,449.62",0,5,"www.rrr.lv"
19,"IRF ""LANGA""","Vienības gatve 200-1, Rīga, LV-1058","IRF ""LANGA"" SIA ārējā mārketinga aktivitāšu programma 2009.gadā","Rīga",24/07/2009,"Ārējo tirgu apgūšana - ārējais mārketings","Atbilstoši uzņēmuma mārketinga stratēģijā izvirzītajam mērķim - palielināt uzņēmuma produkcijas eksporta apjomus, SIA ""LANGA"" plāno 2009.gadā īstenot ārējā mārketinga attīstības projektu, piedaloties specializētajās iepakojuma izstādēs. Projekta ietvaros uzņēmums plāno vairākas ārējā mārketinga aktivitātes:
 1) dalība starptautiskajā iepakojuma tehnoloģiju izstādē ""FachPack-2009"" (29.09.2009. - 01.10.2009., Nirnberga, Vācija);
 2) dalība starptautiskajā iepakojumu izstādē ""Scanpack-2009"" (20.10.209. - 23.10.2009., Gēteborga, Zviedrija).","29,060.32","13,948.95",0,2,"www.langa.lv"
20,"FILTRI","Baltā iela 7, Rīga, LV-1055","SIA ""FILTRI"" ārējo tirgu apgūšana","Rīga",24/07/2009,"Ārējo tirgu apgūšana - ārējais mārketings",,"3,121.26","1,529.41",0,5,"www.filtri.lv"
21,"Asociācija ""Latvijas Mēbeles""","Skaistkalnes iela 1, Rīga, LV-1004","Asociācijas ""Latvijas Mēbeles"" uzņēmumu dalība mēbeļu izstādē Stokholmā","Rīga",24/07/2009,"Ārējo tirgu apgūšana - ārējais mārketings","Paredzēts piedalīties Stokholmas starptautiskajā mēbeļu izstādē ''Stockholm Furniture Fair'' Zviedrijā, ar Latvijas mēbeļu ražotāju uzņēmumiem 2010.gadā no 09.-13.februārim.","50,233.64","25,116.82",0,5,"www.latvianwood.lv"
22,"Avantis Promo","Mēness iela 4, Rīga, LV-1013","SIA ""Avantis promo"" dalība starptautiskās izstādēs","Rīga",24/07/2009,"Ārējo tirgu apgūšana - ārējais mārketings","Projekta ietvaros plānots piedalīties šādās kino un mūzikas izstādēs - festivālos:
 1) ""Leipzig Dok festival"", 2009.gada 26.oktobris - 1.novembris, Leipciga, Vācija;
 2) IDFA, 2009.gada 19.-29.novembris, Amsterdama, Nīderlande;
 3) Sundance, 2010.gada 15.-25.februāris, ASV, Park City, Salt Lake City, Ogden un Sundance, Utah;
 4) Berlinale 2010.gada 11.-21.februāris, Berlīne, Vācija;
 5) 11th HOT Docs, Toronto Documentary Forum, 2010.gada 6.-7.maijs, Toronto, Kanāda.
 ","31,020.00","15,510.00",0,8,"www.avantis.lv"
23,"EHT Dizains","Vienības gatve 100-6, Rīga, LV-1002","Sabiedrības ar ierobežotu atbildību ""EHT Dizains"" ārējā mārketinga aktivitātes","Rīga",24/07/2009,"Ārējo tirgu apgūšana - ārējais mārketings","2009.gadā uzņēmums plāno vairākas ārējā mārketinga aktivitātes:
 1) Jaunajam elektroniski vadāmajam tabakas izstrādājumu mazumtirdzniecības stendam veltītas tīmekļa vietnes izstrādne
 2) British American Tobacco, Globe House, 4 Temple Place, London, Greater London WC2R2PG, Apvienotā Karaliste, Reģistrācijas nr. 002331122009;
 3) ARNO GB Ltd, Victorian House, Coronation Road, Bristol BS3 1AA, reģistrācijas nr. 1385669;
 4) JT International, 1, rue de la Gabelle, 1211 Geneva 26, Switzerland;
 5) Philip Morris GmbH, Fallastraße 40, 81369 München, Vācija.
 Vizīšu ietvaros paredzēts vienoties par SIA ''EHT Dizains'' ražoto tabakas izstrādājumu mazumtirdzniecības stendu piegādēm minētajiem uzņēmumiem 2009. un 2010.gadā.","14,585.76","7,292.88",0,5,"www.eht-dizains.lv"
24,"Autonams","Skanstes iela 9A, Rīga, LV-1013","SIA ""Autonams"" dalība starptautiskajā tehnoloģiju izstādē CEBIT 2010 Hannoverē, Vācijā","Rīga",24/07/2009,"Ārējo tirgu apgūšana - ārējais mārketings","SIA ""Autonams"" plāno piedalīties iztādē CeBIT 2010 Vācijā, Hannoverē.
 Izstādē CeBIT 2010 SIA ""Autonams"" prezentēs 2008.gadā izstrādātos un 2009.gadā pilnveidotos dalītos maršruta kontroles sistēmas produkts. Šo produktu izstrādē SIA ""Autonams"" 2008.gadā ir investējis 340 000 EUR. Kā arī prezentēsim jaunās 2009.gadā izstrādātās tehnoloģijas.","27,967.63","13,983.81",0,5,"www.autonams.lv"
25,"Autonams","Skanstes iela 9A, Rīga, LV-1013","SIA ""Autonams"" dalība straptautiskajā autoelektronikas izstādē ""Automechanika 2010"" Vācijā, Frankfurtē, 2010.gada septembrī","Rīga",24/07/2009,"Ārējo tirgu apgūšana - ārējais mārketings","Izstādē ""Automechanika 2010"" SIA ""Autonams"" prezentēs 2008.gadā izstrādātos un 2009.gadā pilnveidotos dalītos maršruta kontroles sistēmas produktus, kas ir pilnīgi jauni un inovatīvi produkti šajā produktu grupā pasaulē. Šo produktu izstādē SIA ""Autonams"" 2008.gadā ir investējis 340 000 EUR.
 2010.gadā SIA ""Autonams"" plāno piedalīties starptautiskajā tehnoloģiju izstādē ""Automechanika"" Frankfurtē, Vācijā. Izstāde ""Automechanika"" ir lielākā ar automašīnu elektroniku saistītā tehnoloģiju izstāde pasaulē un dalība šajā izstādē palīdzētu atrast jaunus SIA ""Autonams"" produkcijas noieta tirgus pasaulē.","24,995.73","12,497.86",0,13,"www.autonams.lv"
