24,"Saldus novada pašvaldības aģentūra ""Sociālais dienests""","Dzirnavu iela 1, Saldus","Saldus pilsētas sociālās dzīvojamās mājas energoefektivitātes paaugstināšana","Saldus pilsēta",06/02/09,"Sociālo dzīvojamo māju siltumnoturības uzlabošanas pasākumi","Mājoklis ir galvenais cilvēka dzīves darbībai un eksistencei nepieciešamās vides
nodrošinājums. Valsts stratēģiskais ietvardokuments nosaka, ka sakārtots, pieejams un pievilcīgs mājoklis ir viens no dzīves kvalitātes un pievilcīgas dzīves vides faktoriem, kas sekmē cilvēku piesaisti reģionam. Savukārt cilvēkresursu koncentrēšanās noteiktās teritorijās ir viens no pamata priekšnosacījumiem reģiona izaugsmes nodrošināšanai.
 Adekvātu mājokļu pieejamība ir ļoti svarīga, īpaši cilvēkiem, kuru ienākumi neļauj pilnā mērā norēķināties par dzīvojamās platības īri un komunālajiem pakalpojumiem. Sociālie mājokļi tiek veidoti saskaņā ar likumu „Par sociāliem dzīvokļiem un sociālām dzīvojamām mājām” un paredzēti iedzīvotājiem ar zemiem ienākumiem. Sociālo dzīvojamo māju uzturēšanu un apsaimniekošanu finansē no šim nolūkam paredzētiem pašvaldības budžeta līdzekļiem – tie ir nepietiekami, lai veiktu apjomīgus energoefektivitātes paaugstināšanas un ēkas renovācijas darbus. Saldus pilsētas pašvaldībā ir viena sociālā dzīvojamā māja – Celtnieku ielā 2a, kurā dzīvo 22 maznodrošināti vientuļie pensionāri. 2004. gadā veikta ēkas rekonstrukcija, tomēr, finansu līdzekļu trūkuma dēļ, ēkā nav veikti visi nepieciešamie energoefektivitātes pasākumi. 
2008. gada maijā, veicot ēkas energoauditu, tika konstatēti būtiskākie trūkumi un izstrādāts pasākumu komplekss mājokļa energoefektivitātes paaugstināšanai. Lai uzlabotu sociālās mājas iedzīvotāju dzīves vidi un samazinātu pašvaldības izdevumus par sociālā mājokļa uzturēšanu, projekta ietvaros plānots:
saremontēt un nosiltināt bēniņu pārsegumu; siltumizolēt bēniņu lūkas; nomainīt ēkas jumta segumu;
uzlabot ventilācijas sistēmu;
samazināt siltumenerģijas zudumus kāpņutelpās – izbūvēt vējtverus, nomainīt durvis;
nosiltināt ēkas dienvidrietumu fasādes pamatus;
siltumizolēt caurules un armatūru siltummezglā;
izstrādāt un ieviest ēkai piemērotu apkures regulēšanas metodiku; uzstādīt sildķermeņiem automātiskos termoregulatorus.
Sociālās mājas pilnvērtīgas darbības nodrošināšanai un iedzīvotāju drošībai par pašvaldības līdzekļiem plānots uzstādīt LR būvnormatīvu prasībām atbilstošas ārējās evakuācijas kāpnes
Projektā plānoto aktivitāšu īstenošanai paredzēts izmantot kvalitatīvus un videi draudzīgus būvniecības materiālus. Projekta rezultātā tiks nodrošināts energoresursu ietaupījums un to efektīvāka izmantošana (energoefektivitāte paaugstināsies aptuveni par 22.7 %), kas savukārt samazinās CO2 emisijas, tā sekmējot vides kvalitātes paaugstināšanos un dabas resursu ekonomiju. 
Projekta mērķgrupa ir sociāli mazaizsargātie Saldus pilsētas iedzīvotāji – maznodrošinātie, pensionāri, invalīdi. Īstenojot projektu, tiks uzlaboti sociālās mājas iedzīvotāju dzīves apstākļi. Neieguldot līdzekļus ēkas energoefektivitātes paaugstināšanā, proporcionāli siltumenerģijas tarifu pieaugumam, paaugstināsies iedzīvotāju maksājumi par siltumenerģiju, daļa ēkas konstrukciju turpinās strauji nolietoties mitruma iespaidā, palielināsies mājokļa apsaimniekošanas izmaksas. ","55 827.34","41 870.50","4 187.05","9 769.79","6 mēneši","Vēl nav iesniegta informācija"
