"Denominazione del Beneficiario","Titolo del Progetto","Comune","Anno di assegnazione del contributo pubbico","Contributo Pubblico Assegnato (Fesr+Stato+Regione)"
"Pianvallico SpA","Centro per servizi alle imprese e laboratori","Scarperia",2009,814341
"Comune di Cavriglia","Centro di eccellenza per l'innovazione e lo sviluppo di 
impresa","Cavriglia",2009,434127
"Consorzio Arezzo Innovazione ","Realizzazione di struttura plurifunzionale al servizio 
delle imprese","Subbiano",2009,635730
"Comune di Sorano","Realizzazione Centro Servizi in Area PIP in S. Quirico","Sorano",2009,212000
