nr_crt,titlu_proiect,nume_beneficiar,nume_operatiune,fonduri_ue,buget_national,contributie_beneficiar,cheltuieli_neeligibile,total_valoare_proiect,currency,uri
440,INFIINTAREA SECRETARIATUL TEHNIC PERMANENT AL PACTULUI REGIONAL PENTRU OCUPARE SI INCLUZIUNE SOCIALA IN REGIUNEA CENTRU,UNIVERSITATEA ROMANO- GERMANA DIN SIBIU,Axa Prioritară 3/ DMI 3.3. Dezvoltarea parteneriatelor şi încurajarea iniţiativelor pentru partenerii sociali şi societatea civilă,1.525.395,430.239,40.698,38.589,2.034.921,LEI,http://localhost:9999/Lista_contractate_POS_DRU_30_aprilie_2010.pdf
441,LIDERO - Noi competente sociale pentru delegatii sindicali,Confederaţia Naţională Sindicală ”Cartel ALFA”,Axa Prioritară 3/ DMI 3.3. Dezvoltarea parteneriatelor şi încurajarea iniţiativelor pentru partenerii sociali şi societatea civilă,10.323.284,2.911.695,270.110,30.000,13.535.089,LEI,http://localhost:9999/Lista_contractate_POS_DRU_30_aprilie_2010.pdf
442,Birouri de asistenta pentru promovarea Responsabilitatii Sociale a Intreprinderilor,Camera de Comert si Industrie a Romaniei,Axa Prioritară 3/ DMI 3.3. Dezvoltarea parteneriatelor şi încurajarea iniţiativelor pentru partenerii sociali şi societatea civilă,4.626.269,1.304.845,121.043,386.616,6.438.773,LEI,http://localhost:9999/Lista_contractate_POS_DRU_30_aprilie_2010.pdf
443,Consolidarea capacitatii partenerilor sociali de a promova Formarea Profesionala Continua si dialogul social in sectorul metalurgic - CONFORM,Federatia Sindicala a Siderurgistilor METAROM,Axa Prioritară 3/ DMI 3.3. Dezvoltarea parteneriatelor şi încurajarea iniţiativelor pentru partenerii sociali şi societatea civilă,381.225,107.525,9.974,0,498.724,LEI,http://localhost:9999/Lista_contractate_POS_DRU_30_aprilie_2010.pdf
444,Iniţiative ale partenerilor sociali,Romaero,Axa Prioritară 3/ DMI 3.3. Dezvoltarea parteneriatelor şi încurajarea iniţiativelor pentru partenerii sociali şi societatea civilă,1.300.564,366.826,34.028,0,1.701.418,LEI,http://localhost:9999/Lista_contractate_POS_DRU_30_aprilie_2010.pdf
445,Iniţiative ale partenerilor sociali din regiunea Nord Est,SINDICATUL PROMETEU,Axa Prioritară 3/ DMI 3.3. Dezvoltarea parteneriatelor şi încurajarea iniţiativelor pentru partenerii sociali şi societatea civilă,1.273.260,359.125,33.314,0,1.665.699,LEI,http://localhost:9999/Lista_contractate_POS_DRU_30_aprilie_2010.pdf
446,Îmbunătăţirea calităţii profesionale a partenerului social,Federatia Sindicala Automobilul Romanesc,Axa Prioritară 3/ DMI 3.3. Dezvoltarea parteneriatelor şi încurajarea iniţiativelor pentru partenerii sociali şi societatea civilă,1.267.999,357.641,33.176,0,1.658.816,LEI,http://localhost:9999/Lista_contractate_POS_DRU_30_aprilie_2010.pdf
447,“De la informatie la parteneriat” - Formare pentru intarirea capacitatii de monitorizare si participare la procesul decizional,"Asociatia ""Institutul Roman de Training""",Axa Prioritară 3/ DMI 3.3. Dezvoltarea parteneriatelor şi încurajarea iniţiativelor pentru partenerii sociali şi societatea civilă,477.658,134.724,12.502,22.578,647.462,LEI,http://localhost:9999/Lista_contractate_POS_DRU_30_aprilie_2010.pdf
448,Implicare activa in piata muncii a sindicatelor,Filiala Judeteana BNS Constanta,Axa Prioritară 3/ DMI 3.3. Dezvoltarea parteneriatelor şi încurajarea iniţiativelor pentru partenerii sociali şi societatea civilă,1.408.135,397.166,36.843,0,1.842.144,LEI,http://localhost:9999/Lista_contractate_POS_DRU_30_aprilie_2010.pdf
449,CONSOLIDAREA CAPACITATII INSTITUTIONALE A CONSORTIUL REGIONAL AL REGIUNII DE DEZVOLTARE BUCURESTI – ILFOV (CRBI),Universitatea din Bucuresti,Axa Prioritară 3/ DMI 3.3. Dezvoltarea parteneriatelor şi încurajarea iniţiativelor pentru partenerii sociali şi societatea civilă,1.397.996,394.306,35.122,0,1.827.424,LEI,http://localhost:9999/Lista_contractate_POS_DRU_30_aprilie_2010.pdf
450,CONSOLIDAREA CAPACITATII INSTITUTIONALE A CONSORTIULUI REGIONAL,Universitatea Politehnica Timisoara,Axa Prioritară 3/ DMI 3.3. Dezvoltarea parteneriatelor şi încurajarea iniţiativelor pentru partenerii sociali şi societatea civilă,1.361.926,384.133,37.000,0,1.783.059,LEI,http://localhost:9999/Lista_contractate_POS_DRU_30_aprilie_2010.pdf
451,Sindicate active,SINDICATUL LIBER SC CUGIR SA,Axa Prioritară 3/ DMI 3.3. Dezvoltarea parteneriatelor şi încurajarea iniţiativelor pentru partenerii sociali şi societatea civilă,1.406.851,396.804,36.575,0,1.840.230,LEI,http://localhost:9999/Lista_contractate_POS_DRU_30_aprilie_2010.pdf
452,Intarirea capacitatii societatii civile de a promova initiative pentru incluziune sociala,Asociatia Nationala a Birourilor de Consiliere pentru Cetateni,Axa Prioritară 3/ DMI 3.3. Dezvoltarea parteneriatelor şi încurajarea iniţiativelor pentru partenerii sociali şi societatea civilă,1.282.432,361.712,33.554,158.459,1.836.156,LEI,http://localhost:9999/Lista_contractate_POS_DRU_30_aprilie_2010.pdf
453,“Retea Teritoriala de Furnizori Crestini de Servicii Sociale - Parteneri strategici in domeniul incluziunii sociale”,"FUNDATIA ""ORGANIZATIA INTERNATIONALA DE CARITATE CRESTIN ORTODOXA""",Axa Prioritară 3/ DMI 3.3. Dezvoltarea parteneriatelor şi încurajarea iniţiativelor pentru partenerii sociali şi societatea civilă,3.475.829,980.362,90.942,222.919,4.770.052,LEI,http://localhost:9999/Lista_contractate_POS_DRU_30_aprilie_2010.pdf
454,Biroul pentru observarea pietei muncii si a calitatii locurilor de munca,Blocul National Sindical,Axa Prioritară 3/ DMI 3.3. Dezvoltarea parteneriatelor şi încurajarea iniţiativelor pentru partenerii sociali şi societatea civilă,10.538.858,2.972.498,275.742,0,13.787.098,LEI,http://localhost:9999/Lista_contractate_POS_DRU_30_aprilie_2010.pdf
455,Model de armonizare a practicilor in domeniul managementului financiar al proiectelor finantate prin FSE,UNIVERSITATEA BABES BOLYAI - FACULTATEA DE STIINTE ECONOMICE SI GESTIUNEA AFACERILOR,Axa Prioritară 3/ DMI 3.3. Dezvoltarea parteneriatelor şi încurajarea iniţiativelor pentru partenerii sociali şi societatea civilă,1.381.705,389.712,36.152,40.857,1.848.426,LEI,http://localhost:9999/Lista_contractate_POS_DRU_30_aprilie_2010.pdf
456,Activi in comunitate,Asociaţia Socio-Culturală Matei Basarab,Axa Prioritară 3/ DMI 3.3. Dezvoltarea parteneriatelor şi încurajarea iniţiativelor pentru partenerii sociali şi societatea civilă,316.460,89.258,8.280,32.349,446.347,LEI,http://localhost:9999/Lista_contractate_POS_DRU_30_aprilie_2010.pdf
457,Consolidarea capacitatii institutionale a Consortiului Regional (CR) al Regiunii de Dezvoltare Nord-Vest,"Universitatea ""Babes-Bolyai"" Cluj- Napoca",Axa Prioritară 3/ DMI 3.3. Dezvoltarea parteneriatelor şi încurajarea iniţiativelor pentru partenerii sociali şi societatea civilă,1.401.789,395.376,39.000,0,1.836.165,LEI,http://localhost:9999/Lista_contractate_POS_DRU_30_aprilie_2010.pdf
458,Parteneriat pentru Dezvoltare Durabila,Asociatia Salvati Dunarea si Delta,Axa Prioritară 3/ DMI 3.3. Dezvoltarea parteneriatelor şi încurajarea iniţiativelor pentru partenerii sociali şi societatea civilă,11.496.163,3.242.508,301.549,0,15.040.220,LEI,http://localhost:9999/Lista_contractate_POS_DRU_30_aprilie_2010.pdf
459,Analiza deficitului de forţă de muncă calificată în domeniul construcţii,Agentia Nationala pentru Ocuparea Fortei de Munca,Axa Prioritară 4/ DMI 4.1. Întărirea capacităţii SPO pentru furnizarea serviciilor de ocupare,2.387.932,0,795.978,27.692,3.211.602,LEI,http://localhost:9999/Lista_contractate_POS_DRU_30_aprilie_2010.pdf
460,PROSELF – „PROmovarea serviciilor de tip SELF-service”,Agenţia Naţională pentru Ocuparea Forţei de Muncă,Axa Prioritară 4/ DMI 4.1. Întărirea capacităţii SPO pentru furnizarea serviciilor de ocupare,13.123.530,0,4.374.511,1.001.959,18.500.000,LEI,http://localhost:9999/Lista_contractate_POS_DRU_30_aprilie_2010.pdf
461,ASC Anticiparea SChimbărilor pe piaţa muncii,Agenţia Naţională pentru Ocuparea Forţei de Muncă,Axa Prioritară 4/ DMI 4.1. Întărirea capacităţii SPO pentru furnizarea serviciilor de ocupare,5.335.830,0,1.778.611,417.472,7.531.913,LEI,http://localhost:9999/Lista_contractate_POS_DRU_30_aprilie_2010.pdf
462,MODEL DE COOPERARE TRANSNATIONALA PENTRU INTOARCEREA LUCRATORILOR ROMANI,Agenţia Naţională pentru Ocuparea Forţei de Muncă,Axa Prioritară 4/ DMI 4.1. Întărirea capacităţii SPO pentru furnizarea serviciilor de ocupare,7.374.007,0,2.458.003,684.259,10.516.269,LEI,http://localhost:9999/Lista_contractate_POS_DRU_30_aprilie_2010.pdf
463,"SAPeRe Studii, analize şi previziuni asupra pieţei muncii pentru a întări capacitatea SPO în România, la nivel naţional şi local",Agenţia Naţională pentru Ocuparea Forţei de Muncă,Axa Prioritară 4/ DMI 4.1. Întărirea capacităţii SPO pentru furnizarea serviciilor de ocupare,13.535.041,0,4.511.680,453.279,18.500.000,LEI,http://localhost:9999/Lista_contractate_POS_DRU_30_aprilie_2010.pdf
464,asigurarea managementului calității serviciului public de ocupare la standarde europene - CALISPO,Agenția Județeană pentru Ocuparea Forței de Muncă Bihor,Axa Prioritară 4/ DMI 4.1. Întărirea capacităţii SPO pentru furnizarea serviciilor de ocupare,592.239,0,197.413,57.164,846.816,LEI,http://localhost:9999/Lista_contractate_POS_DRU_30_aprilie_2010.pdf
465,PRELUCRARE INFORMATICA A SUBVENTIILOR ANGAJATORILOR (PISA),AGENTIA JUDETEANA PENTRU OCUPAREA FORTEI DE MUNCA COVASNA,Axa Prioritară 4/ DMI 4.1. Întărirea capacităţii SPO pentru furnizarea serviciilor de ocupare,1.342.766,0,447.589,0,1.790.355,LEI,http://localhost:9999/Lista_contractate_POS_DRU_30_aprilie_2010.pdf
466,Sistem de afisare electronica a informatiilor privind piata muncii,Agentia Judeteana pentru Ocuparea Fortei de Munca Hunedoara,Axa Prioritară 4/ DMI 4.1. Întărirea capacităţii SPO pentru furnizarea serviciilor de ocupare,701.221,0,233.740,27.109,962.070,LEI,http://localhost:9999/Lista_contractate_POS_DRU_30_aprilie_2010.pdf
467,"Necesitate, oportunitate, eficienta si eficacitate in SPO",Agentia Judeteana pentru Ocuparea Fortei de Munca Mehedinti,Axa Prioritară 4/ DMI 4.1. Întărirea capacităţii SPO pentru furnizarea serviciilor de ocupare,470.987,0,156.996,77.000,704.983,LEI,http://localhost:9999/Lista_contractate_POS_DRU_30_aprilie_2010.pdf
468,Serviciul public de ocupare în sprijinul dumneavoastră,Agenţia Judeţeană pentru Ocuparea Forţei de Muncă Călăraşi,Axa Prioritară 4/ DMI 4.1. Întărirea capacităţii SPO pentru furnizarea serviciilor de ocupare,438.600,0,146.200,0,584.800,LEI,http://localhost:9999/Lista_contractate_POS_DRU_30_aprilie_2010.pdf
469,Call Center SPO,Agentia Nationala pentru Ocuparea Fortei de Munca,Axa Prioritară 4/ DMI 4.1. Întărirea capacităţii SPO pentru furnizarea serviciilor de ocupare,7.630.880,0,2.543.628,0,10.174.508,LEI,http://localhost:9999/Lista_contractate_POS_DRU_30_aprilie_2010.pdf
470,Campanie de comunicare privind serviciile SPO oferite tinerilor si angajatorilor,Agentia Nationala pentru Ocuparea Fortei de Munca,Axa Prioritară 4/ DMI 4.1. Întărirea capacităţii SPO pentru furnizarea serviciilor de ocupare,6.898.500,0,2.299.500,818.900,10.016.900,LEI,http://localhost:9999/Lista_contractate_POS_DRU_30_aprilie_2010.pdf
471,SCOP - Specializarea Consilierilor de Orientare Profesională,Agenţia Naţională pentru Ocuparea Forţei de Muncă,Axa Prioritară 4/ DMI 4.2. Formarea personalului propriu al SPO,13.770.606,0,4.590.202,139.192,18.500.000,LEI,http://localhost:9999/Lista_contractate_POS_DRU_30_aprilie_2010.pdf
472,COMPROF,Agenţia Naţională pentru Ocuparea Forţei de Muncă,Axa Prioritară 4/ DMI 4.2. Formarea personalului propriu al SPO,13.653.449,0,4.551.150,295.401,18.500.000,LEI,http://localhost:9999/Lista_contractate_POS_DRU_30_aprilie_2010.pdf
473,"Modernizarea Serviciului Public de Ocupare- Formarea personalului propriu al SPO- ""Excelenta in Ocupare"".",Agentia Judeteana pentru Ocuparea Fortei de Munca SIBIU,Axa Prioritară 4/ DMI 4.2. Formarea personalului propriu al SPO,835.710,0,278.570,44.060,1.158.340,LEI,http://localhost:9999/Lista_contractate_POS_DRU_30_aprilie_2010.pdf
474,"CALITATE, EFICIENTA SI TRANSPARENTA IN SERVICIUL PUBLIC DE OCUPARE",AJOFM VRANCEA,Axa Prioritară 4/ DMI 4.2. Formarea personalului propriu al SPO,424.086,0,141.363,75.000,640.449,LEI,http://localhost:9999/Lista_contractate_POS_DRU_30_aprilie_2010.pdf
475,Cresterea capacitatii Servicii Publice de Ocupare (SPO) din regiune de a planifica proiecte si de a furniza servicii de consiliere centrata pe client,Agentia Judeteana pentru Ocuparea Fortei de Munca Mehedinti,Axa Prioritară 4/ DMI 4.2. Formarea personalului propriu al SPO,1.251.867,0,417.289,179.314,1.848.470,LEI,http://localhost:9999/Lista_contractate_POS_DRU_30_aprilie_2010.pdf
476,"RATIO L3: Analizarea, dezvoltarea, coniventa, testarea, evaluarea si modelarea unei strategii inovatoare pentru formarea continua a personalului Serviciului Public de Ocupare(SPO)",Agentia Nationala pentru Ocuparea Fortei de Munca,Axa Prioritară 4/ DMI 4.2. Formarea personalului propriu al SPO,12.798.750,0,4.266.250,1.300.000,18.365.000,LEI,http://localhost:9999/Lista_contractate_POS_DRU_30_aprilie_2010.pdf
477,Campanie de comunicare privind serviciile SPO oferite tinerilor si angajatorilor,Agentia Nationala pentru Ocuparea Fortei de Munca,Axa Prioritară 4/ DMI 4.2. Formarea personalului propriu al SPO,7.943.511,0,2.647.839,508.630,11.099.980,LEI,http://localhost:9999/Lista_contractate_POS_DRU_30_aprilie_2010.pdf
478,Pregatire si adaptare pentru o societate mai curata,"FUNDATIA PENTRU EDUCATIE DEZVOLTARE SI SPRIJIN COMUNITAR ""CONSTANTIN BRANCOVEANU"" BACAU",Axa Prioritară 5/ DMI 5.1. Dezvoltarea şi implementarea măsurilor active de ocupare,1.254.655,124.087,28.138,0,1.406.880,LEI,http://localhost:9999/Lista_contractate_POS_DRU_30_aprilie_2010.pdf
479,INITIERE IN MESERIA DE ELECTRICIAN- ELECTRONIST AUTO,SC AUTOSERVICE MARINI SRL,Axa Prioritară 5/ DMI 5.1. Dezvoltarea şi implementarea măsurilor active de ocupare,687.778,68.022,45.000,0,800.800,LEI,http://localhost:9999/Lista_contractate_POS_DRU_30_aprilie_2010.pdf
480,Măsuri active de ocupare pentru şomeri şi somerii tineri aflaţi în căutarea unui loc de muncă din din regiunea Nord Est prin calificare în meserii din domeniul întreţinerii şi reparaţiilor auto,SC APETRANS SRL,Axa Prioritară 5/ DMI 5.1. Dezvoltarea şi implementarea măsurilor active de ocupare,1.314.213,129.977,76.010,0,1.520.200,LEI,http://localhost:9999/Lista_contractate_POS_DRU_30_aprilie_2010.pdf
481,Ocupare garantată prin formarea de competenţe specifice aliniate la necesităţile operatorilor economici din domeniul construcţiilor activi în Regiunea de Sud-Est,Fundatia Satean Braila,Axa Prioritară 5/ DMI 5.1. Dezvoltarea şi implementarea măsurilor active de ocupare,1.635.754,161.778,36.868,0,1.834.400,LEI,http://localhost:9999/Lista_contractate_POS_DRU_30_aprilie_2010.pdf
482,Someri instruiti - persoane active pe piata muncii,Unitatea Administrativ Teritoriala Chiscani,Axa Prioritară 5/ DMI 5.1. Dezvoltarea şi implementarea măsurilor active de ocupare,935.549,92.527,21.000,12.720,1.061.796,LEI,http://localhost:9999/Lista_contractate_POS_DRU_30_aprilie_2010.pdf
483,"Panificatie si patiserie, comert si restauratie: califica-te pentru piata muncii",SC EURODEZVOLTARE SRL,Axa Prioritară 5/ DMI 5.1. Dezvoltarea şi implementarea măsurilor active de ocupare,1.513.848,149.721,87.556,80.325,1.831.450,LEI,http://localhost:9999/Lista_contractate_POS_DRU_30_aprilie_2010.pdf
484,O sansa in plus,Agentia Judeteana pentru Ocuparea Fortei de Munca Braila,Axa Prioritară 5/ DMI 5.1. Dezvoltarea şi implementarea măsurilor active de ocupare,347.686,34.386,7.797,34.766,424.635,LEI,http://localhost:9999/Lista_contractate_POS_DRU_30_aprilie_2010.pdf
485,"O MESERIE, UN VIITOR MAI SIGUR",International Protect Security,Axa Prioritară 5/ DMI 5.1. Dezvoltarea şi implementarea măsurilor active de ocupare,468.239,46.309,28.500,24.008,567.056,LEI,http://localhost:9999/Lista_contractate_POS_DRU_30_aprilie_2010.pdf
486,FII CALIFICAT INTR-O ECONOMIE BAZATA PE CUNOASTERE PROGRAM DE PREGATIRE PENTRU SOMERI IN DOMENIUL TIC,FUNDATIA GIOVANNI BOSCO,Axa Prioritară 5/ DMI 5.1. Dezvoltarea şi implementarea măsurilor active de ocupare,1.532.096,151.526,34.359,6.585,1.724.566,LEI,http://localhost:9999/Lista_contractate_POS_DRU_30_aprilie_2010.pdf
487,"Fii activ pe piata muncii in sectoarele turism si comert in judetele Tulcea, Braila, Galati",SC EURODEZVOLTARE SRL,Axa Prioritară 5/ DMI 5.1. Dezvoltarea şi implementarea măsurilor active de ocupare,1.582.552,156.516,91.530,2.221,1.832.819,LEI,http://localhost:9999/Lista_contractate_POS_DRU_30_aprilie_2010.pdf
488,O VIATA MAI BUNA PENTRU TINE,SC BRATILA SRL,Axa Prioritară 5/ DMI 5.1. Dezvoltarea şi implementarea măsurilor active de ocupare,1.076.008,106.418,75.474,0,1.257.900,LEI,http://localhost:9999/Lista_contractate_POS_DRU_30_aprilie_2010.pdf
489,Masuri Active integrate pentru persoanele fara loc de munca din Regiunea Sud-Muntenia in vederea cresterii ratei de ocupare si a mobilitatii ocupationale,ASOCIATIA DE SPRIJIN A SOMERILOR DAMBOVITA,Axa Prioritară 5/ DMI 5.1. Dezvoltarea şi implementarea măsurilor active de ocupare,1.485.211,146.889,36.000,0,1.668.100,LEI,http://localhost:9999/Lista_contractate_POS_DRU_30_aprilie_2010.pdf
490,"Servicii integrate de masuri active pentru persoanelor in cautare de loc de munca, pentru someri , pentru someri de lunga durata si persoanele inactive din judetul Dambovita in",CONSILIUL LOCAL MORENI,Axa Prioritară 5/ DMI 5.1. Dezvoltarea şi implementarea măsurilor active de ocupare,740.922,73.278,24.000,0,838.200,LEI,http://localhost:9999/Lista_contractate_POS_DRU_30_aprilie_2010.pdf
491,Calificarea şi recalificarea-condiţie a dezvoltării resurselor umane şi creşterii competitivităţii acestora pe piaţa muncii,DINAMIC TOUR BORCEA SRL CALARASI,Axa Prioritară 5/ DMI 5.1. Dezvoltarea şi implementarea măsurilor active de ocupare,802.804,79.398,46.432,24.632,953.266,LEI,http://localhost:9999/Lista_contractate_POS_DRU_30_aprilie_2010.pdf
492,Fii activ pe piata muncii in turism in judetul Prahova,SC EURODEZVOLTARE SRL,Axa Prioritară 5/ DMI 5.1. Dezvoltarea şi implementarea măsurilor active de ocupare,1.591.383,157.389,92.041,2.024,1.842.837,LEI,http://localhost:9999/Lista_contractate_POS_DRU_30_aprilie_2010.pdf
493,Masuri active in vederea cresterii sanselor de insertie pe piata muncii a persoanelor neocupate,SC Automonza SRL,Axa Prioritară 5/ DMI 5.1. Dezvoltarea şi implementarea măsurilor active de ocupare,619.461,61.265,36.000,0,716.726,LEI,http://localhost:9999/Lista_contractate_POS_DRU_30_aprilie_2010.pdf
494,"Centru de informare, orientare si calificare profesionala - CIOCP",SC Basicra Prod Serv SRL,Axa Prioritară 5/ DMI 5.1. Dezvoltarea şi implementarea măsurilor active de ocupare,1.181.491,116.851,68.334,0,1.366.676,LEI,http://localhost:9999/Lista_contractate_POS_DRU_30_aprilie_2010.pdf
495,"Creşterea adaptabilităţii şi a performanţelor şomerilor tineri, în integrarea pe piaţa europeană a muncii",AGENTIA JUDETEANA PENTRU OCUPAREA FORTEI DE MUNCA ARAD,Axa Prioritară 5/ DMI 5.1. Dezvoltarea şi implementarea măsurilor active de ocupare,601.919,59.530,13.499,22.368,697.316,LEI,http://localhost:9999/Lista_contractate_POS_DRU_30_aprilie_2010.pdf
496,”ŞANSE PENTRU TINERI”,AJOFM Timis,Axa Prioritară 5/ DMI 5.1. Dezvoltarea şi implementarea măsurilor active de ocupare,1.536.844,151.996,34.550,97.848,1.821.238,LEI,http://localhost:9999/Lista_contractate_POS_DRU_30_aprilie_2010.pdf
497,Promovarea eficientă a măsurilor active de ocupare a forţei de muncă în activităţi cu rată mare a locurilor de muncă vacante “PRO-FM”,S.C. R & B Consulting S.R.L.,Axa Prioritară 5/ DMI 5.1. Dezvoltarea şi implementarea măsurilor active de ocupare,1.484.475,146.816,100.000,108.666,1.839.957,LEI,http://localhost:9999/Lista_contractate_POS_DRU_30_aprilie_2010.pdf
498,CALIFICARE ŞI COMPETENŢĂ - PREMISE PENTRU SUCCES ŞI DEZVOLTARE,ASOCIATIA BARNABAS,Axa Prioritară 5/ DMI 5.1. Dezvoltarea şi implementarea măsurilor active de ocupare,1.269.441,125.549,28.470,63.813,1.487.273,LEI,http://localhost:9999/Lista_contractate_POS_DRU_30_aprilie_2010.pdf
499,"”Servicii integrate pentru inserţia şomerilor pe piaţa muncii din municipiul Hunedoara""","Asociatia Non Profit ""Iancu de Hunedoara - PAEM""",Axa Prioritară 5/ DMI 5.1. Dezvoltarea şi implementarea măsurilor active de ocupare,717.808,70.992,16.300,16.550,821.650,LEI,http://localhost:9999/Lista_contractate_POS_DRU_30_aprilie_2010.pdf
500,"Consiliere, mediere, formare profesionala in cadrul organizat al unui job club",SC CONTINENTAL TRANSCOM SRL,Axa Prioritară 5/ DMI 5.1. Dezvoltarea şi implementarea măsurilor active de ocupare,534.184,52.831,30.896,16.135,634.045,LEI,http://localhost:9999/Lista_contractate_POS_DRU_30_aprilie_2010.pdf
501,AGENTIA DE DEZVOLTARE OCUPATIONALA,SC Lotus B&B SRL,Axa Prioritară 5/ DMI 5.1. Dezvoltarea şi implementarea măsurilor active de ocupare,1.361.065,134.611,78.722,0,1.574.398,LEI,http://localhost:9999/Lista_contractate_POS_DRU_30_aprilie_2010.pdf
502,AI O ŞANSĂ AI JOB CLUB-UL TĂU,SC VECO-ROM SRL,Axa Prioritară 5/ DMI 5.1. Dezvoltarea şi implementarea măsurilor active de ocupare,1.557.084,153.997,90.899,16.000,1.817.980,LEI,http://localhost:9999/Lista_contractate_POS_DRU_30_aprilie_2010.pdf
503,Centrul de dezvoltare şi formare profesională,SC PSIHOTERA SRL,Axa Prioritară 5/ DMI 5.1. Dezvoltarea şi implementarea măsurilor active de ocupare,573.855,56.755,33.190,13.680,677.480,LEI,http://localhost:9999/Lista_contractate_POS_DRU_30_aprilie_2010.pdf
504,Turist in Europa Moderna,MERIDIAN EUROPA SERVICES GROUP SRL,Axa Prioritară 5/ DMI 5.1. Dezvoltarea şi implementarea măsurilor active de ocupare,1.075.335,106.352,62.196,0,1.243.883,LEI,http://localhost:9999/Lista_contractate_POS_DRU_30_aprilie_2010.pdf
505,Creşterea gradului de ocupare a forţei de muncă prin măsuri integrate în cooperare transnaţională CGOFM-MICT,Fundaţia Româno-Germană de pregătire şi perfecţionare profesională Timişoara,Axa Prioritară 5/ DMI 5.1. Dezvoltarea şi implementarea măsurilor active de ocupare,11.253.098,1.112.944,252.368,0,12.618.410,LEI,http://localhost:9999/Lista_contractate_POS_DRU_30_aprilie_2010.pdf
506,Salvamari si scafandri pentru economia românească.,Asociatia Nationala a Scafandrilor Profesionisti si Salvamarilor din Romania,Axa Prioritară 5/ DMI 5.1. Dezvoltarea şi implementarea măsurilor active de ocupare,16.330.252,1.615.080,366.231,177.430,18.488.993,LEI,http://localhost:9999/Lista_contractate_POS_DRU_30_aprilie_2010.pdf
507,"S.C.O.R. - ""Şanse pentru comunitatea rurală""",Agenţia Naţională pentru Ocuparea Forţei de Muncă,Axa Prioritară 5/ DMI 5.2. Promovarea sustenabilităţii pe termen lung a zonelor rurale în ceea ce priveşte dezvoltarea resurselor umane şi ocuparea forţei de muncă,15.000.734,2.454.158,370.000,675.108,18.500.000,LEI,http://localhost:9999/Lista_contractate_POS_DRU_30_aprilie_2010.pdf
508,Necesitate si oportunitate-instruire pentru comunitatea rurala,ASOCIATIA LINGUA INTERNATIONAL,Axa Prioritară 5/ DMI 5.2. Promovarea sustenabilităţii pe termen lung a zonelor rurale în ceea ce priveşte dezvoltarea resurselor umane şi ocuparea forţei de muncă,3.190.395,521.957,77.695,0,3.790.047,LEI,http://localhost:9999/Lista_contractate_POS_DRU_30_aprilie_2010.pdf
509,Rural-Manager,Fundatia Nationala a Tinerilor Manageri - FNTM,Axa Prioritară 5/ DMI 5.2. Promovarea sustenabilităţii pe termen lung a zonelor rurale în ceea ce priveşte dezvoltarea resurselor umane şi ocuparea forţei de muncă,7.149.249,1.169.635,169.774,362.022,8.850.680,LEI,http://localhost:9999/Lista_contractate_POS_DRU_30_aprilie_2010.pdf
510,Populaţia ocupată în agricultura de subzistenţă - soluţie pentru echilibrarea pieţei interne a muncii în România.,sc agroserv management srl,Axa Prioritară 5/ DMI 5.2. Promovarea sustenabilităţii pe termen lung a zonelor rurale în ceea ce priveşte dezvoltarea resurselor umane şi ocuparea forţei de muncă,1.642.331,268.689,100.580,96.000,2.107.600,LEI,http://localhost:9999/Lista_contractate_POS_DRU_30_aprilie_2010.pdf
511,RURALTIN - SERVICII INTEGRATE SI PERSONALIZATE PENTRU TINERII DIN MEDIUL RURAL,AGENTIA NATIONALA PENTRU SPRIJINIREA INITIATIVELOR TINERILOR (ANSIT),Axa Prioritară 5/ DMI 5.2. Promovarea sustenabilităţii pe termen lung a zonelor rurale în ceea ce priveşte dezvoltarea resurselor umane şi ocuparea forţei de muncă,3.773.735,617.392,89.615,128.658,4.609.400,LEI,http://localhost:9999/Lista_contractate_POS_DRU_30_aprilie_2010.pdf
512,Metode moderne de ocupare pentru mediul rural,Asociatia de Dezvoltare Durabila a Judetului Tulcea,Axa Prioritară 5/ DMI 5.2. Promovarea sustenabilităţii pe termen lung a zonelor rurale în ceea ce priveşte dezvoltarea resurselor umane şi ocuparea forţei de muncă,1.681.750,275.138,40.000,22.000,2.018.888,LEI,http://localhost:9999/Lista_contractate_POS_DRU_30_aprilie_2010.pdf
513,Dezvoltarea pieţei muncii prin promovarea ocupaţiilor neagricole în mediul rural,Universitatea de Stiinte Agronomice si Medicina Veterinara Bucuresti,Axa Prioritară 5/ DMI 5.2. Promovarea sustenabilităţii pe termen lung a zonelor rurale în ceea ce priveşte dezvoltarea resurselor umane şi ocuparea forţei de muncă,12.499.973,2.045.027,296.718,699.701,15.541.419,LEI,http://localhost:9999/Lista_contractate_POS_DRU_30_aprilie_2010.pdf
