"Communauté de communes de la Région de Montmarault","Construction d'une maison de santé pluridisciplinaire","753,088 €","176,976 €","FEDER ","AUVERGNE","AUVERGNE",,"61","Projets intégrés de réhabilitation urbaine et rurale"
"Communauté de communes des Côtes de Combrailles","Construction d'un bâtiment industriel locatif pour la société Auvergne Bio Distribution","498,300 €","150,000 €","FEDER ","AUVERGNE","AUVERGNE",,"5","Services de soutien avancé aux sociétés et groupes de sociétés"
"Communauté de communes du Cézallier","Création d'une maison de santé pluridisciplinaire de santé, à Condat ","1,144,587 €","268,978 €","FEDER ","AUVERGNE","AUVERGNE",,"61","Projets intégrés de réhabilitation urbaine et rurale"
"Communauté de communes du Cézallier","Création d'une maison de services à Allanches ","470,332 €","60,015 €","FEDER ","AUVERGNE","AUVERGNE",,"61","Projets intégrés de réhabilitation urbaine et rurale"
"Communauté de communes du Cézallier","Etude de faisabilité d'une zone résidentielle de loisirs à vocation environnementale","14,298 €","2,859 €","FEDER ","AUVERGNE","AUVERGNE",,"6","Soutien aux PME pour la promotion de produits et processus de fabrication écologiques (...)"
"Communauté de communes du pays d'Arlanc","Salon du bois en Pays d'Arlanc 2008","81,015 €","19,212 €","FEDER ","AUVERGNE","AUVERGNE",,"43","Efficacité énergétique, cogénération, gestion de l'énergie"
"Communauté de communes du Pays de Cayres-Pradelles","Réalisation d'une chaufferie à granulés bois","117,164 €","28,120 €","FEDER ","AUVERGNE","AUVERGNE",,"41","Energie renouvelable: biomasse"
"Communauté de communes du Pays de Maurs","Installation de panneaux solaires sur un multiple rural - multi services à Leynhac","14,576 €","3,498 €","FEDER ","AUVERGNE","AUVERGNE",,"40","Energie renouvelable: én. solaire"
"Communauté de communes du Pays de Saint-Flour","Construction d'une chaufferie bois pour alimenter le futur centre aqualudique intercommunal","495,889 €","116,856 €","FEDER ","AUVERGNE","AUVERGNE",,"41","Energie renouvelable: biomasse"
"Communauté de communes du Pays de Sauxillanges","Construction d'une maison de santé au Vernet La Varenne dans le Puy de Dôme","896,200 €","46,907 €","FEDER ","AUVERGNE","AUVERGNE",,"61","Projets intégrés de réhabilitation urbaine et rurale"
"COMMUNAUTE DE COMMUNES DU PAYS D'OLLIERGUES","réalisation d'un réseau de chaleur bois sur la commune du Brugeron","716,668 €","110,565 €","FEDER ","AUVERGNE","AUVERGNE",,"41","Energie renouvelable: biomasse"
"Communauté de communes du Sancy","Installation solaire pour la production d'ECS dans le cadre de la construction d'un pôle aquatique à la Bourboule","63,732 €","15,423 €","FEDER ","AUVERGNE","AUVERGNE",,"40","Energie renouvelable: én. solaire"
"Communauté de communes Limagne d'Ennezat","Programme d'animation et de promotion de la technopole Biopôle Clermont-Limagne","15,619 €","7,809 €","FEDER ","AUVERGNE","AUVERGNE",,"5","Services de soutien avancé aux sociétés et groupes de sociétés"
"Communauté de communes Sancy Artense","Etude bilan diagnostique des cours d'eau communautaires","34,385 €","12,938 €","FEDER ","AUVERGNE","AUVERGNE",,"51","Promotion de la biodiversité et protection de la nature (y compris Natura 2000)"
"Communauté de l'agglomération montluçonnaise","Construction d'un conservatoire musique et dart dramatique d'intérêt départemental dans un quartier retenu par l'ANRU","7,660,156 €","761,500 €","FEDER ","AUVERGNE","AUVERGNE",,"59","Développement d'infrastructures culturelles"
"Commune de Chilhac","Etude paysagère et d'aménagement du village de Chilhac","11,175 €","3,353 €","FEDER ","AUVERGNE","AUVERGNE",,"56","Protection et valorisation du patrimoine naturel"
"Commune de Craponne-sur-Arzon","Réalisation d'une chaufferie bois au sein du centre administratif","45,108 €","5,503 €","FEDER ","AUVERGNE","AUVERGNE",,"41","Energie renouvelable: biomasse"
"Commune de Gannat","Station d'épuration des Cavillons","2,914,515 €","160,831 €","FEDER ","AUVERGNE","AUVERGNE",,"46","Traitement de l'eau (eaux usées)"
"Commune de Leucamp","Installation d'une chaudière bois et réseau de chaleur","20,701 €","5,010 €","FEDER ","AUVERGNE","AUVERGNE",,"41","Energie renouvelable: biomasse"
"Commune de Monistrol sur Loire","Réalisation d'une chaufferie bois dans le cadre de la construction d'un nouveau groupe scolaire ","87,400 €","10,942 €","FEDER ","AUVERGNE","AUVERGNE",,"41","Energie renouvelable: biomasse"
"Commune de Ravel","Mise en place d'une chaudière à plaquettes dans le nouvel atelier communal","44,420 €","10,661 €","FEDER ","AUVERGNE","AUVERGNE",,"41","Energie renouvelable: biomasse"
"Commune de Reilhac","Installation d'une production ECS pour l'EHPAD à Reilhac","39,532 €","9,500 €","FEDER ","AUVERGNE","AUVERGNE",,"40","Energie renouvelable: én. solaire"
"Commune de Riom-ès-Montagnes","Assistance à Maitrise d'ouvrage pour la création d'un réseau de chaleur bois ","36,350 €","8,724 €","FEDER ","AUVERGNE","AUVERGNE",,"41","Energie renouvelable: biomasse"
"Commune de Saint-Clément-de-Régnat","Installation d'un réseau de chaleur au bois","392,569 €","39,728 €","FEDER ","AUVERGNE","AUVERGNE",,"41","Energie renouvelable: biomasse"
"Commune de Sainte-Florine","Installation solaire pour la production d'ECS sur la salle polyvalente - halle des sports","15,077 €","3,618 €","FEDER ","AUVERGNE","AUVERGNE",,"40","Energie renouvelable: én. solaire"
"Commune de Saint Germain l'Herm","Extension du réseau de chaleur bois (2e tranche)","610,533 €",,"FEDER ","AUVERGNE","AUVERGNE",,"41","Energie renouvelable: biomasse"
"Commune de Saint Just Malmont","Aménagement d'un réseau de chaleur et réalisation d'une chaufferie bois au village de Malmont","120,700 €","28,968 €","FEDER ","AUVERGNE","AUVERGNE",,"41","Energie renouvelable: biomasse"
"Commune de Solignac-sur-Loire","Installation d'une chaufferie bois dans le cadre de la construction d'une école maternelle et primaire","40,568 €","9,736 €","FEDER ","AUVERGNE","AUVERGNE",,"41","Energie renouvelable: biomasse"
"Commune de Tence","Réalisation d'une chaufferie bois ","1,433,333 €","307,202 €","FEDER ","AUVERGNE","AUVERGNE",,"41","Energie renouvelable: biomasse"
"Commune de Viverols","Réalisation d'un chauffage à granulés bois","51,700 €","6,407 €","FEDER ","AUVERGNE","AUVERGNE",,"41","Energie renouvelable: biomasse"
"Commune d'Olby","Mise en place d'une chaudière à granulés pour le groupe scolaire","78,514 €","18,724 €","FEDER ","AUVERGNE","AUVERGNE",,"41","Energie renouvelable: biomasse"
"Commune du Chambon-Sur-Lignon","Construction d'une chaufferie bois","696,066 €","167,056 €","FEDER ","AUVERGNE","AUVERGNE",,"41","Energie renouvelable: biomasse"
"Commune du Mont-Dore","Projet de mise en valeur des sources de la Dordogne","373,937 €","119,286 €","FEDER ","AUVERGNE","AUVERGNE",,"56","Protection et valorisation du patrimoine naturel"
"Commune d'Yssingeaux","Assistance à Maîtrise d'Ouvrage préalable à une délégation de service public pour la réalisation d'un réseau de chaleur","45,717 €","10,972 €","FEDER ","AUVERGNE","AUVERGNE",,"41","Energie renouvelable: biomasse"
"Commune d'Yssingeaux","reprise et réhabilitation des locaux de l'Ecole Nationale Supérieure de la Pâtisserie 2e tranche ","750,571 €","249,940 €","FEDER ","AUVERGNE","AUVERGNE",,"8","Autres investissements en entreprises"
"CONCEPTS ET INNOVATIONS EN SECURITE MAGNETIQUE","Etude de faisabilité d'une gamme de nouveaux barillets à came ou à loquets miniaturisés et utilisant le principe de codage par flux magnétiques breveté par CISM.","37,208 €",,"FEDER ","AUVERGNE","AUVERGNE",,"7","Investissements dans les entreprises directement liées à la recherche et l'innovation (...)"
"Congrégation des soeurs de l'enfant Jesus","Installation d'un chauffe-eau solaire collectif","38,253 €","9,257 €","FEDER ","AUVERGNE","AUVERGNE",,"40","Energie renouvelable: én. solaire"
"Conseil Général du Cantal","Environnements Numériques de Travail (ENT) dans les collèges","200,000 €","60,000 €","FEDER ","AUVERGNE","AUVERGNE",,"13","Services et applications pour les citoyens (santé, gouvernement, formation en ligne, participation de tous à la société de l'information, etc.)"
"Conseil Général du Cantal","Expérimentation  Classe mobile ","16,358 €","4,907 €","FEDER ","AUVERGNE","AUVERGNE",,"13","Services et applications pour les citoyens (santé, gouvernement, formation en ligne, participation de tous à la société de l'information, etc.)"
"Conseil Général du Cantal","Réalisation d'un préinventaire des zones humides du Cantal","43,165 €","12,950 €","FEDER ","AUVERGNE","AUVERGNE",,"56","Protection et valorisation du patrimoine naturel"
"Conseil Général du Cantal","réalisation d'un schéma départemental de gestion des déchets d'assainissements - boues d'épuration et matières de vidange","58,963 €","22,878 €","FEDER ","AUVERGNE","AUVERGNE",,"46","Traitement de l'eau (eaux usées)"
"Conseil Général du Cantal","Reconstruction du mur de soutènement du Pas de Peyrol","180,883 €","48,246 €","FEDER ","AUVERGNE","AUVERGNE",,"56","Protection et valorisation du patrimoine naturel"
"Conseil Général du Puy-de-Dôme","Assistance au Conseil général du Puy-de-Dôme dans l'élaboration de son Agenda 21","88,050 €","18,842 €","FEDER ","AUVERGNE","AUVERGNE",,"61","Projets intégrés de réhabilitation urbaine et rurale"
"Conseil Général du Puy-de-Dôme","Installation d'une chaufferie bois pour le futur bâtiment du Centre d'Intervention Routière et du CDIS à Herment","41,925 €","4,109 €","FEDER ","AUVERGNE","AUVERGNE",,"41","Energie renouvelable: biomasse"
"Conseil Général du Puy-de-Dôme","Installation géothermique dans le cadre de la construction d'un collège à Pontgibaud en démarche HQE","117,606 €","28,461 €","FEDER ","AUVERGNE","AUVERGNE",,"42","Energie renouvelable: én. hydroélectrique, géothermique et autre"
"Conseil Général du Puy-de-Dôme","Plan d'actions pour développer les télé-procédures et la e-administration","84,000 €","25,200 €","FEDER ","AUVERGNE","AUVERGNE",,"13","Services et applications pour les citoyens (santé, gouvernement, formation en ligne, participation de tous à la société de l'information, etc.)"
"Conseil Général du Puy-de-Dôme","Projet global d'aménagement du site du Puy de Dôme","81,063,911 €","12,000,000 €","FEDER ","AUVERGNE","AUVERGNE",,"56","Protection et valorisation du patrimoine naturel"
"Conseil interconsulaire Auvergne","Actions pour le développement de la reprise d'entreprises 2008-2009","170,994 €","59,534 €","FEDER ","AUVERGNE","AUVERGNE",,"9","Autres mesures pour stimuler la recherche, l'innovation et l'esprit d'entreprise dans les PME"
"Conseil interconsulaire Auvergne","Actions pour le développement de la reprise d'entreprises en Auvergne","142,000 €","50,410 €","FEDER ","AUVERGNE","AUVERGNE",,"5","Services de soutien avancé aux sociétés et groupes de sociétés"
"Conseil régional d'Auvergne","Assistance technique pour les années 2009 et 2010 liée à la subvention globale","756,261 €","642,822 €","FEDER ","AUVERGNE","AUVERGNE",,"85","Préparation, mise en oeuvre, suivi et inspection "
"Conseil régional d'Auvergne","Diagnostic de la biodiversité en Auvergne","68,190 €","27,276 €","FEDER ","AUVERGNE","AUVERGNE",,"51","Promotion de la biodiversité et protection de la nature (y compris Natura 2000)"
"Conseil Régional d'Auvergne","Aménagement des zones blanches au haut débit (partenariat public-privé)","12,103,235 €","3,679,383 €","FEDER ","AUVERGNE","AUVERGNE",,"10","Infrastructures téléphoniques (y compris réseaux haut débit)"
"Conseil Régional d'Auvergne","Assistance Technique liée à la subvention globale","203,600 €","173,060 €","FEDER ","AUVERGNE","AUVERGNE",,"85","Préparation, mise en oeuvre, suivi et inspection "
"Conseil Régional d'Auvergne","Etude schéma du haut et du très haut débit","140,100 €","43,851 €","FEDER ","AUVERGNE","AUVERGNE",,"10","Infrastructures téléphoniques (y compris réseaux haut débit)"
"Conseil Régional d'Auvergne","Organisation de la  Journée des solutions numériques  le 4 juin 2009 à la Grande halle d'Auvergne  ","105,211 €","31,563 €","FEDER ","AUVERGNE","AUVERGNE",,"14","Services et applications pour les PME (commerce électronique, éducation et formation, mise en réseau, etc.)"
"Conservatoire National du Saumon Sauvage","Création d'une centrale photovoltaïque sur le site du conservatoire du saumon sauvage","785,061 €","78,500 €","FEDER ","AUVERGNE","AUVERGNE",,"40","Energie renouvelable: én. solaire"
"Convivial ","Développement d'une nouvelle chaîne de viandes effeuillées.","427,654 €","150,000 €","FEDER ","AUVERGNE","AUVERGNE",,"7","Investissements dans les entreprises directement liées à la recherche et l'innovation (...)"
"Cybermassif","Diagnostic des usages TIC dans les PME/PMI auvergnates","115,000 €","34,500 €","FEDER ","AUVERGNE","AUVERGNE",,"14","Services et applications pour les PME (commerce électronique, éducation et formation, mise en réseau, etc.)"
"Ecole Nationale Supérieure de Chimie de Clermont Ferrand","Bourse innovation - CDD - Commercialisation d'agents anticancéreux capables de détruire sélectivement la vascularisation tumorale","45,950 €","20,678 €","FEDER ","AUVERGNE","AUVERGNE",,"1","Activités R&DT dans centres de recherche"
"Ecole Nationale Supérieure de Chimie de Clermont Ferrand","Bourse innovation - Thèse - Recherche et évaluation d'antalgiques originaux: les activateurs des canaux potassiques trek 1,2 et traak","86,000 €","38,700 €","FEDER ","AUVERGNE","AUVERGNE",,"1","Activités R&DT dans centres de recherche"
"Ecole Nationale Supérieure de Chimie de Clermont Ferrand","Valorisation des déchets de thuya: une nouvelle source de production d'ambrox","65,500 €","29,000 €","FEDER ","AUVERGNE","AUVERGNE",,"1","Activités R&DT dans centres de recherche"
"EHPAD (Etablissement d'Hébergement pour Personnes Agées Dépendantes) de Chaudes-Aigues","Installation d'une chaudière bois","275,355 €","43,318 €","FEDER ","AUVERGNE","AUVERGNE",,"41","Energie renouvelable: biomasse"
"EHPAD PIERRE HERBECQ","Production d'eau chaude sanitaire au moyen de l'énergie solaire","25,221 €","6,103 €","FEDER ","AUVERGNE","AUVERGNE",,"40","Energie renouvelable: én. solaire"
"ELASTOPOLE","Préparation des entreprises auvergnates du secteur caoutchouc à la réglementation européenne REACH","296,490 €","97,278 €","FEDER ","AUVERGNE","AUVERGNE",,"5","Services de soutien avancé aux sociétés et groupes de sociétés"
"ENITA (Ecole d'Ingénieurs des Travaux Agricoles)","CRAIG - Acquisition d'un référentiel géographique à l'échelle de la Région Auvergne et mise en oeuvre site internet","232,232 €","69,670 €","FEDER ","AUVERGNE","AUVERGNE",,"13","Services et applications pour les citoyens (santé, gouvernement, formation en ligne, participation de tous à la société de l'information, etc.)"
"ENITA (Ecole d'Ingénieurs des Travaux Agricoles)","CRAIG : Réalisation d'une orthophotographie sur les départements du Puy-de-Dôme et de l'Allier","423,794 €","127,138 €","FEDER ","AUVERGNE","AUVERGNE",,"13","Services et applications pour les citoyens (santé, gouvernement, formation en ligne, participation de tous à la société de l'information, etc.)"
"ENITA (Ecole d'Ingénieurs des Travaux Agricoles)","Développement de la Plate-forme d'appui technologique aux entreprises régionales pour la période 200","331,756 €","165,878 €","FEDER ","AUVERGNE","AUVERGNE",,"3","Transfert de technologie et amélioration des réseaux de coopération..."
"ENITA (Ecole d'Ingénieurs des Travaux Agricoles)","Investissements 2008 pour T3A (volets 1, 2 et 3)","266,786 €","120,000 €","FEDER ","AUVERGNE","AUVERGNE",,"1","Activités R&DT dans centres de recherche"
"ENITA (Ecole d'Ingénieurs des Travaux Agricoles)","T3A 2009 - Acquisition d'équipements scientifiques","27,998 €","10,339 €","FEDER ","AUVERGNE","AUVERGNE",,"1","Activités R&DT dans centres de recherche"
"ENITA (Ecole d'Ingénieurs des Travaux Agricoles)","Territoires, Agriculture et Alimentation en Auvergne","88,168 €","20,000 €","FEDER ","AUVERGNE","AUVERGNE",,"2","Infrastructure R&DT et centres de compétence pour des technologies spécifiques"
"Entreprises pour l'Environnement et l'Innovation en Auvergne","Création de l'association E2IA (Entreprises pour l'Environnement et l'Innovation en Auvergne)","425,731 €","135,000 €","FEDER ","AUVERGNE","AUVERGNE",,"5","Services de soutien avancé aux sociétés et groupes de sociétés"
"ERASTEEL COMMENTRY","Récupération, déshuilage et valorisation des déchets de tournures d'aciers rapides","2,683,119 €","715,051 €","FEDER ","AUVERGNE","AUVERGNE",,"8","Autres investissements en entreprises"
"ES3","Mise en place d'actions collectives pour les entreprises de plasturgie de Haute-Loire","103,431 €","25,000 €","FEDER ","AUVERGNE","AUVERGNE",,"5","Services de soutien avancé aux sociétés et groupes de sociétés"
"ESEPAC Ecole Supérieure des Professions de l'Emballage et du Conditionnement","Construction d'un bâtiment à vocation pédagogique pour l'ESEPAC","2,095,727 €","297,877 €","FEDER ","AUVERGNE","AUVERGNE",,"8","Autres investissements en entreprises"
"Etablissement public Loire","Etude  inventaire pour la préservation des zones humides ","100,000 €","17,980 €","FEDER ","AUVERGNE","AUVERGNE",,"51","Promotion de la biodiversité et protection de la nature (y compris Natura 2000)"
"Etablissements BONHOMME","Mise en place d'une plate-forme bois énergie dans une scierie du Cantal","169,664 €","9,908 €","FEDER ","AUVERGNE","AUVERGNE",,"41","Energie renouvelable: biomasse"
"EUROPHARTECH","Développement d'un nouveau process de séchage par micro-ondes pour la fabrication de médicaments.","368,257 €","110,000 €","FEDER ","AUVERGNE","AUVERGNE",,"7","Investissements dans les entreprises directement liées à la recherche et l'innovation (...)"
"Fédération française de la coutellerie","Promotion de la marque collective  Esprit de Thiers ","548,421 €","219,368 €","FEDER ","AUVERGNE","AUVERGNE",,"5","Services de soutien avancé aux sociétés et groupes de sociétés"
"Fondation pour les Etudes et Recherches sur le Développement International (FERDI)","Acquisition et aménagement de locaux pour développer les activités de recherche de la FERDI","572,232 €","184,116 €","FEDER ","AUVERGNE","AUVERGNE",,"1","Activités R&DT dans centres de recherche"
"GDF SUEZ ENERGIE SERVICES- COFELY","Réalisation d'un réseau de chaleur biomasse sur la commune du Mayet de Montagne","1,562,620 €","154,572 €","FEDER ","AUVERGNE","AUVERGNE",,,
"Green City","Projet de développement de l'entreprise","721,133 €","108,170 €","FEDER ","AUVERGNE","AUVERGNE",,"6","Soutien aux PME pour la promotion de produits et processus de fabrication écologiques (...)"
"GREENTECH","Développement de nouvelles biomolécules actives pour la dermocosmétique.","363,560 €","145,000 €","FEDER ","AUVERGNE","AUVERGNE",,"7","Investissements dans les entreprises directement liées à la recherche et l'innovation (...)"
"HEALTHGRID","Organisation du 3ème Forum des utilisateurs de grilles de calculs scientifiques (projet européen EGE","77,532 €","25,818 €","FEDER ","AUVERGNE","AUVERGNE",,"9","Autres mesures pour stimuler la recherche, l'innovation et l'esprit d'entreprise dans les PME"
"ICARE","Création d'un système d'information numérique pour la gestion dynamique des données expérimentales de l'entreprise ICARE - AAP Bioinformatique","72,853 €","20,000 €","FEDER ","AUVERGNE","AUVERGNE",,"5","Services de soutien avancé aux sociétés et groupes de sociétés"
"IMAXIO","Création d'une plate-forme de génotypage et séquençage à haut débit en Auvergne","464,614 €","69,692 €","FEDER ","AUVERGNE","AUVERGNE",,"9","Autres mesures pour stimuler la recherche, l'innovation et l'esprit d'entreprise dans les PME"
"IMAXIO","Développement et validation d'un test moléculaire pour l'étude de gènes de prédispositon héréditaire au cancer du sein BRCAI et BRCA2.","221,701 €","88,000 €","FEDER ","AUVERGNE","AUVERGNE",,"7","Investissements dans les entreprises directement liées à la recherche et l'innovation (...)"
"INRA","Système d'Information et d'Analyse de Génomes de Pathogènes (SIAGe-Pathogènes)","520,336 €","91,500 €","FEDER ","AUVERGNE","AUVERGNE",,"5","Services de soutien avancé aux sociétés et groupes de sociétés"
"Institut Français de Mécanique Avancée (IFMA)","Bourse innovation - thèse - Développement des méthodes probabilistes pour la cotation fonctionnelle en vue d'un outil métier","72,800 €","32,550 €","FEDER ","AUVERGNE","AUVERGNE",,"1","Activités R&DT dans centres de recherche"
"Institut Français de Mécanique Avancée (IFMA)","Soutien à la plate-forme de transfert de technologie Méc@prod (investissements - année 2009)","278,426 €","111,370 €","FEDER ","AUVERGNE","AUVERGNE",,"3","Transfert de technologie et amélioration des réseaux de coopération..."
"Institut National de la Recherche Agronomique","Actualisation des documents de communication du Centre INRA de Clermont-Ferrand _ Theix","26,137 €","8,625 €","FEDER ","AUVERGNE","AUVERGNE",,"9","Autres mesures pour stimuler la recherche, l'innovation et l'esprit d'entreprise dans les PME"
"Institut National de la Recherche Agronomique","Bourse doctorale pour T3A (action 2, volet 2)  Modélisation de l'élaboration de la performance de reproduction des vaches allaitantes ","68,408 €","24,726 €","FEDER ","AUVERGNE","AUVERGNE",,"1","Activités R&DT dans centres de recherche"
"Institut National de la Recherche Agronomique","Bourse innovation -thèse- Modélisation de voies métaboliques et de leurs régulations transcriptionnelles","60,726 €","22,331 €","FEDER ","AUVERGNE","AUVERGNE",,"1","Activités R&DT dans centres de recherche"
"Institut National de la Recherche Agronomique","Bourse Post-doctorale 2008 T3A - Volet 2 Action 3","41,000 €","12,800 €","FEDER ","AUVERGNE","AUVERGNE",,"1","Activités R&DT dans centres de recherche"
"Institut National de la Recherche Agronomique","Bourse post-doctorale dans le cadre du projet SANTÉ (action 1 : Nutrition et Cancer)","50,000 €","20,000 €","FEDER ","AUVERGNE","AUVERGNE",,"1","Activités R&DT dans centres de recherche"
"Institut National de la Recherche Agronomique","Bourses thèse 2008 T3A - volet 3 action 3","60,000 €","15,000 €","FEDER ","AUVERGNE","AUVERGNE",,"1","Activités R&DT dans centres de recherche"
"Institut National de la Recherche Agronomique","Environnement 2007","90,506 €","32,709 €","FEDER ","AUVERGNE","AUVERGNE",,"2","Infrastructure R&DT et centres de compétence pour des technologies spécifiques"
"Institut National de la Recherche Agronomique","Environnement 2008 - Bourse post-doctorale - Action de recherche n°5","42,000 €","13,600 €","FEDER ","AUVERGNE","AUVERGNE",,"1","Activités R&DT dans centres de recherche"
"Institut National de la Recherche Agronomique","Environnement 2008 (équipements)","34,587 €","10,065 €","FEDER ","AUVERGNE","AUVERGNE",,"1","Activités R&DT dans centres de recherche"
"Institut National de la Recherche Agronomique","INNOVAPOLE 2008 (équipements)","24,832 €","10,442 €","FEDER ","AUVERGNE","AUVERGNE",,"1","Activités R&DT dans centres de recherche"
"Institut National de la Recherche Agronomique","Innov@pôle 2007","55,255 €","23,018 €","FEDER ","AUVERGNE","AUVERGNE",,"1","Activités R&DT dans centres de recherche"
"Institut National de la Recherche Agronomique","Investissement 2008 pour T3A (volets 1,2,3 et 4)","2,493,542 €","1,000,154 €","FEDER ","AUVERGNE","AUVERGNE",,"2","Infrastructure R&DT et centres de compétence pour des technologies spécifiques"
"Institut National de la Recherche Agronomique","Territoires, agriculture et alimentation en Auvergne ","2,920,375 €","1,314,169 €","FEDER ","AUVERGNE","AUVERGNE",,"2","Infrastructure R&DT et centres de compétence pour des technologies spécifiques"
"INTERLAB","Extension de l'unité de recherche de Interlab ","218,174 €","98,178 €","FEDER ","AUVERGNE","AUVERGNE",,"4","Soutien à la R&DT, en particulier dans les PME (y compris accès à des services de R&DT dans les centres de recherche)"
"ISSOIRE COMMUNAUTE","Etude sur le projet POLYDYAM","23,561 €","8,246 €","FEDER ","AUVERGNE","AUVERGNE",,"5","Services de soutien avancé aux sociétés et groupes de sociétés"
"Jacquet Panification","Doublement de l'usine de fabrication à Saint Beauzire","24,748,250 €","800,000 €","FEDER ","AUVERGNE","AUVERGNE",,"7","Investissements dans les entreprises directement liées à la recherche et l'innovation (...)"
"JET CUT","Développement de l'exportation sur des techniques de découpe innovantes","201,993 €","75,000 €","FEDER ","AUVERGNE","AUVERGNE",,"7","Investissements dans les entreprises directement liées à la recherche et l'innovation (...)"
"JET CUT","Prototype combiné usinage grande vitesse / jet d'eau 5 axes grandes dimensions","1,522,941 €","161,279 €","FEDER ","AUVERGNE","AUVERGNE",,"7","Investissements dans les entreprises directement liées à la recherche et l'innovation (...)"
"Jeune Chambre Economique de la Plasturgie","Action collective d'encouragement aux projets d'innovation des PME du secteur de la plasturgie","248,559 €","70,000 €","FEDER ","AUVERGNE","AUVERGNE",,"5","Services de soutien avancé aux sociétés et groupes de sociétés"
