"JOUBERT PRODUCTIONS","Gamme optimisée d'accessoires sécurisant l'usage de sangles textiles tressées destinées aux marchés nord-américains.","182,525 €","54,246 €","FEDER ","AUVERGNE","AUVERGNE",,"7","Investissements dans les entreprises directement liées à la recherche et l'innovation (...)"
"LABORATOIRE REGIONAL DES PONTS ET CHAUSSEES","Innovapôle 2008 (équipements)","60,226 €","25,415 €","FEDER ","AUVERGNE","AUVERGNE",,"1","Activités R&DT dans centres de recherche"
"LABORATOIRE REGIONAL DES PONTS ET CHAUSSEES","Innov@pôle 2007","34,967 €","13,862 €","FEDER ","AUVERGNE","AUVERGNE",,"1","Activités R&DT dans centres de recherche"
"LABORATOIRES CYCLOPHARMA","Développement de nouvelles structures hétéro-aromatiques halogénées pour l'imagerie par TEP et la radiothérapie interne vectorisée du mélanome ","170,100 €","68,000 €","FEDER ","AUVERGNE","AUVERGNE",,"3","Transfert de technologie et amélioration des réseaux de coopération..."
"La Gerbe d'Or","Construction d'un bâtiment industriel à usage de boulangerie sur le biopôle Clermont-Limagne à Saint","2,115,463 €","90,000 €","FEDER ","AUVERGNE","AUVERGNE",,"7","Investissements dans les entreprises directement liées à la recherche et l'innovation (...)"
"Les Petits Débrouillards Auvergne","UniverCités","30,232 €","10,067 €","FEDER ","AUVERGNE","AUVERGNE",,"9","Autres mesures pour stimuler la recherche, l'innovation et l'esprit d'entreprise dans les PME"
"LIMAGRAIN VERNEUIL HOLDING","Recherche de marqueurs moléculaires pour les céréales Blé et Maïs","1,088,919 €","544,460 €","FEDER ","AUVERGNE","AUVERGNE",,"7","Investissements dans les entreprises directement liées à la recherche et l'innovation (...)"
"LIMAGRAIN VERNEUIL HOLDING","Territoires, Agriculture et Alimentation en Auvergne","347,659 €","156,447 €","FEDER ","AUVERGNE","AUVERGNE",,"4","Soutien à la R&DT, en particulier dans les PME (y compris accès à des services de R&DT dans les centres de recherche)"
"LOGOLEXIE","Développement d'un outil d'enregistrement et de transcription multiformat et multilingue des interventions orales ","255,144 €","100,000 €","FEDER ","AUVERGNE","AUVERGNE",,"7","Investissements dans les entreprises directement liées à la recherche et l'innovation (...)"
"LPO AUVERGNE","Améliorer nos connaissances sur la faune vertébrée terrestre d'Auvergne et les faire partager","362,500 €","145,000 €","FEDER ","AUVERGNE","AUVERGNE",,"51","Promotion de la biodiversité et protection de la nature (y compris Natura 2000)"
"Lycée Claude Mercier","Aide à la mise en place de la Plate-forme Technologique Forbois@uvergne sur le site du Mayet de Mont","108,419 €","32,526 €","FEDER ","AUVERGNE","AUVERGNE",,"3","Transfert de technologie et amélioration des réseaux de coopération..."
"Lycée Claude Mercier","Aide à la mise en place de la Plate-forme Technologique Forbois@uvergne sur le site du Mayet de Mont","281,060 €","70,000 €","FEDER ","AUVERGNE","AUVERGNE",,"3","Transfert de technologie et amélioration des réseaux de coopération..."
"Maison d'enfants les Ecureuils","Installation d'une chaufferie bois pour deux bâtiments d'accueil d'enfants","101,583 €","24,380 €","FEDER ","AUVERGNE","AUVERGNE",,"41","Energie renouvelable: biomasse"
"Maison de retraite d'Arlanc","Installation d'une chaudière bois","540,000 €","129,600 €","FEDER ","AUVERGNE","AUVERGNE",,"41","Energie renouvelable: biomasse"
"METABOLIC EXPLORER","Aide au partenariat technologique dans le cadre du programme ISI Bio2Chem.","62,990 €",,"FEDER ","AUVERGNE","AUVERGNE",,"7","Investissements dans les entreprises directement liées à la recherche et l'innovation (...)"
"METABOLIC EXPLORER"," Analyse de la faisabilité scientifique, technique et de l'intérêt économique de nouveaux bioprocédés de bioconversion de molécules de la chimie de commodité.","263,647 €",,"FEDER ","AUVERGNE","AUVERGNE",,"7","Investissements dans les entreprises directement liées à la recherche et l'innovation (...)"
"METABOLIC EXPLORER","Extension des moyens de recherche et développement","1,481,632 €","296,326 €","FEDER ","AUVERGNE","AUVERGNE",,"4","Soutien à la R&DT, en particulier dans les PME (y compris accès à des services de R&DT dans les centres de recherche)"
"METABOLIC EXPLORER","Projet de développement  : équipement pour l'unité de production pilote","3,804,400 €","270,000 €","FEDER ","AUVERGNE","AUVERGNE",,"9","Autres mesures pour stimuler la recherche, l'innovation et l'esprit d'entreprise dans les PME"
"Monsieur et Madame ENJOLRAS Claude","Installation de production d'eau chaude sanitaire solaire","20,027 €","3,021 €","FEDER ","AUVERGNE","AUVERGNE",,"40","Energie renouvelable: én. solaire"
"Natixis Lease - Bail Matériel","Acquisition d'équipements de broyage et de criblage pour la production de plaquettes bois","964,221 €","115,707 €","FEDER ","AUVERGNE","AUVERGNE",,"41","Energie renouvelable: biomasse"
"Natixis Lease - Bail Matériel","Acquisition d'un broyeur de bois en crédit-bail pour la société ABE (Auvergne Bois Energie) ","355,000 €","49,700 €","FEDER ","AUVERGNE","AUVERGNE",,"41","Energie renouvelable: biomasse"
"NERGECO","Optimisation d'une nouvelle génération de Portes de Productivité dotée des systèmes d'écrans souples intelligents","429,881 €","150,000 €","FEDER ","AUVERGNE","AUVERGNE",,"7","Investissements dans les entreprises directement liées à la recherche et l'innovation (...)"
"N.S.E. INTEGRATIONS","Maintenance de câblages civils et militaires dans le domaine aéronautique pour les marchés africains.","252,820 €","75,000 €","FEDER ","AUVERGNE","AUVERGNE",,"7","Investissements dans les entreprises directement liées à la recherche et l'innovation (...)"
"NUMTECH","Accompagnement dans le cadre du montage d'un projet européen FP7-SME'S CAPACITIES PROGRAMME.","41,400 €",,"FEDER ","AUVERGNE","AUVERGNE",,"7","Investissements dans les entreprises directement liées à la recherche et l'innovation (...)"
"NUMTECH","Développement d'une plate-forme opérationnelle pour la gestion des risques environnementaux (projet collaboratif)","654,357 €","234,950 €","FEDER ","AUVERGNE","AUVERGNE",,"4","Soutien à la R&DT, en particulier dans les PME (y compris accès à des services de R&DT dans les centres de recherche)"
"OPAC de Commentry","Installation solaire pour la production d'ECS dans 19 logements locatifs","32,282 €","5,592 €","FEDER ","AUVERGNE","AUVERGNE",,"40","Energie renouvelable: én. solaire"
"OSEO Innovation","Assistance technique pour les années 2008-2009","234,446 €","199,279 €","FEDER ","AUVERGNE","AUVERGNE",,"85","Préparation, mise en oeuvre, suivi et inspection "
"OSEO Innovation","Expertise pour l'évaluation et l'accompagnement des projets dans leur recherche industrielle (2008)","100,000 €","50,000 €","FEDER ","AUVERGNE","AUVERGNE",,"9","Autres mesures pour stimuler la recherche, l'innovation et l'esprit d'entreprise dans les PME"
"Parc naturel régional des volcans d'Auvergne","Aménagement des cheminements et réhabilitation des zones dégradées - Chaîne des Puys - 2ème tranche","200,000 €","63,800 €","FEDER ","AUVERGNE","AUVERGNE",,"56","Protection et valorisation du patrimoine naturel"
"Parc naturel régional des volcans d'Auvergne","Définition des connectivités et fonctionnalités écologiques du territoire du parc et sensibilisation","124,460 €","48,515 €","FEDER ","AUVERGNE","AUVERGNE",,"51","Promotion de la biodiversité et protection de la nature (y compris Natura 2000)"
"Parc naturel régional des volcans d'Auvergne","Elaboration du schéma paysager à l'échelle du PNR des Volcans d'Auvergne","59,800 €","19,076 €","FEDER ",,,,"56","Protection et valorisation du patrimoine naturel"
"Parc Naturel Régional Livradois-Forez","Etude des réseaux écologiques du PNR Livradois Forez","39,917 €","12,000 €","FEDER ","AUVERGNE","AUVERGNE",,"51","Promotion de la biodiversité et protection de la nature (y compris Natura 2000)"
"PLASTYROBEL","Etude de faisabilité préalable au développement de matériaux d'emballage moulés compostables.","35,060 €",,"FEDER ","AUVERGNE","AUVERGNE",,"7","Investissements dans les entreprises directement liées à la recherche et l'innovation (...)"
"Pôle d'assistance à l'innovation et au développement économique du Pays d'Issoire Val d'Allier Sud","Sessions d'accompagnement à l'innovation","5,680 €","1,892 €","FEDER ","AUVERGNE","AUVERGNE",,"9","Autres mesures pour stimuler la recherche, l'innovation et l'esprit d'entreprise dans les PME"
"Pôle de recherche et d'enseignement supérieur de Clermont-ferrand","études préalables à la mise en valeur des  herbiers universitaires","23,450 €","9,380 €","FEDER ","AUVERGNE","AUVERGNE",,"51","Promotion de la biodiversité et protection de la nature (y compris Natura 2000)"
"Pôle technologique d'Auvergne C.A.S.I.M.I.R.","Activité 2008 du Réseau de Développement Technologique d'Auvergne","190,129 €","80,000 €","FEDER ","AUVERGNE","AUVERGNE",,"3","Transfert de technologie et amélioration des réseaux de coopération..."
"Pôle technologique d'Auvergne C.A.S.I.M.I.R.","Activité 2009 du Réseau de Développement Technologique d'Auvergne","182,630 €","80,000 €","FEDER ","AUVERGNE","AUVERGNE",,"3","Transfert de technologie et amélioration des réseaux de coopération..."
"Pôle technologique d'Auvergne C.A.S.I.M.I.R.","Appui aux missions d'animation et de réalisation d'opérations collectives","708,450 €","112,968 €","FEDER ","AUVERGNE","AUVERGNE",,"3","Transfert de technologie et amélioration des réseaux de coopération..."
"Pôle technologique d'Auvergne C.A.S.I.M.I.R.","Appui aux missions de transfert de technologies (année 2009)","549,229 €","274,614 €","FEDER ","AUVERGNE","AUVERGNE",,"3","Transfert de technologie et amélioration des réseaux de coopération..."
"Pôle technologique d'Auvergne C.A.S.I.M.I.R.","Etude du potentiel de développement des nanomatériaux en Région Auvergne","68,250 €","27,300 €","FEDER ","AUVERGNE","AUVERGNE",,"3","Transfert de technologie et amélioration des réseaux de coopération..."
"Pôle technologique d'Auvergne C.A.S.I.M.I.R.","Projet DIFEX-BIO","72,232 €","14,446 €","FEDER ","AUVERGNE","AUVERGNE",,"5","Services de soutien avancé aux sociétés et groupes de sociétés"
"Pôle technologique d'Auvergne C.A.S.I.M.I.R.","Renforcement du dispositif de transfert de technologie de CASIMIR : investissements en matériel d'analyse et d'essais","188,501 €","75,400 €","FEDER ","AUVERGNE","AUVERGNE",,"3","Transfert de technologie et amélioration des réseaux de coopération..."
"Pôle technologique d'Auvergne C.A.S.I.M.I.R.","Renforcement du dispositif de transfert de technologie du pôle technologique CASIMIR","525,874 €","262,937 €","FEDER ","AUVERGNE","AUVERGNE",,"3","Transfert de technologie et amélioration des réseaux de coopération..."
"QUANTEL MEDICAL","Développements d'un dispositif adaptable aux lasers existants, introduisant la semi automatisation de la photocoagulation.","276,800 €","80,000 €","FEDER ","AUVERGNE","AUVERGNE",,"7","Investissements dans les entreprises directement liées à la recherche et l'innovation (...)"
"Réseau Entreprendre Auvergne","FETE DES LAUREATS 2008","12,382 €","5,349 €","FEDER ","AUVERGNE","AUVERGNE",,"5","Services de soutien avancé aux sociétés et groupes de sociétés"
"Réseau Entreprendre Auvergne","Fête des Lauréats 2009","19,455 €","6,810 €","FEDER ","AUVERGNE","AUVERGNE",,"5","Services de soutien avancé aux sociétés et groupes de sociétés"
"Réseau ferré de France","Etude projet pour l'amélioration de l'offre ferroviaire sur l'axe est ouest du périurbain de l'agglomération de Clermont-Ferrand","738,890 €","165,000 €","FEDER ","AUVERGNE","AUVERGNE",,"52","Promotion de transports urbains propres"
"Réseau ferré de France","Etudes Avant Projet de mise en accessibilité du PEI de Clermont-Ferrand","207,797 €","60,598 €","FEDER ","AUVERGNE","AUVERGNE",,"52","Promotion de transports urbains propres"
"Réseau ferré de France","Phase 1 de la modernisation de la relation ferroviaire entre Clermont-Fd et Aurillac","13,806,677 €","3,091,000 €","FEDER ","AUVERGNE","AUVERGNE",,"16","Rail"
"Réseau ferré de France","Phase 2 de la modernisation de la relation ferroviaire Clermont -Aurillac","21,250,530 €","3,317,710 €","FEDER ","AUVERGNE","AUVERGNE",,"16","Rail"
"RIOM COMMUNAUTE","Assistance à Maîtrise d'Ouvrage pour le réseau urbain de chaleur alimenté par une chaudière bois","35,968 €","8,710 €","FEDER ",,,,"41","Energie renouvelable: biomasse"
"SA E-Charlemagne","Développement d'une architecture spécifique internationale du logiciel KONOSYS.","346,896 €","145,000 €","FEDER ","AUVERGNE","AUVERGNE",,"7","Investissements dans les entreprises directement liées à la recherche et l'innovation (...)"
"SAGEM DEFENSE SECURITE","Projet CORIOLIS","49,630,000 €","2,300,000 €","FEDER ","AUVERGNE","AUVERGNE",,"7","Investissements dans les entreprises directement liées à la recherche et l'innovation (...)"
"SA HLM Interrégionale POLYGONE","Installation de capteurs solaires dans le cadre de la construction de l'EHPAD  La Maisonnée  à Aurillac","64,253 €","13,680 €","FEDER ","AUVERGNE","AUVERGNE",,,
"SA MATIERE","Poutres-caissons métlliques modulaires UNIBRIDGE R préfabriquées à l'appontement maritime temporaire","344,999 €","137,000 €","FEDER ","AUVERGNE","AUVERGNE",,"7","Investissements dans les entreprises directement liées à la recherche et l'innovation (...)"
"SARL 100 % Pure Auvergne","Création d'un écolodge sur le site du Lac du Pêcher, à Chavagnac","399,943 €","65,000 €","FEDER ","AUVERGNE","AUVERGNE",,"61","Projets intégrés de réhabilitation urbaine et rurale"
"SARL Château La Grange-Fort","Réalisation d'une installation de production d'ECS par Energie Solaire Thermique dans le camping de ","28,651 €","4,584 €","FEDER ","AUVERGNE","AUVERGNE",,"40","Energie renouvelable: én. solaire"
"SARL C.J.L.C.F.C.","Création du Family Center dédié à la remise en forme et aux jeux pour enfants","517,427 €","56,700 €","FEDER ","AUVERGNE","AUVERGNE",,"8","Autres investissements en entreprises"
"SARL Le bonheur dans le pré","Installation d'une chaudière à plaquettes bois dans le cadre d'un projet de construction de gîte de séjours","47,865 €","5,265 €","FEDER ","AUVERGNE","AUVERGNE",,"41","Energie renouvelable: biomasse"
"SARL MOURGUES CHARPENTES","Mise en place d'une plateforme bois énergie pour la scierie SARL MOURGUES CHARPENTES","46,765 €","3,741 €","FEDER ","AUVERGNE","AUVERGNE",,"41","Energie renouvelable: biomasse"
"SARL SOGHESTEL INVESTISSEMENT","Aménagement du complexe touristique  Hôtel de Paris , à Moulins","4,565,222 €","227,604 €","FEDER ","AUVERGNE","AUVERGNE",,"61","Projets intégrés de réhabilitation urbaine et rurale"
"SARL TOURLAN","Mise en place d'une plateforme bois énergie pour la scierie SARL TOURLAN","51,120 €","4,090 €","FEDER ","AUVERGNE","AUVERGNE",,"41","Energie renouvelable: biomasse"
"SAS LABORATOIRES LYOCENTRE","Développement de l'activité probiotique - Partie R&D","363,200 €","150,000 €","FEDER ","AUVERGNE","AUVERGNE",,"4","Soutien à la R&DT, en particulier dans les PME (y compris accès à des services de R&DT dans les centres de recherche)"
"SGAR Auvergne","Dépenses liées à la mise en oeuvre du programme 2007-2015","200,000 €","200,000 €","FEDER ","AUVERGNE","AUVERGNE",,"85","Préparation, mise en oeuvre, suivi et inspection "
"SGAR Auvergne","Dépenses liées à l'évaluation du programme 2007-2015 ","600,000 €","600,000 €","FEDER ","AUVERGNE","AUVERGNE",,"86","Evaluation et études; information et communication"
"SGAR Auvergne","Elaboration de la stratégie régionale de l'innovation en Auvergne","335,753 €","335,753 €","FEDER ","AUVERGNE","AUVERGNE",,"9","Autres mesures pour stimuler la recherche, l'innovation et l'esprit d'entreprise dans les PME"
"SGAR Auvergne","Plan de communication pour le programme  Compétitivité Régionale et Emploi ","734,000 €","734,000 €","FEDER ","AUVERGNE","AUVERGNE",,"85","Préparation, mise en oeuvre, suivi et inspection "
"SGAR Auvergne","Salaires assistants techniques 2007-2015","2,000,000 €","2,000,000 €","FEDER ","AUVERGNE","AUVERGNE",,"85","Préparation, mise en oeuvre, suivi et inspection "
"SGAR Auvergne","Salaires des agents de l'Etat 2007-2015 - Contreparties","1,000,000 €",0 €,"FEDER ","AUVERGNE","AUVERGNE",,"85","Préparation, mise en oeuvre, suivi et inspection "
"S.I. des Equipements Scolaires et Sportifs du collège de Bellenaves","Extension du réseau de chaleur de Bellenaves","260,285 €","62,468 €","FEDER ","AUVERGNE","AUVERGNE",,"41","Energie renouvelable: biomasse"
"S.N.C Elyo Centre-Est Méditerranée","Réalisation d'un réseau de chaleur biomasse sur la commune de Rochefort-Montagne","2,544,797 €","610,751 €","FEDER ","AUVERGNE","AUVERGNE",,"41","Energie renouvelable: biomasse"
"SOCIETE COOPERATIVE AGRICOLE DU PUY DE DOME","Etude de faisabilité d'un procédé industriel de détoxification des mycotoxines sur grain : conception d'un prototype de machine de lavage et brossage","45,670 €",,"FEDER ","AUVERGNE","AUVERGNE",,"7","Investissements dans les entreprises directement liées à la recherche et l'innovation (...)"
"Société de Granulés d'Arlanc","Création d'une entreprise de fabrication de granulés de bois","2,891,785 €","257,947 €","FEDER ","AUVERGNE","AUVERGNE",,"41","Energie renouvelable: biomasse"
"Société Eskiss Packaging","Machine de remplissage liquide poudre et granulé","351,993 €","140,000 €","FEDER ","AUVERGNE","AUVERGNE",,"7","Investissements dans les entreprises directement liées à la recherche et l'innovation (...)"
"SOFIMAC PARTNERS","Fonds JEREMIE-Auvergne (partie économie  classique )","7,000,000 €","5,000,000 €","FEDER ","AUVERGNE","AUVERGNE",,"9","Autres mesures pour stimuler la recherche, l'innovation et l'esprit d'entreprise dans les PME"
"SOFIMAC PARTNERS","Fonds JEREMIE-Auvergne (partie Innovation)","18,200,000 €","13,000,000 €","FEDER ","AUVERGNE","AUVERGNE",,"9","Autres mesures pour stimuler la recherche, l'innovation et l'esprit d'entreprise dans les PME"
"SOL SOLUTION","Développement d'une gamme de pénétromètres dynamiques en vue de leur commercialisation sur les marchés français et internationaux.","368,892 €","140,000 €","FEDER ","AUVERGNE","AUVERGNE",,"7","Investissements dans les entreprises directement liées à la recherche et l'innovation (...)"
"SORMEA","Développement d'un système d'analyse comportemental de franchissement de tous types de feux de circulation.","95,743 €","38,881 €","FEDER ","AUVERGNE","AUVERGNE",,"7","Investissements dans les entreprises directement liées à la recherche et l'innovation (...)"
"Star Lease","Création d'une unité de fabrication de Bois Massif Collés","2,055,000 €","150,000 €","FEDER ","AUVERGNE","AUVERGNE",,"5","Services de soutien avancé aux sociétés et groupes de sociétés"
"SYDEC Allier-Allagnon ( Syndicat Mixte de Développement Économique)","Création d'un Pôle d'Excellence Rurale PRACTIS (Pôle Rural d'Activités TIC et de Services)","1,641,250 €","330,343 €","FEDER ","AUVERGNE","AUVERGNE",,"5","Services de soutien avancé aux sociétés et groupes de sociétés"
"SYMEOS","Développement d'une solution d'identification électronique par mot de passe à usage unique. ","150,665 €","62,526 €","FEDER ","AUVERGNE","AUVERGNE",,"7","Investissements dans les entreprises directement liées à la recherche et l'innovation (...)"
"Syndicat Mixte des Eaux de l'Allier","Etude des captages prioritaires du département de l'Allier","200,000 €","60,000 €","FEDER ","AUVERGNE","AUVERGNE",,"54","Autres mesures pour protéger l'environnement et prévenir les risques"
"Syndicat Mixte du Puy Mary","Aménagement Paysager et Touristique d'une aire  d'accueil à St Cirgues de Jordanne  ( tranche 1)","96,500 €","30,783 €","FEDER ","AUVERGNE","AUVERGNE",,"56","Protection et valorisation du patrimoine naturel"
"Syndicat Mixte du Puy Mary","Etude d'aménagement du Site Naturel de Récusset à Saint Paul de Salers ","30,151 €","9,618 €","FEDER ","AUVERGNE","AUVERGNE",,"56","Protection et valorisation du patrimoine naturel"
"Syndicat Mixte du Puy Mary","Mise en place de la Charte Signalétique du PNRVA sur le Grand Site du Puy Mary - Tranche 1: Jalonnem","62,643 €","19,983 €","FEDER ","AUVERGNE","AUVERGNE",,"56","Protection et valorisation du patrimoine naturel"
"Syndicat Mixte du Puy Mary","Réhabilitation du Centre d'accueil et d'interprétation de Dienne","1,273,083 €","362,194 €","FEDER ","AUVERGNE","AUVERGNE",,"56","Protection et valorisation du patrimoine naturel"
"Syndicat Mixte du Puy Mary","Réhabilitation du Centre d'accueil et d'interprétation de Mandaillles","462,381 €","118,750 €","FEDER ","AUVERGNE","AUVERGNE",,"56","Protection et valorisation du patrimoine naturel"
"Syndicat Mixte du Puy Mary","Sentiers de randonnée","240,000 €","70,200 €","FEDER ","AUVERGNE","AUVERGNE",,"56","Protection et valorisation du patrimoine naturel"
"SYSTEME D'INFORMATIONS MEDICALES PARTAGEES EN AUVERGNE","projet SIMPA : plate-forme régionale de télésanté en région Auvergne","671,502 €","181,977 €","FEDER ","AUVERGNE","AUVERGNE",,"13","Services et applications pour les citoyens (santé, gouvernement, formation en ligne, participation de tous à la société de l'information, etc.)"
"TARRERIAS BONJEAN","Innovation technologique concernant la qualité et la durée de vie de coupe","953,900 €","116,375 €","FEDER ","AUVERGNE","AUVERGNE",,"7","Investissements dans les entreprises directement liées à la recherche et l'innovation (...)"
"TEDRAL","USINE PILOTE POUR L'ENVIRONNEMENT ET LE DEVELOPPEMENT DURABLE","495,000 €","49,500 €","FEDER ","AUVERGNE","AUVERGNE",,"40","Energie renouvelable: én. solaire"
"TIGER PROCESS","Développement d'un robot de soudage intégré en vue des marchés domestiques et internationaux.","166,140 €","65,592 €","FEDER ","AUVERGNE","AUVERGNE",,"7","Investissements dans les entreprises directement liées à la recherche et l'innovation (...)"
"UNIFERGIE","Création d'une unité de granulation bois pour Moulins Bois Energie","5,537,000 €","630,000 €","FEDER ","AUVERGNE","AUVERGNE",,"9","Autres mesures pour stimuler la recherche, l'innovation et l'esprit d'entreprise dans les PME"
"Union Immobilière des Organismes de Sécurité Sociale du Cantal","Installation d'une chaudière bois","370,347 €","56,594 €","FEDER ","AUVERGNE","AUVERGNE",,"41","Energie renouvelable: biomasse"
"Unité de Laboratoire en Ingéniérie Céréalière","Territoires, Agriculture et Alimentation en Auvergne","35,226 €","14,319 €","FEDER ","AUVERGNE","AUVERGNE",,"4","Soutien à la R&DT, en particulier dans les PME (y compris accès à des services de R&DT dans les centres de recherche)"
"Université Blaise Pascal","Acquisition d'une presse multi-enclumes pour le laboratoire Magmas et Volcans","588,400 €","116,300 €","FEDER ","AUVERGNE","AUVERGNE",,"2","Infrastructure R&DT et centres de compétence pour des technologies spécifiques"
"Université Blaise Pascal","Aménagement du 1er étage du chalet du Puy-de-Dôme","1,087,137 €","489,212 €","FEDER ","AUVERGNE","AUVERGNE",,"1","Activités R&DT dans centres de recherche"
"Université Blaise Pascal","AVUTEQ","67,233 €","29,920 €","FEDER ","AUVERGNE","AUVERGNE",,"9","Autres mesures pour stimuler la recherche, l'innovation et l'esprit d'entreprise dans les PME"
"Université Blaise Pascal","Bourse doctorale SANTE (Nutrition et cancer)  Interactions entre les voies de signalisation régulées par le récepteur des androgènes et les récepteurs des oxystérols dans la prostate normale et tumorale : effet d'un régime riche en lipides.","75,000 €","30,000 €","FEDER ","AUVERGNE","AUVERGNE",,"1","Activités R&DT dans centres de recherche"
"Université Blaise Pascal","Bourse innovation - CDD - Calcul parallèle sur GPU pour la modélisation atmosphérique","49,114 €","22,102 €","FEDER ","AUVERGNE","AUVERGNE",,"1","Activités R&DT dans centres de recherche"
"Université Blaise Pascal","Bourse innovation - CDD - Création d'une entreprise innovante réalisant des expertises sur la santé des arbres à partir de biocapteurs","46,535 €","20,940 €","FEDER ","AUVERGNE","AUVERGNE",,"1","Activités R&DT dans centres de recherche"
"Université Blaise Pascal","Bourse innovation - CDD - Développement d'un outil d'analyse intégrée de la durabilité globale des matières plastiques","39,488 €","17,770 €","FEDER ","AUVERGNE","AUVERGNE",,"1","Activités R&DT dans centres de recherche"
"Université Blaise Pascal","Bourse innovation - CDD - Mise en place d'un test de biodégradabilité de polyoléfines additivées pré-oxydées","42,900 €","19,305 €","FEDER ","AUVERGNE","AUVERGNE",,"1","Activités R&DT dans centres de recherche"
"Université Blaise Pascal","Bourse innovation-CDD- Production de monoxyde de carbone par plasma : valorisation du CO2, traitement de la biomasse","39,830 €","17,437 €","FEDER ","AUVERGNE","AUVERGNE",,"1","Activités R&DT dans centres de recherche"
"Université Blaise Pascal","Bourse innovation - CDD - TEXTILES : TEXTiles Imprégnés Luminescents pour applications en Eclairage de Substitution","38,750 €","17,437 €","FEDER ","AUVERGNE","AUVERGNE",,"1","Activités R&DT dans centres de recherche"
"Université Blaise Pascal","Bourse innovation - thèse -  AGROBETON  Conception d'un Eco matériau pour le génie civil","76,453 €","33,750 €","FEDER ","AUVERGNE","AUVERGNE",,"1","Activités R&DT dans centres de recherche"
