"GIP-FCIP ACADEMIE DE CAEN","Pôles d'insertion (2008-2009)",135331,135331,"FONDS SOCIAL EUROPEEN","BASSE-NORMANDIE",,"Programme opérationnel national Fonds social européen","73","Mesures pour renforcer la participation dans l'éducation et la formation tout au long de la vie..."
"GIP-FCIP ACADEMIE DE CAEN","Projet de communication VAE inter-valideurs en direction des entreprises, salariés et des syndicats",43667,19540,"FONDS SOCIAL EUROPEEN","BASSE-NORMANDIE",,"Programme opérationnel national Fonds social européen","73","Mesures pour renforcer la participation dans l'éducation et la formation tout au long de la vie..."
"GIP Maison Départementale des Personnes Handicapées du Calvados","Dématérialisation des dossiers de la Maison Départementale des Personnes Handicapées du Calvados",171830.42,68732.17,"FEDER ","BASSE-NORMANDIE","CALVADOS / CAEN / CAEN","PO FEDER 2007-2013","12","Technologies de l'information et la communication (RTE-TIC)"
"GRETA des Estuaires","Ingénierie pour le développement de positionnements pédagogiques FOAD",16067,7054,"FONDS SOCIAL EUROPEEN","BASSE-NORMANDIE",,"Programme opérationnel national Fonds social européen","72","Élaboration, introduction et mise en oeuvre de réformes dans les systèmes d'éducation et de formation..."
"GRETA des Estuaires","Pré qualification maquettisme, travail sur le projet, maintenance et hygiène des locaux-maison d'arr",89200,44600,"FONDS SOCIAL EUROPEEN","BASSE-NORMANDIE","MANCHE / COUTANCES / COUTANCES / COUTANCES","Programme opérationnel national Fonds social européen","71","Parcours d'insertion et de retour à l'emploi pour les personnes défavorisées..."
"GRETA des Estuaires","Pré-qualification Maquettisme, Travail sur le projet, Maintenance et Hygiène des locaux  Maison d'arrêt de Coutances ",90200,45100,"FONDS SOCIAL EUROPEEN","BASSE-NORMANDIE","MANCHE / COUTANCES / COUTANCES","Programme opérationnel national Fonds social européen","71","Parcours d'insertion et de retour à l'emploi pour les personnes défavorisées..."
"Greta du Calvados","Atelier de Formation de Base - Caen",97200,36466.2,"FONDS SOCIAL EUROPEEN","BASSE-NORMANDIE","CALVADOS","Programme opérationnel national Fonds social européen","71","Parcours d'insertion et de retour à l'emploi pour les personnes défavorisées..."
"Greta du Calvados","Atelier de Formation de Base - Caen",97200,36450,"FONDS SOCIAL EUROPEEN","BASSE-NORMANDIE","CALVADOS / CAEN / CAEN / CAEN","Programme opérationnel national Fonds social européen","71","Parcours d'insertion et de retour à l'emploi pour les personnes défavorisées..."
"Greta du Calvados","Ingénierie pour le développement de positionnements pédagogiques FOAD",17883,7869,"FONDS SOCIAL EUROPEEN","BASSE-NORMANDIE",,"Programme opérationnel national Fonds social européen","72","Élaboration, introduction et mise en oeuvre de réformes dans les systèmes d'éducation et de formation..."
"Greta du Calvados","Parcours Personnalisés vers l'Emploi",61600,24640,"FONDS SOCIAL EUROPEEN","BASSE-NORMANDIE","Multilocalisation","Programme opérationnel national Fonds social européen","71","Parcours d'insertion et de retour à l'emploi pour les personnes défavorisées..."
"GRETA du Cotentin","Ingénierie pour le développement de positionnements pédagogiques FOAD",12486,4503,"FONDS SOCIAL EUROPEEN","BASSE-NORMANDIE",,"Programme opérationnel national Fonds social européen","72","Élaboration, introduction et mise en oeuvre de réformes dans les systèmes d'éducation et de formation..."
"GRETA Sud Normandie","Atelier de formation de base",31590,9720,"FONDS SOCIAL EUROPEEN","BASSE-NORMANDIE","Multilocalisation","Programme opérationnel national Fonds social européen","71","Parcours d'insertion et de retour à l'emploi pour les personnes défavorisées..."
"GRETA Sud Normandie","Ingénierie pour le développement de positionnements pédagogiques FOAD",18112,7111,"FONDS SOCIAL EUROPEEN","BASSE-NORMANDIE","ORNE","Programme opérationnel national Fonds social européen","72","Élaboration, introduction et mise en oeuvre de réformes dans les systèmes d'éducation et de formation..."
"Groupe d'ETudes des Invertébrés Armoricains (GRETIA)","Structuration des connaissances sur les invertébrés bas-normands et soutien à l'animation de réseau",82500,33000,"FEDER ","BASSE-NORMANDIE",,"PO FEDER 2007-2013","51","Promotion de la biodiversité et protection de la nature (y compris Natura 2000)"
"Groupement Régional des Associations de Protection de l'Environnement (G.R.A.P.E)","Espace Info Energie 2008-2009",237283,124452,"FEDER ","BASSE-NORMANDIE",,"PO FEDER 2007-2013","41","Energie renouvelable: biomasse"
"Haras Nationaux","Concours EQUIDEFI",93841.14,37536,"FEDER ","BASSE-NORMANDIE",,"PO FEDER 2007-2013","5","Services de soutien avancé aux sociétés et groupes de sociétés"
"Haras Nationaux","Equi meeting maréchalerie",80000,32000,"FEDER ","BASSE-NORMANDIE","ORNE","PO FEDER 2007-2013","6","Soutien aux PME pour la promotion de produits et processus de fabrication écologiques (...)"
"HIPPOFACTO","Création d'une activité de petite restauration à emporter hippomobile (roulotte et percherons)",23000,18400,"FONDS SOCIAL EUROPEEN","BASSE-NORMANDIE","CALVADOS","Programme opérationnel national Fonds social européen","71","Parcours d'insertion et de retour à l'emploi pour les personnes défavorisées..."
"IMAGE DE SOI","Atelier  le look qui va bien pour mon entretien ",1946,1946,"FONDS SOCIAL EUROPEEN","BASSE-NORMANDIE","MANCHE / CHERBOURG","Programme opérationnel national Fonds social européen","71","Parcours d'insertion et de retour à l'emploi pour les personnes défavorisées..."
"INFREP Flers","Chantier Formation : Valorisation des publics en difficultés à travers la revalorisation du matériel informatique",61079,14862,"FONDS SOCIAL EUROPEEN","BASSE-NORMANDIE","ORNE / ALENCON / DOMFRONT","Programme opérationnel national Fonds social européen","71","Parcours d'insertion et de retour à l'emploi pour les personnes défavorisées..."
"INFREP Flers","Dispositif de lutte contre l'illéttrisme",69300,27225,"FONDS SOCIAL EUROPEEN","BASSE-NORMANDIE","Multilocalisation","Programme opérationnel national Fonds social européen","71","Parcours d'insertion et de retour à l'emploi pour les personnes défavorisées..."
"INFREP Flers","Dispositif de lutte contre l'illettrisme en Basse-Normandie",68893,28292,"FONDS SOCIAL EUROPEEN","BASSE-NORMANDIE","ORNE","Programme opérationnel national Fonds social européen","71","Parcours d'insertion et de retour à l'emploi pour les personnes défavorisées..."
"INFREP Mortagne","Ateliers de Formation de Base",24493,9690.1,"FONDS SOCIAL EUROPEEN","BASSE-NORMANDIE","ORNE","Programme opérationnel national Fonds social européen","71","Parcours d'insertion et de retour à l'emploi pour les personnes défavorisées..."
"INFREP Mortagne","Ateliers de Formation de Base",46170,17955,"FONDS SOCIAL EUROPEEN","BASSE-NORMANDIE","ORNE","Programme opérationnel national Fonds social européen","71","Parcours d'insertion et de retour à l'emploi pour les personnes défavorisées..."
"Initiatives Pour l'Emploi Environnement","Chantier d'insertion environnement",100578,50289,"FONDS SOCIAL EUROPEEN","BASSE-NORMANDIE","MANCHE / SAINT-LO","Programme opérationnel national Fonds social européen","71","Parcours d'insertion et de retour à l'emploi pour les personnes défavorisées..."
"Initiatives Pour l'Emploi Environnement","IPE ENVIRONNEMENT CHANTIER ENVIRONNEMENT",102087,51043.5,"FONDS SOCIAL EUROPEEN","BASSE-NORMANDIE","MANCHE / SAINT-LO","Programme opérationnel national Fonds social européen","71","Parcours d'insertion et de retour à l'emploi pour les personnes défavorisées..."
"Institut Universitaire de Technologie d'Alençon","Préparation au Diplôme d'Université : Création et reprise d'activité",55714,27796,"FONDS SOCIAL EUROPEEN","BASSE-NORMANDIE","ORNE / ALENCON / ALENCON-1ER / DAMIGNY","Programme opérationnel national Fonds social européen","68","Aide au travail indépendant et à la création d'entreprise"
"IRFA Normandie Maine ","Développement de la formation ouverte et à distance",110000,49500,"FONDS SOCIAL EUROPEEN","BASSE-NORMANDIE","ORNE","Programme opérationnel national Fonds social européen","72","Élaboration, introduction et mise en oeuvre de réformes dans les systèmes d'éducation et de formation..."
"LA LUCERNE D'OUTREMER","Installation d'une chaufferie bois déchiqueté et son réseau de chaleur.",154136,30826,"FEDER ","BASSE-NORMANDIE","MANCHE / AVRANCHES / HAYE-PESNEL / LA LUCERNE-D'OUTREMER","PO FEDER 2007-2013","41","Energie renouvelable: biomasse"
"La Maison des Mots","Atelier de formation de base",54573,25650,"FONDS SOCIAL EUROPEEN","BASSE-NORMANDIE","Multilocalisation","Programme opérationnel national Fonds social européen","71","Parcours d'insertion et de retour à l'emploi pour les personnes défavorisées..."
"Les 7 Vents du Cotentin SCIC.","Animation d'un espace info énergie pour l'année 2009",153707.95,81247.95,"FEDER ","BASSE-NORMANDIE","MANCHE / COUTANCES","PO FEDER 2007-2013","41","Energie renouvelable: biomasse"
"Les 7 Vents du Cotentin SCIC.","Conforter l'attractivité de la région dans une perspective de développement durable.",153435.18,44497.1,"FEDER ","BASSE-NORMANDIE","MANCHE / COUTANCES","PO FEDER 2007-2013","41","Energie renouvelable: biomasse"
"Les chemins de traverses","Parcours Personnalisés vers l'Emploi 2008",15300,6120,"FONDS SOCIAL EUROPEEN","BASSE-NORMANDIE","CALVADOS / CAEN / CAEN / CAEN","Programme opérationnel national Fonds social européen","71","Parcours d'insertion et de retour à l'emploi pour les personnes défavorisées..."
"L'Etape","Agir et construire l'égalité entre les femmes et les hommes en Basse-Normandie",60450,26850,"FONDS SOCIAL EUROPEEN","BASSE-NORMANDIE",,"Programme opérationnel national Fonds social européen","71","Parcours d'insertion et de retour à l'emploi pour les personnes défavorisées..."
"L'Etape","Parcours Personnalisés vers l'Emploi",25920,10368,"FONDS SOCIAL EUROPEEN","BASSE-NORMANDIE","Multilocalisation","Programme opérationnel national Fonds social européen","71","Parcours d'insertion et de retour à l'emploi pour les personnes défavorisées..."
"L'Etape","Parcours Personnalisés vers l'Emploi 2009",26325,10530,"FONDS SOCIAL EUROPEEN","BASSE-NORMANDIE","Multilocalisation","Programme opérationnel national Fonds social européen","71","Parcours d'insertion et de retour à l'emploi pour les personnes défavorisées..."
"L'Etape","Programme de retour vers l'activité économique - Agora de l'égalité professionnelle entre les femmes",37619,18753,"FONDS SOCIAL EUROPEEN","BASSE-NORMANDIE","Multilocalisation","Programme opérationnel national Fonds social européen","71","Parcours d'insertion et de retour à l'emploi pour les personnes défavorisées..."
"L'Etape","Stimuler la créativité par la mise en place de lieux dédiés à l'émergence de projets",40636,20318,"FONDS SOCIAL EUROPEEN","BASSE-NORMANDIE","CALVADOS","Programme opérationnel national Fonds social européen","68","Aide au travail indépendant et à la création d'entreprise"
"LP LECLERC ALENCON","DISPOSITIF DE REUSSITE SCOLAIRE ET PREVENTION DU DECROCHAGE SCOLAIRE   (2008-2009)",4080,4080,"FONDS SOCIAL EUROPEEN","BASSE-NORMANDIE","ORNE","Programme opérationnel national Fonds social européen","73","Mesures pour renforcer la participation dans l'éducation et la formation tout au long de la vie..."
"Lycée Napoléon","Pôles d'insertion (2008-2009)",7980,540,"FONDS SOCIAL EUROPEEN","BASSE-NORMANDIE","ORNE","Programme opérationnel national Fonds social européen","73","Mesures pour renforcer la participation dans l'éducation et la formation tout au long de la vie..."
"Lycée Polyvalent Gabriel","Pôle d'insertion",12600,600,"FONDS SOCIAL EUROPEEN","BASSE-NORMANDIE","ORNE","Programme opérationnel national Fonds social européen","73","Mesures pour renforcer la participation dans l'éducation et la formation tout au long de la vie..."
"Lycée Professionnel Arcisse de Caumont","Pôle d'insertion de Bayeux",33027,,"FONDS SOCIAL EUROPEEN","BASSE-NORMANDIE","CALVADOS","Programme opérationnel national Fonds social européen","73","Mesures pour renforcer la participation dans l'éducation et la formation tout au long de la vie..."
"Lycée professionnel de Flers","Pôle d'insertion",49266,1337,"FONDS SOCIAL EUROPEEN","BASSE-NORMANDIE","ORNE","Programme opérationnel national Fonds social européen","73","Mesures pour renforcer la participation dans l'éducation et la formation tout au long de la vie..."
"lycee professionnel EREA  LES MARETTES ","Pôle d'insertion (2008/2009)",34025,4244,"FONDS SOCIAL EUROPEEN","BASSE-NORMANDIE","CALVADOS","Programme opérationnel national Fonds social européen","73","Mesures pour renforcer la participation dans l'éducation et la formation tout au long de la vie..."
"Lycée professionnel Jean Mermoz","Pôle d'insertion",13366,4566,"FONDS SOCIAL EUROPEEN","BASSE-NORMANDIE","CALVADOS","Programme opérationnel national Fonds social européen","73","Mesures pour renforcer la participation dans l'éducation et la formation tout au long de la vie..."
"Lycée professionnel Julliot de la Morandière","Pôle d'insertion",14523,6363,"FONDS SOCIAL EUROPEEN","BASSE-NORMANDIE","MANCHE","Programme opérationnel national Fonds social européen","73","Mesures pour renforcer la participation dans l'éducation et la formation tout au long de la vie..."
"Lycée professionnel Marcel Mezen","Pôle d'insertion",62043,8376,"FONDS SOCIAL EUROPEEN","BASSE-NORMANDIE","ORNE","Programme opérationnel national Fonds social européen","73","Mesures pour renforcer la participation dans l'éducation et la formation tout au long de la vie..."
"Lycée professionnel Paul Cornu","DISPOSITIF DE REUSSITE SCOLAIRE ET PREVENTION DU DECROCHAGE SCOLAIRE   (2008-2009)",5220,5220,"FONDS SOCIAL EUROPEEN","BASSE-NORMANDIE","CALVADOS","Programme opérationnel national Fonds social européen","73","Mesures pour renforcer la participation dans l'éducation et la formation tout au long de la vie..."
"Maison de l'Emploi et de la Formation Cherbourg-Octeville (MEF)","Accompagnement des particicipants du PLIE par un référent du service La Passerelle",38527,,"FONDS SOCIAL EUROPEEN","BASSE-NORMANDIE","Multilocalisation","Programme opérationnel national Fonds social européen","71","Parcours d'insertion et de retour à l'emploi pour les personnes défavorisées..."
"Maison de l'Emploi et de la Formation Cherbourg-Octeville (MEF)","Accompagnement renforcé vers l'emploi et la qualification des jeunes bénéficiaires du PLIE-Mission Locale",42908,42908,"FONDS SOCIAL EUROPEEN","BASSE-NORMANDIE","MANCHE / CHERBOURG","Programme opérationnel national Fonds social européen","71","Parcours d'insertion et de retour à l'emploi pour les personnes défavorisées..."
"Maison de l'Emploi et de la Formation Cherbourg-Octeville (MEF)","Balise et Service d'Amorçage de Projets dans les quartiers politique de la ville",104755,50000,"FONDS SOCIAL EUROPEEN","BASSE-NORMANDIE","Multilocalisation","Programme opérationnel national Fonds social européen","68","Aide au travail indépendant et à la création d'entreprise"
"Maison de l'Emploi et de la Formation Cherbourg-Octeville (MEF)","Conseil en orientation professionnelle auprès des bénéficiaires du PLIE",23440,23440,"FONDS SOCIAL EUROPEEN","BASSE-NORMANDIE","MANCHE / CHERBOURG","Programme opérationnel national Fonds social européen","71","Parcours d'insertion et de retour à l'emploi pour les personnes défavorisées..."
"Maison de l'Emploi et de la Formation Cherbourg-Octeville (MEF)","Mise en oeuvre de la clause de promotion de l'emploi (clause sociale) dans les marchés publics et privés",42468,22468,"FONDS SOCIAL EUROPEEN","BASSE-NORMANDIE","MANCHE / CHERBOURG","Programme opérationnel national Fonds social européen","71","Parcours d'insertion et de retour à l'emploi pour les personnes défavorisées..."
"Maison de l'Emploi et de la Formation Cherbourg-Octeville (MEF)","Plan Local pour l' Insertion et l'Emploi  ",3740259,1898178,"FONDS SOCIAL EUROPEEN","BASSE-NORMANDIE","Multilocalisation","Programme opérationnel national Fonds social européen","86","Evaluation et études; information et communication"
"Maison de l'Emploi et de la Formation Cherbourg-Octeville (MEF)","Renforcement de l'accès à la qualification et à l'emploi des jeunes faiblement qualifiés",330723,136376,"FONDS SOCIAL EUROPEEN","BASSE-NORMANDIE","MANCHE / CHERBOURG / CHERBOURG / CHERBOURG","Programme opérationnel national Fonds social européen","65","Modernisation et renforcement des institutions du marché du travail"
"Maison de l'Emploi et de la Formation Cherbourg-Octeville (MEF)","Soutien à l'ingénierie et à la coordination de la Maison de l'Emploi et de la Formation du Cotentin",60000,30000,"FONDS SOCIAL EUROPEEN","BASSE-NORMANDIE","MANCHE / CHERBOURG / CHERBOURG / CHERBOURG","Programme opérationnel national Fonds social européen","65","Modernisation et renforcement des institutions du marché du travail"
"Maison de l'Emploi et de la Formation de l'Agglomération Caennaise","Etudes et Evaluations - MEFAC",30662,15331,"FONDS SOCIAL EUROPEEN","BASSE-NORMANDIE","CALVADOS / CAEN / CAEN / CAEN","Programme opérationnel national Fonds social européen","65","Modernisation et renforcement des institutions du marché du travail"
"Maison de l'Emploi et de la Formation de l'Agglomération Caennaise","Etudes et Evaluations - MEFAC",68970,34485,"FONDS SOCIAL EUROPEEN","BASSE-NORMANDIE","CALVADOS / CAEN / CAEN / CAEN","Programme opérationnel national Fonds social européen","65","Modernisation et renforcement des institutions du marché du travail"
"Maison de l'Information sur la Formation et l'Emploi","Pole de sevices Balise",158016,70000,"FONDS SOCIAL EUROPEEN","BASSE-NORMANDIE","Multilocalisation","Programme opérationnel national Fonds social européen","68","Aide au travail indépendant et à la création d'entreprise"
"Ministère de l'Economie, de l'Industrie et de l'Emploi - DRIRE de Basse-Normandie","Diagnostic du système d'innovation et accompagnement d'une démarche stratégique d'iinovation en BN",222399,111199,"FEDER ","BASSE-NORMANDIE",,"PO FEDER 2007-2013","9","Autres mesures pour stimuler la recherche, l'innovation et l'esprit d'entreprise dans les PME"
"Ministère de l'Intérieur - Préfecture de la Région Basse Normandie","Assistance technique, mise ne oeuvre du programme 2008-2010",105000,105000,"FEDER ","BASSE-NORMANDIE",,"PO FEDER 2007-2013","85","Préparation, mise en oeuvre, suivi et inspection "
"MIRIADE","Animation du RDT Basse-Normandie 2008",430000,172000,"FEDER ","BASSE-NORMANDIE",,"PO FEDER 2007-2013","3","Transfert de technologie et amélioration des réseaux de coopération..."
"MIRIADE","Passerelles R&D",528000,174240,"FEDER ","BASSE-NORMANDIE",,"PO FEDER 2007-2013","3","Transfert de technologie et amélioration des réseaux de coopération..."
"Mission locale de la Baie de Seine","Accompagnement renforcé des publics en difficulté d'insertion et de bas niveau de qualification",134799,55000,"FONDS SOCIAL EUROPEEN","BASSE-NORMANDIE","Multilocalisation","Programme opérationnel national Fonds social européen","65","Modernisation et renforcement des institutions du marché du travail"
"Mission Locale de l'Agglomération Caennaise","Accompagnement renforcé des jeunes de 16 à 25 ans de bas niveaux de qualification",1002299,490962,"FONDS SOCIAL EUROPEEN","BASSE-NORMANDIE","CALVADOS / CAEN / CAEN / CAEN","Programme opérationnel national Fonds social européen","65","Modernisation et renforcement des institutions du marché du travail"
"Mission Locale de l'Aigle-Mortagne","Accès des jeunes au marché du travail par l'accompagnement des parcours, les relations avec les entr",180555,90277,"FONDS SOCIAL EUROPEEN","BASSE-NORMANDIE","ORNE / MORTAGNE-AU-PERCHE / MORTAGNE-AU-PERCHE / MORTAGNE-AU-PERCHE","Programme opérationnel national Fonds social européen","65","Modernisation et renforcement des institutions du marché du travail"
"Mission Locale des Jeunes du Bocage","Accompagnement renforcé au bénéficie des jeunes de bas niveau de qualification",116365,57979,"FONDS SOCIAL EUROPEEN","BASSE-NORMANDIE","ORNE / ARGENTAN / FLERS / FLERS","Programme opérationnel national Fonds social européen","65","Modernisation et renforcement des institutions du marché du travail"
"Mission Locale des Pays d'Argentan-Vimoutiers","Accompagnement renforcé au bénéfice des jeunes de bas niveau de qualification",160013,77960,"FONDS SOCIAL EUROPEEN","BASSE-NORMANDIE","Multilocalisation","Programme opérationnel national Fonds social européen","65","Modernisation et renforcement des institutions du marché du travail"
"Mission Locale du Bassin d'Emploi Granvillais","Renforcement de l'activité de la Mission Locale",134381,62838,"FONDS SOCIAL EUROPEEN","BASSE-NORMANDIE","MANCHE / AVRANCHES / GRANVILLE / GRANVILLE","Programme opérationnel national Fonds social européen","65","Modernisation et renforcement des institutions du marché du travail"
"Mission Locale du Centre Manche","Accès des jeunes au marché du travail par un renforcement de l'accueil et de l'orientation",374176,180273,"FONDS SOCIAL EUROPEEN","BASSE-NORMANDIE","MANCHE / SAINT-LO / SAINT-LO / SAINT-LO","Programme opérationnel national Fonds social européen","65","Modernisation et renforcement des institutions du marché du travail"
"Mission Locale du Pays de Coutances","Accompagnement renforcé des jeunes de 16 à 25 ans de bas niveau de qualification ou sans qualificati",129756,64878,"FONDS SOCIAL EUROPEEN","BASSE-NORMANDIE","MANCHE / COUTANCES / COUTANCES","Programme opérationnel national Fonds social européen","65","Modernisation et renforcement des institutions du marché du travail"
"Mission Locale du Pays de Coutances","Accompagnement renforcé des jeunes de 16 à 25 ans de bas niveau de qualification ou sans qualification (Niveau V et infra)",119090,59286,"FONDS SOCIAL EUROPEEN","BASSE-NORMANDIE","MANCHE / COUTANCES / COUTANCES / COUTANCES","Programme opérationnel national Fonds social européen","65","Modernisation et renforcement des institutions du marché du travail"
"Mission Locale du Sud Pays d'Auge (ex PAIO)","Accompagnement renforcé au bénéfice des jeunes de bas niveau de qualification",164715,79486,"FONDS SOCIAL EUROPEEN","BASSE-NORMANDIE","Multilocalisation","Programme opérationnel national Fonds social européen","65","Modernisation et renforcement des institutions du marché du travail"
"Mission locale pour l'insertion sociale et professionnelle des jeunes du Pays d'Alençon","Accompagnement renforcé des jeunes vers l'emploi",232325,116163,"FONDS SOCIAL EUROPEEN","BASSE-NORMANDIE","ORNE / ALENCON / ALENCON / ALENCON","Programme opérationnel national Fonds social européen","65","Modernisation et renforcement des institutions du marché du travail"
"Mission locale pour l'insertion sociale et professionnelle des jeunes du Pays d'Alençon","Dispositif Local d'Accompagnement de l'Orne - Accompagnement des structures d'utilité sociale",129500,21966,"FONDS SOCIAL EUROPEEN","BASSE-NORMANDIE","ORNE","Programme opérationnel national Fonds social européen","80","Promouvoir les partenariats, les pactes et les initiatives par la mise en réseau des acteurs concernés"
"Mission locale pour l'insertion sociale et professionnelle des jeunes du Pays d'Alençon","Dispositif Local d'Accompagnement de l'Orne - Accompagnement des structures d'utilité sociale",164999.5,48875,"FONDS SOCIAL EUROPEEN","BASSE-NORMANDIE","ORNE","Programme opérationnel national Fonds social européen","80","Promouvoir les partenariats, les pactes et les initiatives par la mise en réseau des acteurs concernés"
"MOV'EO","Animation du Comité Régional de Basse Normandie 2008.",153800,61520,"FEDER ","BASSE-NORMANDIE",,"PO FEDER 2007-2013","3","Transfert de technologie et amélioration des réseaux de coopération..."
"Normandie AeroEspace","Animation Réseau PME/PMI",234500,93800,"FEDER ","BASSE-NORMANDIE",,"PO FEDER 2007-2013","3","Transfert de technologie et amélioration des réseaux de coopération..."
"Normandie AeroEspace","certification EN 9100",193393,36717,"FEDER ","BASSE-NORMANDIE",,"PO FEDER 2007-2013","3","Transfert de technologie et amélioration des réseaux de coopération..."
"Normandie AeroEspace","Soutien au programme de communication 2008",98000,53900,"FEDER ","BASSE-NORMANDIE",,"PO FEDER 2007-2013","3","Transfert de technologie et amélioration des réseaux de coopération..."
"NORMANDIE AMENAGEMENT","Construction du bâtiment ERABLE - Campus Efficience à Colombelles",6540392,1962118,"FEDER ","BASSE-NORMANDIE","CALVADOS / CAEN / CABOURG / COLOMBELLES","PO FEDER 2007-2013","2","Infrastructure R&DT et centres de compétence pour des technologies spécifiques"
"Normandie Formation Taxi","Préparation à l'examen du certificat conducteur de taxi",2200,2200,"FONDS SOCIAL EUROPEEN","BASSE-NORMANDIE","MANCHE / CHERBOURG","Programme opérationnel national Fonds social européen","71","Parcours d'insertion et de retour à l'emploi pour les personnes défavorisées..."
"NORMANDIE INCUBATION","Accompagnement et prestations externes offerts aux porteurs de projets",927000,370800,"FEDER ","BASSE-NORMANDIE","CALVADOS / CAEN / CAEN / CAEN","PO FEDER 2007-2013","5","Services de soutien avancé aux sociétés et groupes de sociétés"
"Objectif Emploi","Parcours Personnalisés vers l'Emploi",87000,34800,"FONDS SOCIAL EUROPEEN","BASSE-NORMANDIE","CALVADOS / CAEN / CAEN / CAEN","Programme opérationnel national Fonds social européen","71","Parcours d'insertion et de retour à l'emploi pour les personnes défavorisées..."
