"Nom ou raison sociale du bénéficiaire","Intitulé du dossier","Montant du projet en coût total","Montant du cofinanceur européen","Fonds européen concerné","Région de localisation du dossier","Localisation","Programme","Catégorisation","Libellé catégorisation"
"ABEC","ABEC  Chantier tâches multiples n°1 ",31973,15986.5,"FONDS SOCIAL EUROPEEN","BASSE-NORMANDIE","MANCHE / SAINT-LO / CARENTAN","Programme opérationnel national Fonds social européen","71","Parcours d'insertion et de retour à l'emploi pour les personnes défavorisées..."
"ABEC","ABEC  Chantier tâches multiples n°2 ",31500,15750,"FONDS SOCIAL EUROPEEN","BASSE-NORMANDIE","MANCHE / COUTANCES / HAYE-DU-PUITS","Programme opérationnel national Fonds social européen","71","Parcours d'insertion et de retour à l'emploi pour les personnes défavorisées..."
"ACDS Dernier soupir","Ateliers  Ecritures des corps ",13123,10498,"FONDS SOCIAL EUROPEEN","BASSE-NORMANDIE","MANCHE / SAINT-LO","Programme opérationnel national Fonds social européen","71","Parcours d'insertion et de retour à l'emploi pour les personnes défavorisées..."
"ACSEA FORMATION","Ateliers de Formation de Base",93195,46597.5,"FONDS SOCIAL EUROPEEN","BASSE-NORMANDIE","CALVADOS","Programme opérationnel national Fonds social européen","71","Parcours d'insertion et de retour à l'emploi pour les personnes défavorisées..."
"ACSEA FORMATION","Ateliers de Formation de Base",90742.5,44145,"FONDS SOCIAL EUROPEEN","BASSE-NORMANDIE","CALVADOS / LISIEUX / LISIEUX / LISIEUX","Programme opérationnel national Fonds social européen","71","Parcours d'insertion et de retour à l'emploi pour les personnes défavorisées..."
"ACSEA FORMATION","Parcours Personnalisés vers l'Emploi 2009",49725,19890,"FONDS SOCIAL EUROPEEN","BASSE-NORMANDIE","Multilocalisation","Programme opérationnel national Fonds social européen","71","Parcours d'insertion et de retour à l'emploi pour les personnes défavorisées..."
"ADASEA de l'Orne","Soutenir la création d'entreprise en milieu rural",144527,20000,"FONDS SOCIAL EUROPEEN","BASSE-NORMANDIE","ORNE / ALENCON / ALENCON / ALENCON","Programme opérationnel national Fonds social européen","68","Aide au travail indépendant et à la création d'entreprise"
"ADASEA du Calvados","Transmission des exploitations agricoles",198120,60000,"FONDS SOCIAL EUROPEEN","BASSE-NORMANDIE","CALVADOS / CAEN / CABOURG / COLOMBELLES","Programme opérationnel national Fonds social européen","68","Aide au travail indépendant et à la création d'entreprise"
"AFIP Normandie","Le rendez-vous des jeunes créatifs",24482,12139,"FONDS SOCIAL EUROPEEN","BASSE-NORMANDIE",,"Programme opérationnel national Fonds social européen","68","Aide au travail indépendant et à la création d'entreprise"
"AFPA CROP","Examen psychotechnique de sécurité",110,110,"FONDS SOCIAL EUROPEEN","BASSE-NORMANDIE","MANCHE / CHERBOURG / CHERBOURG","Programme opérationnel national Fonds social européen","71","Parcours d'insertion et de retour à l'emploi pour les personnes défavorisées..."
"AFPA CROP","Plate-forme Nouveaux Services Basse-Normandie",489336,200000,"FONDS SOCIAL EUROPEEN","BASSE-NORMANDIE","CALVADOS / CAEN / CAEN / CAEN","Programme opérationnel national Fonds social européen","65","Modernisation et renforcement des institutions du marché du travail"
"AFT IFTIM","Conducteur(trice) routier interurbain de voyageurs 2009-036",92400,46200,"FONDS SOCIAL EUROPEEN","BASSE-NORMANDIE",,"Programme opérationnel national Fonds social européen","66","Mise en oeuvre de mesures actives et préventives sur le marché de l'emploi"
"AFT IFTIM","TP conducteur/trice routier interurbain de voyageurs avec TWISTO 2009-028",73920,36960,"FONDS SOCIAL EUROPEEN","BASSE-NORMANDIE","CALVADOS","Programme opérationnel national Fonds social européen","66","Mise en oeuvre de mesures actives et préventives sur le marché de l'emploi"
"AGEFOS PME Basse-Normandie","Développement égalité professionnelle entre les femmes et les hommes dans TPE-PME par la formation",141624,64812,"FONDS SOCIAL EUROPEEN","BASSE-NORMANDIE",,"Programme opérationnel national Fonds social européen","69","Mesures pour améliorer l'accès à l'emploi et renforcer la participation durable et la progression des femmes..."
"AGEFOS PME Basse-Normandie","Horizon 2010 - PASS PME",1470221,573286,"FONDS SOCIAL EUROPEEN","BASSE-NORMANDIE",,"Programme opérationnel national Fonds social européen","73","Mesures pour renforcer la participation dans l'éducation et la formation tout au long de la vie..."
"AGEFOS PME Basse-Normandie","Valorice - Horizon 2010",580571,221295,"FONDS SOCIAL EUROPEEN","BASSE-NORMANDIE",,"Programme opérationnel national Fonds social européen","64","Développement de services spécifiques d'emploi, de formation et de soutien dans le contexte de restructuration sectorielle..."
"Agence Nationale Pour l'Emploi - Pôle Emploi","Accompagnement des demandeurs d'emploi non indemnisés présentant un risque élevé de chômage de longu",3600000,1800000,"FONDS SOCIAL EUROPEEN","BASSE-NORMANDIE",,"Programme opérationnel national Fonds social européen","65","Modernisation et renforcement des institutions du marché du travail"
"Agence Nationale Pour l'Emploi - Pôle Emploi","Accompagnement vers l'emploi des bénéficiares du PLIE",86958,86958,"FONDS SOCIAL EUROPEEN","BASSE-NORMANDIE","MANCHE / CHERBOURG","Programme opérationnel national Fonds social européen","71","Parcours d'insertion et de retour à l'emploi pour les personnes défavorisées..."
"Agence Nationale Pour l'Emploi - Pôle Emploi","Conseillers emploi RMI",400818.6,125619.2,"FONDS SOCIAL EUROPEEN","BASSE-NORMANDIE","CALVADOS","Programme opérationnel national Fonds social européen","71","Parcours d'insertion et de retour à l'emploi pour les personnes défavorisées..."
"AIFCC","Travailleurs indépendants",116640.75,56103,"FONDS SOCIAL EUROPEEN","BASSE-NORMANDIE","CALVADOS","Programme opérationnel national Fonds social européen","71","Parcours d'insertion et de retour à l'emploi pour les personnes défavorisées..."
"AIFCC","Travailleurs Indépendants 2009",121498.1,56455,"FONDS SOCIAL EUROPEEN","BASSE-NORMANDIE","CALVADOS","Programme opérationnel national Fonds social européen","71","Parcours d'insertion et de retour à l'emploi pour les personnes défavorisées..."
"A.I.F.S.T. Centre Horticole du Londel","Atelier Chantier d'insertion  Jardin des compagnons ",128176,50628,"FONDS SOCIAL EUROPEEN","BASSE-NORMANDIE","CALVADOS / CAEN / CAEN / CAEN","Programme opérationnel national Fonds social européen","71","Parcours d'insertion et de retour à l'emploi pour les personnes défavorisées..."
"A.I.F.S.T. Centre Horticole du Londel","Atelier chantier d'insertion  Londel Eco-environnement ",155749,66486,"FONDS SOCIAL EUROPEEN","BASSE-NORMANDIE","CALVADOS / CAEN / CAEN / CAEN","Programme opérationnel national Fonds social européen","71","Parcours d'insertion et de retour à l'emploi pour les personnes défavorisées..."
"APEI Centre Manche","Ent'Raid de la Vallée de la Vire",12176,7851,"FONDS SOCIAL EUROPEEN","BASSE-NORMANDIE",,"Programme opérationnel national Fonds social européen","71","Parcours d'insertion et de retour à l'emploi pour les personnes défavorisées..."
"APEI Centre Manche","Handi-Foot Saint-Lô / Barcelone",24820,20320,"FONDS SOCIAL EUROPEEN","BASSE-NORMANDIE","MANCHE","Programme opérationnel national Fonds social européen","71","Parcours d'insertion et de retour à l'emploi pour les personnes défavorisées..."
"APPCMAN","12 parcours vers les métiers de demain : la vidéo pour convaincre",24995,19995,"FONDS SOCIAL EUROPEEN","BASSE-NORMANDIE","MANCHE / CHERBOURG","Programme opérationnel national Fonds social européen","71","Parcours d'insertion et de retour à l'emploi pour les personnes défavorisées..."
"AQM BASSE-NORMANDIE","Accompagnement vers la performance",186900,93450,"FEDER ","BASSE-NORMANDIE",,"PO FEDER 2007-2013","6","Soutien aux PME pour la promotion de produits et processus de fabrication écologiques (...)"
"AQM BASSE-NORMANDIE","Journée Régionale de l'Excellence - La compétence au service de l'Excellence",58000,29000,"FEDER ","BASSE-NORMANDIE",,"PO FEDER 2007-2013","6","Soutien aux PME pour la promotion de produits et processus de fabrication écologiques (...)"
"ASSISE ORNE (ASSOCIATION POUR L'INSERTION SOCIALE POUR L'ECONOMIE DANS L'ORNE)","Création du restaurant d'insertion  Aux Goûts d'Ici et d'Ailleurs ",23000,18379,"FONDS SOCIAL EUROPEEN","BASSE-NORMANDIE","ORNE / ALENCON","Programme opérationnel national Fonds social européen","71","Parcours d'insertion et de retour à l'emploi pour les personnes défavorisées..."
"Association ALFAH","Professionnalisation des acteurs de formation et de l'insertion visant à faciliter l'accueil et la f",38570,19285,"FONDS SOCIAL EUROPEEN","BASSE-NORMANDIE",,"Programme opérationnel national Fonds social européen","71","Parcours d'insertion et de retour à l'emploi pour les personnes défavorisées..."
"Association Calvados Création","Dispositif Local d'Accompagnement sur le département du Calvados",226873,71250,"FONDS SOCIAL EUROPEEN","BASSE-NORMANDIE","CALVADOS","Programme opérationnel national Fonds social européen","80","Promouvoir les partenariats, les pactes et les initiatives par la mise en réseau des acteurs concernés"
"Association Calvados Création","Dispositif Local d'Accompagnement sur le département du Calvados",283400,74400,"FONDS SOCIAL EUROPEEN","BASSE-NORMANDIE","CALVADOS","Programme opérationnel national Fonds social européen","80","Promouvoir les partenariats, les pactes et les initiatives par la mise en réseau des acteurs concernés"
"Association  Conquérants et Bâtisseurs ","Chantier  Bâtiment et Emplois Verts ",57326,28663,"FONDS SOCIAL EUROPEEN","BASSE-NORMANDIE","MANCHE / SAINT-LO","Programme opérationnel national Fonds social européen","71","Parcours d'insertion et de retour à l'emploi pour les personnes défavorisées..."
"Association  Conquérants et Bâtisseurs ","Chantier  Couture et Entretien ",25774,12887,"FONDS SOCIAL EUROPEEN","BASSE-NORMANDIE","MANCHE / SAINT-LO","Programme opérationnel national Fonds social européen","71","Parcours d'insertion et de retour à l'emploi pour les personnes défavorisées..."
"Association  Conquérants et Bâtisseurs ","Chantier  Multi-services ",84347,42173.5,"FONDS SOCIAL EUROPEEN","BASSE-NORMANDIE","MANCHE / SAINT-LO","Programme opérationnel national Fonds social européen","71","Parcours d'insertion et de retour à l'emploi pour les personnes défavorisées..."
"Association de la PAIO du Bocage Virois","L'accompagnement renforcé des jeunes de bas niveau de qualification pour un meilleur accès à l'emploi",86140,25000,"FONDS SOCIAL EUROPEEN","BASSE-NORMANDIE","CALVADOS / VIRE / VIRE / VIRE","Programme opérationnel national Fonds social européen","65","Modernisation et renforcement des institutions du marché du travail"
"Association de lutte contre l'illettrisme du Pays d'alençon - La boîte aux Lettres","Atelier de formation de base",58995,7695,"FONDS SOCIAL EUROPEEN","BASSE-NORMANDIE","Multilocalisation","Programme opérationnel national Fonds social européen","71","Parcours d'insertion et de retour à l'emploi pour les personnes défavorisées..."
"Association de lutte contre l'illettrisme du Pays d'alençon - La boîte aux Lettres","Atelier de Formation de Base",32650,3904.9,"FONDS SOCIAL EUROPEEN","BASSE-NORMANDIE","ORNE","Programme opérationnel national Fonds social européen","71","Parcours d'insertion et de retour à l'emploi pour les personnes défavorisées..."
"Association Départementale pour la Sauvegarde de l'Enfant à l'Adulte de la Manche","Service : Cap Alternance",113087,36262,"FONDS SOCIAL EUROPEEN","BASSE-NORMANDIE","MANCHE / SAINT-LO / SAINT-LO / SAINT-LO","Programme opérationnel national Fonds social européen","71","Parcours d'insertion et de retour à l'emploi pour les personnes défavorisées..."
"Association des Amis de Jean Bosco - Centre de Formation Bernard de Guitaut","Action modulaire d'insertion",180347,90000,"FONDS SOCIAL EUROPEEN","BASSE-NORMANDIE","CALVADOS / CAEN / CAEN / CAEN","Programme opérationnel national Fonds social européen","71","Parcours d'insertion et de retour à l'emploi pour les personnes défavorisées..."
"Association de Solidarité par le Travail et la Recherche de l'Emploi","Accompagnement renforcé des bénéficiaires du PLIE",21717,21717,"FONDS SOCIAL EUROPEEN","BASSE-NORMANDIE","Multilocalisation","Programme opérationnel national Fonds social européen","71","Parcours d'insertion et de retour à l'emploi pour les personnes défavorisées..."
"Association du PLIE du Pays de Caen","Plan Local d'Initiatives pour L'emploi du Pays de Caen",3348469,1674235,"FONDS SOCIAL EUROPEEN","BASSE-NORMANDIE","CALVADOS / CAEN","Programme opérationnel national Fonds social européen","86","Evaluation et études; information et communication"
"Association Habitat et Développement de l'Orne","Animation d'un Espace Info-Energie 2008",115178,34553,"FEDER ","BASSE-NORMANDIE","ORNE / ALENCON","PO FEDER 2007-2013","41","Energie renouvelable: biomasse"
"Association Habitat et Développement de l'Orne","Espace Info-Energie année 2009",117960,47184,"FEDER ","BASSE-NORMANDIE",,"PO FEDER 2007-2013","41","Energie renouvelable: biomasse"
"Association Itinéraires","Parcours Personnalisés vers l'Emploi",29000,11600,"FONDS SOCIAL EUROPEEN","BASSE-NORMANDIE","CALVADOS / CAEN / CAEN / CAEN","Programme opérationnel national Fonds social européen","71","Parcours d'insertion et de retour à l'emploi pour les personnes défavorisées..."
"Association Normande des Entreprises Agroalimentaires","Démarche collective du chantier Bilan Carbone®",78699.2,31479.68,"FEDER ","BASSE-NORMANDIE",,"PO FEDER 2007-2013","43","Efficacité énergétique, cogénération, gestion de l'énergie"
"Association Normande des Entreprises Agroalimentaires","Structuration et Animation de la filière.",255000,80000,"FEDER ","BASSE-NORMANDIE",,"PO FEDER 2007-2013","3","Transfert de technologie et amélioration des réseaux de coopération..."
"Association Pays d'Ouche Développement","Préparation de l'élaboration d'un Plan Climat Territorial 2008",40881.78,12264.53,"FEDER ","BASSE-NORMANDIE","ORNE / ARGENTAN / FERTE-FRENEL","PO FEDER 2007-2013","81","Mécanismes pour améliorer la conception des politiques et des programmes, le suivi et l'évaluation ..."
"Association Poisson d'avril","Atelier Chantier d'Insertion  Journal du lien de quartier ",66578,19157,"FONDS SOCIAL EUROPEEN","BASSE-NORMANDIE","CALVADOS / CAEN / FALAISE / FALAISE","Programme opérationnel national Fonds social européen","71","Parcours d'insertion et de retour à l'emploi pour les personnes défavorisées..."
"Association Poisson d'avril","Atelier Chantier d'Insertion  Peinture et Signalétique de Quartier ",60074,24435,"FONDS SOCIAL EUROPEEN","BASSE-NORMANDIE","CALVADOS / CAEN / FALAISE / FALAISE","Programme opérationnel national Fonds social européen","71","Parcours d'insertion et de retour à l'emploi pour les personnes défavorisées..."
"Association Pôle de compétitivité Transactions Electroniques Sécurisées (apTES)","Accompagnement des PME à l'innovation.",195790,107684,"FEDER ","BASSE-NORMANDIE","CALVADOS / CAEN","PO FEDER 2007-2013","3","Transfert de technologie et amélioration des réseaux de coopération..."
"Association Pôle de compétitivité Transactions Electroniques Sécurisées (apTES)","Maitriser l'information stratégique : APIE",106964,34727,"FEDER ","BASSE-NORMANDIE",,"PO FEDER 2007-2013","6","Soutien aux PME pour la promotion de produits et processus de fabrication écologiques (...)"
"Association pour l'Accueil et la Réinsertion Sociale des Adultes","Insertion par l'activité économique des personnes en situation d'exclusion",103670,41033,"FONDS SOCIAL EUROPEEN","BASSE-NORMANDIE","ORNE / ALENCON / ALENCON / ALENCON","Programme opérationnel national Fonds social européen","71","Parcours d'insertion et de retour à l'emploi pour les personnes défavorisées..."
"Association pour l'Accueil et la Réinsertion Sociale des Adultes","Insertion par l'activité économique des personnes en situation d'exclusion sociale",133265,67162,"FONDS SOCIAL EUROPEEN","BASSE-NORMANDIE","ORNE","Programme opérationnel national Fonds social européen","71","Parcours d'insertion et de retour à l'emploi pour les personnes défavorisées..."
"Association pour l'Accueil et la Réinsertion Sociale des Adultes","Insertion par l'activité économique des personnes en situation d'exclusion sociale",140879,58058,"FONDS SOCIAL EUROPEEN","BASSE-NORMANDIE","ORNE / ALENCON / ALENCON / ALENCON","Programme opérationnel national Fonds social européen","71","Parcours d'insertion et de retour à l'emploi pour les personnes défavorisées..."
"Association pour le Développement de l'Echangeur Régional","Dém@tech - 4ème forum de Dématérialisation",63014,18904.2,"FEDER ","BASSE-NORMANDIE","ORNE / ALENCON","PO FEDER 2007-2013","13","Services et applications pour les citoyens (santé, gouvernement, formation en ligne, participation de tous à la société de l'information, etc.)"
"Association pour le Droit à l'Initiative Economique (ADIE)","Financement et accompagnement de projets de création de microentreprises par des chômeurs et allocat",215605,105000,"FONDS SOCIAL EUROPEEN","BASSE-NORMANDIE",,"Programme opérationnel national Fonds social européen","68","Aide au travail indépendant et à la création d'entreprise"
"Association Régionale Acteurs Chantier Ecole Basse-Normandie","Améliorer l'offre de service des ateliers et chantiers d'insertion de Basse-Normandie",183040,75000,"FONDS SOCIAL EUROPEEN","BASSE-NORMANDIE",,"Programme opérationnel national Fonds social européen","80","Promouvoir les partenariats, les pactes et les initiatives par la mise en réseau des acteurs concernés"
"Association Régionale Biomasse Normandie","Animation d'un Espace Info Energie 2009",115303.27,44435.82,"FEDER ","BASSE-NORMANDIE",,"PO FEDER 2007-2013","41","Energie renouvelable: biomasse"
"Association Régionale Biomasse Normandie","Animation volet bois 2008.",169426.3,50541,"FEDER ","BASSE-NORMANDIE","CALVADOS / CAEN","PO FEDER 2007-2013","41","Energie renouvelable: biomasse"
"Association Régionale Biomasse Normandie","Animation volet bois 2009",167671.98,49137.58,"FEDER ","BASSE-NORMANDIE",,"PO FEDER 2007-2013","41","Energie renouvelable: biomasse"
"Association Régionale Biomasse Normandie","Espace Info-Energie 2008",119597.33,35879,"FEDER ","BASSE-NORMANDIE","CALVADOS / CAEN","PO FEDER 2007-2013","41","Energie renouvelable: biomasse"
"Association Régionale de l'Industrie Automobile (ARIA)","Programme pour la Compétitivité de l'Automobile en Région (PROCAR)",306353.22,122541.28,"FEDER ","BASSE-NORMANDIE","CALVADOS / CAEN","PO FEDER 2007-2013","3","Transfert de technologie et amélioration des réseaux de coopération..."
"Association Régionale Recherche et Formation à l'Intervention Sociale (ARRFIS)","Concours de moniteur educateur",146,146,"FONDS SOCIAL EUROPEEN","BASSE-NORMANDIE","MANCHE / CHERBOURG","Programme opérationnel national Fonds social européen","71","Parcours d'insertion et de retour à l'emploi pour les personnes défavorisées..."
"Association  Relais Enfant ","Chantier d'insertion  Beaumont Hague ",17501,8750.5,"FONDS SOCIAL EUROPEEN","BASSE-NORMANDIE","MANCHE / CHERBOURG / BEAUMONT","Programme opérationnel national Fonds social européen","71","Parcours d'insertion et de retour à l'emploi pour les personnes défavorisées..."
"Association  Relais Enfant ","Chantier d'insertion  Beaumont-Hague ",17242,8621,"FONDS SOCIAL EUROPEEN","BASSE-NORMANDIE","MANCHE / CHERBOURG / BEAUMONT","Programme opérationnel national Fonds social européen","71","Parcours d'insertion et de retour à l'emploi pour les personnes défavorisées..."
"Association  Relais Enfant ","Chantier d'insertion  Cherbourg ",83609,41804.5,"FONDS SOCIAL EUROPEEN","BASSE-NORMANDIE","MANCHE / CHERBOURG","Programme opérationnel national Fonds social européen","71","Parcours d'insertion et de retour à l'emploi pour les personnes défavorisées..."
"Association  Relais Enfant ","Chantier d'insertion  CUC ",84863,42431.5,"FONDS SOCIAL EUROPEEN","BASSE-NORMANDIE","MANCHE / CHERBOURG","Programme opérationnel national Fonds social européen","71","Parcours d'insertion et de retour à l'emploi pour les personnes défavorisées..."
"Association  Relais Enfant ","Chantier d'insertion  Les Pieux ",27589,13794.5,"FONDS SOCIAL EUROPEEN","BASSE-NORMANDIE","MANCHE / CHERBOURG","Programme opérationnel national Fonds social européen","71","Parcours d'insertion et de retour à l'emploi pour les personnes défavorisées..."
"Association  Relais Enfant ","Chantier d'insertion  Tri de vêtement  Valognes",24830,12415,"FONDS SOCIAL EUROPEEN","BASSE-NORMANDIE","MANCHE / CHERBOURG / VALOGNES","Programme opérationnel national Fonds social européen","71","Parcours d'insertion et de retour à l'emploi pour les personnes défavorisées..."
"Association  Relais Enfant ","Chantier d'insertion  Valognes ",25203,12601.5,"FONDS SOCIAL EUROPEEN","BASSE-NORMANDIE","MANCHE / CHERBOURG","Programme opérationnel national Fonds social européen","71","Parcours d'insertion et de retour à l'emploi pour les personnes défavorisées..."
"Association  Relais Enfant ","Chantier insertion  Les Pieux ",28003,14001.5,"FONDS SOCIAL EUROPEEN","BASSE-NORMANDIE","MANCHE / CHERBOURG / PIEUX","Programme opérationnel national Fonds social européen","71","Parcours d'insertion et de retour à l'emploi pour les personnes défavorisées..."
"Association Rivières et Bocages","Chantier d'insertion Environnement",68920,34460,"FONDS SOCIAL EUROPEEN","BASSE-NORMANDIE","MANCHE / AVRANCHES","Programme opérationnel national Fonds social européen","71","Parcours d'insertion et de retour à l'emploi pour les personnes défavorisées..."
"Association TRAJECTIO","Accès à l'emploi direct 2009",125560,62780,"FONDS SOCIAL EUROPEEN","BASSE-NORMANDIE","CALVADOS / CAEN / CAEN / CAEN","Programme opérationnel national Fonds social européen","71","Parcours d'insertion et de retour à l'emploi pour les personnes défavorisées..."
"Association TRAJECTIO","Accès personnalisé à l'emploi pérenne",128920,64460,"FONDS SOCIAL EUROPEEN","BASSE-NORMANDIE","CALVADOS / CAEN / CAEN / CAEN","Programme opérationnel national Fonds social européen","71","Parcours d'insertion et de retour à l'emploi pour les personnes défavorisées..."
"Association TRAJECTIO","Challenge de la meilleure écoconductrice  Promotion des métiers du transport auprès des femmes ",15400,7700,"FONDS SOCIAL EUROPEEN","BASSE-NORMANDIE","CALVADOS / CAEN / CAEN / CAEN","Programme opérationnel national Fonds social européen","69","Mesures pour améliorer l'accès à l'emploi et renforcer la participation durable et la progression des femmes..."
"Association TRAJECTIO","Egalité professionnelle - Création, valorisation et diffusion d'outils de communication à destination des acteurs économiques",20000,10000,"FONDS SOCIAL EUROPEEN","BASSE-NORMANDIE","CALVADOS / CAEN / CAEN / CAEN","Programme opérationnel national Fonds social européen","71","Parcours d'insertion et de retour à l'emploi pour les personnes défavorisées..."
"Association TRAJECTIO","Promouvoir les outils de l'égalité professionnelle et salariale entre les hommes et les femmes auprès des entreprises de Basse-Normandie",20000,10000,"FONDS SOCIAL EUROPEEN","BASSE-NORMANDIE","CALVADOS / CAEN / CAEN / CAEN","Programme opérationnel national Fonds social européen","71","Parcours d'insertion et de retour à l'emploi pour les personnes défavorisées..."
"Association Vire FM","Fréquence Emploi",19354,15483,"FONDS SOCIAL EUROPEEN","BASSE-NORMANDIE","Multilocalisation","Programme opérationnel national Fonds social européen","71","Parcours d'insertion et de retour à l'emploi pour les personnes défavorisées..."
"ASTRE Environnement","Chantier d'insertion Cherbourg",68419,34209.5,"FONDS SOCIAL EUROPEEN","BASSE-NORMANDIE","MANCHE / CHERBOURG / CHERBOURG","Programme opérationnel national Fonds social européen","71","Parcours d'insertion et de retour à l'emploi pour les personnes défavorisées..."
"ASTRE Environnement","Chantier d'insertion de la Glacerie",31111,15555.5,"FONDS SOCIAL EUROPEEN","BASSE-NORMANDIE","MANCHE / CHERBOURG / TOURLAVILLE / LA GLACERIE","Programme opérationnel national Fonds social européen","71","Parcours d'insertion et de retour à l'emploi pour les personnes défavorisées..."
"Atelier de Formation d'Entraide et de Réentraînement à l'Emploi","Chantier d'insertion tri de vêtements",48979,24489.5,"FONDS SOCIAL EUROPEEN","BASSE-NORMANDIE","MANCHE / COUTANCES / PERIERS","Programme opérationnel national Fonds social européen","71","Parcours d'insertion et de retour à l'emploi pour les personnes défavorisées..."
"Au Fil De L'Eau","Chantier d'insertion Atellier Bois",25000,12500,"FONDS SOCIAL EUROPEEN","BASSE-NORMANDIE","MANCHE / CHERBOURG","Programme opérationnel national Fonds social européen","71","Parcours d'insertion et de retour à l'emploi pour les personnes défavorisées..."
"Auto Ecole Chevrollier","Formation permis B Langevin",464,464,"FONDS SOCIAL EUROPEEN","BASSE-NORMANDIE","MANCHE / CHERBOURG / CHERBOURG","Programme opérationnel national Fonds social européen","71","Parcours d'insertion et de retour à l'emploi pour les personnes défavorisées..."
"Auto Ecole PATRICK","Formation au permis B",218.64,218.64,"FONDS SOCIAL EUROPEEN","BASSE-NORMANDIE","MANCHE / CHERBOURG / CHERBOURG","Programme opérationnel national Fonds social européen","71","Parcours d'insertion et de retour à l'emploi pour les personnes défavorisées..."
