"Nom ou raison sociale du bénéficiaire","Intitulé du dossier","Montant du projet en coût total","Montant du cofinanceur européen","Fonds européen concerné","Région de localisation du dossier","Localisation","Programme","Catégo- -risation","Libellé catégorisation"
"A B A P E","Aménagement d'une brasserie solidaire","208,390 €","62,517 €","FEDER ","FRANCHE-COMTE","FRANCHE-COMTE",,"8","Autres investissements en entreprises"
"ADDOS EURL","Business plan PME","180,900 €","56,394 €","FEDER ","FRANCHE-COMTE","FRANCHE-COMTE",,"63","Conception et diffusion de modes d'organisation du travail innovateurs et plus productifs"
"AFOBAT DE FRANCHE-COMTE","Extension et équipements du CFA VAUBAN du Bâtiment de Franche-Comté","1,018,933 €","407,673 €","FEDER ","FRANCHE-COMTE","FRANCHE-COMTE",,"64","Développement de services spécifiques d'emploi, de formation et de soutien dans le contexte de restructuration sectorielle..."
"AGENCE DE DEVELOPPEMENT ET D'URBANISME DU PAYS DE MONTBELIARD","Création dun Groupe de Prospective numérique en Franche-Comté","223,300 €","111,650 €","FEDER ","FRANCHE-COMTE","FRANCHE-COMTE",,"11","Technologies de l'information et la communication (...)"
"AJENA","Mise en oeuvre du programme PACTES Energie","480,340 €","226,766 €","FEDER ","FRANCHE-COMTE","FRANCHE-COMTE",,"54","Autres mesures pour protéger l'environnement et prévenir les risques"
"ALLIZE PLASTURGIE FRANCHE COMTE","ACTIONS COLLECTIVES PLASTURGIE FRANCHE-COMTE 2010","580,090 €","290,045 €","FEDER ","FRANCHE-COMTE","FRANCHE-COMTE",,"5","Services de soutien avancé aux sociétés et groupes de sociétés"
"AMENOPHIS COSMETICS SARL","création d'un dispositif thérapeutique à atmosphère modifié","780,391 €","118,246 €","FEDER ","FRANCHE-COMTE","FRANCHE-COMTE",,"7","Investissements dans les entreprises directement liées à la recherche et l'innovation (...)"
"ASSOCIATION DEPARTEMENTALE POUR LE DEVELOPPEMENT ET L'INITIATIVE DE LA MUSIQUE (ADDIM)","mise en oeuvre d'un projet expérimental de développement culturel attaché à la Bulle à spectacle","360,208 €","140,041 €","FEDER ","FRANCHE-COMTE","FRANCHE-COMTE",,"60","Autres aides à l'amélioration des services culturels"
"ASSOCIATION DEVELOPPEMENT FORET ET INDUSTRIES DU BOIS EN FC (ADIB)","Actions collectives 2008 en faveur des scieries 2ème tranche 2008","193,189 €","60,933 €","FEDER ","FRANCHE-COMTE","FRANCHE-COMTE",,"3","Transfert de technologie et amélioration des réseaux de coopération..."
"ASSOCIATION DEVELOPPEMENT FORET ET INDUSTRIES DU BOIS EN FC (ADIB)","Actions collectives en faveur de la construction bois menuiserie charpente","255,926 €","68,278 €","FEDER ","FRANCHE-COMTE","FRANCHE-COMTE",,"5","Services de soutien avancé aux sociétés et groupes de sociétés"
"ASSOCIATION DEVELOPPEMENT FORET ET INDUSTRIES DU BOIS EN FC (ADIB)","AMEUBLEMENT 2009","255,000 €","89,819 €","FEDER ","FRANCHE-COMTE","FRANCHE-COMTE",,"9","Autres mesures pour stimuler la recherche, l'innovation et l'esprit d'entreprise dans les PME"
"ASSOCIATION EFOR39","Création d'une épicerie multi services à Port Lesney","103,083 €","31,797 €","FEDER ","FRANCHE-COMTE","FRANCHE-COMTE",,"69","Mesures pour améliorer l'accès à l'emploi et renforcer la participation durable et la progression des femmes..."
"ASSOCIATION EUROPE EN FRANCHE-COMTE","Stand Europe à la foire comtoise 2010","8,383 €","4,191 €","FEDER ","FRANCHE-COMTE","FRANCHE-COMTE",,"86","Evaluation et études; information et communication"
"ASSOCIATION EUROPE EN FRANCHE-COMTE","Stand  Programmes européens FEDER-FSE  au Trophées CGPME le 19 septembre 2008","5,980 €","5,980 €","FEDER ","FRANCHE-COMTE","FRANCHE-COMTE",,"86","Evaluation et études; information et communication"
"Association Juratic","Sensibiliser et accompagner les entreprises aux usages des TIC","213,895 €","85,558 €","FEDER ","FRANCHE-COMTE","FRANCHE-COMTE",,"15","Autres mesures pour améliorer l'accès et l'utilisation efficace des TIC par les PME"
"ASSOCIATION LUNETIERE TECHNOLOGIQUE (ALUTEC)","PROGRAMME DE DEVELOPPEMENT TECHNOLOGIQUE DE LA LUNETTERIE 2007/2009","1,134,000 €","436,597 €","FEDER ","FRANCHE-COMTE","FRANCHE-COMTE",,"3","Transfert de technologie et amélioration des réseaux de coopération..."
"Association Montbéliardaise d'aide aux travailleurs (A.MA.T)","Programme de démolition du foyer de mandeure","381,443 €","133,505 €","FEDER ","FRANCHE-COMTE","FRANCHE-COMTE",,"61","Projets intégrés de réhabilitation urbaine et rurale"
"ASSOCIATION POLE VEHICULE DU FUTUR","LES CLES DE LA PERFORMANCE","566,587 €","182,295 €","FEDER ","FRANCHE-COMTE","FRANCHE-COMTE",,"9","Autres mesures pour stimuler la recherche, l'innovation et l'esprit d'entreprise dans les PME"
"ASSOCIATION POUR LA FORMATION D'APPRENTIS DE L'INDUSTRIE","Evolution du plateau technique en usinage commande numérique","248,768 €","124,384 €","FEDER ","FRANCHE-COMTE","FRANCHE-COMTE",,"62","Développement de systèmes et stratégies d'apprentissage tout au long de la vie dans les entreprises; formation et services aux employés..."
"ASSOCIATION POUR LA FORMATION PROFESSIONELLE DES ADULTES (AFPA)","Création d'un plateau technique cuisine et restaurant pédagogique AFPA Besançon","881,378 €","440,689 €","FEDER ","FRANCHE-COMTE","FRANCHE-COMTE",,"64","Développement de services spécifiques d'emploi, de formation et de soutien dans le contexte de restructuration sectorielle..."
"ASSOCIATION POUR LA FORMATION PROFESSIONELLE DES ADULTES (AFPA)","extension centre AFPA Vesoul","638,415 €","191,524 €","FEDER ","FRANCHE-COMTE","FRANCHE-COMTE",,"64","Développement de services spécifiques d'emploi, de formation et de soutien dans le contexte de restructuration sectorielle..."
"ASSOCIATION POUR LE DEVELOPPEMENT DES INDUSTRIES DU BOIS (ADIB) ","Actions collectives de développement des scieries","42,042 €","12,247 €","FEDER ","FRANCHE-COMTE","FRANCHE-COMTE",,"3","Transfert de technologie et amélioration des réseaux de coopération..."
"ASSOCIATION POUR LE DEVELOPPEMENT DES INDUSTRIES DU BOIS (ADIB) ","Actions collectives en faveur de la construction bois, menuiserie, charpente en franche-Comté - programme 2009/2010","270,700 €","134,385 €","FEDER ","FRANCHE-COMTE","FRANCHE-COMTE",,"9","Autres mesures pour stimuler la recherche, l'innovation et l'esprit d'entreprise dans les PME"
"ASSOCIATION POUR LE DEVELOPPEMENT DES INDUSTRIES DU BOIS (ADIB) ","Actions collectives en faveur des scieireis de Franche-Comté - programme 2009","181,350 €","75,700 €","FEDER ","FRANCHE-COMTE","FRANCHE-COMTE",,"3","Transfert de technologie et amélioration des réseaux de coopération..."
"ASSOCIATION POUR LE DEVELOPPEMENT DES INDUSTRIES DU BOIS (ADIB) ","Actions collectives transversales en faveur des entreprises de la filière forêt-bois de Franche-Comté","195,800 €","88,414 €","FEDER ","FRANCHE-COMTE","FRANCHE-COMTE",,"3","Transfert de technologie et amélioration des réseaux de coopération..."
"ASSOCIATION POUR LE DEVELOPPEMENT DES INDUSTRIES DU BOIS (ADIB) ","Assises de la forêt et du Bois de Franche-Comté","59,000 €","18,000 €","FEDER ","FRANCHE-COMTE","FRANCHE-COMTE",,"3","Transfert de technologie et amélioration des réseaux de coopération..."
"ASSOCIATION POUR LE DEVELOPPEMENT DES INDUSTRIES DU BOIS (ADIB) ","OPERATION : AMEUBLEMENT","259,000 €","65,500 €","FEDER ","FRANCHE-COMTE","FRANCHE-COMTE",,"3","Transfert de technologie et amélioration des réseaux de coopération..."
"ASSOCIATION REGIE DE QUARTIER DES GLACIS","Aménagement nouveaux locaux Régie de Quartier des Glacis","214,003 €","60,000 €","FEDER ","FRANCHE-COMTE","FRANCHE-COMTE",,"8","Autres investissements en entreprises"
"ASSOCIATION SAPIN EI","ASSOCIATION SAPIN EI","203,386 €","61,016 €","FEDER ","FRANCHE-COMTE","FRANCHE-COMTE",,"8","Autres investissements en entreprises"
"Centre de formation d'apprentis agricoles de Châteaufarine","Acquisition de simulateurs de conduite d'engins forestiers avec informatique embarquée","228,950 €","114,475 €","FEDER ","FRANCHE-COMTE","FRANCHE-COMTE",,"64","Développement de services spécifiques d'emploi, de formation et de soutien dans le contexte de restructuration sectorielle..."
"CETIM","ACAMAS FC Multi filières","183,090 €","91,545 €","FEDER ","FRANCHE-COMTE","FRANCHE-COMTE",,"5","Services de soutien avancé aux sociétés et groupes de sociétés"
"CETIM","Centre de ressources de la mécanique franc-comtoise Années 1 et 2","298,328 €","149,164 €","FEDER ","FRANCHE-COMTE","FRANCHE-COMTE",,"5","Services de soutien avancé aux sociétés et groupes de sociétés"
"CHAMBRE DE METIERS de LA HAUTE-SAONE  (CM70)","Soutien au développement du e.commerce dans l'artisanat","173,750 €","79,113 €","FEDER ","FRANCHE-COMTE","FRANCHE-COMTE",,"5","Services de soutien avancé aux sociétés et groupes de sociétés"
"CHAMBRE DE METIERS du DOUBS (CM25)  ","Création d'un club de chefs d'entreprises artisanales","50,322 €","24,658 €","FEDER ","FRANCHE-COMTE","FRANCHE-COMTE",,"5","Services de soutien avancé aux sociétés et groupes de sociétés"
"CHAMBRE DE METIERS du JURA (CM39) ","Mise en réseau des entreprises - appui à la mise en place et au démarrage d'une coopérative d'entreprises artisanales  services à la personne ","77,431 €","38,715 €","FEDER ","FRANCHE-COMTE","FRANCHE-COMTE",,"5","Services de soutien avancé aux sociétés et groupes de sociétés"
"CHAMBRE DEPARTEMENTALE DE COMMERCE ET D'INDUSTRIE de  BELFORT  (CCI90)","Structuration de la filière  Energie  en Franche-Comté","898,586 €","338,452 €","FEDER ","FRANCHE-COMTE","FRANCHE-COMTE",,"6","Soutien aux PME pour la promotion de produits et processus de fabrication écologiques (...)"
"CHAMBRE DEPARTEMENTALE DE COMMERCE ET D'INDUSTRIE du DOUBS (CCI25)","POSITIONNEMENT STRATEGIQUE ET ACCOMPAGNEMENT","984,726 €","260,400 €","FEDER ","FRANCHE-COMTE","FRANCHE-COMTE",,"5","Services de soutien avancé aux sociétés et groupes de sociétés"
"CHAMBRE REGIONALE DE COMMERCE ET D'INDUSTRIE (CRCI)","L'Intelligence Economique au service des entreprises","708,000 €","149,400 €","FEDER ","FRANCHE-COMTE","FRANCHE-COMTE",,"9","Autres mesures pour stimuler la recherche, l'innovation et l'esprit d'entreprise dans les PME"
"CHAMBRE REGIONALE DE COMMERCE ET D'INDUSTRIE (CRCI)","PIE AIR","855,000 €","427,500 €","FEDER ","FRANCHE-COMTE","FRANCHE-COMTE",,"9","Autres mesures pour stimuler la recherche, l'innovation et l'esprit d'entreprise dans les PME"
"CHAMBRE REGIONALE DE COMMERCE ET D'INDUSTRIE (CRCI)","Rebond","125,000 €","62,500 €","FEDER ","FRANCHE-COMTE","FRANCHE-COMTE",,"3","Transfert de technologie et amélioration des réseaux de coopération..."
"CHAMBRE REGIONALE DE COMMERCE ET D'INDUSTRIE (CRCI)","Volet IE du CAC automobile transport","369,000 €","184,500 €","FEDER ","FRANCHE-COMTE","FRANCHE-COMTE",,"9","Autres mesures pour stimuler la recherche, l'innovation et l'esprit d'entreprise dans les PME"
"CHAMBRE REGIONALE DE METIERS (CRM) ","Accompagnement à la transmission-reprise d'entreprises artisanales","229,500 €","100,000 €","FEDER ","FRANCHE-COMTE","FRANCHE-COMTE",,"5","Services de soutien avancé aux sociétés et groupes de sociétés"
"CHARM'OSSATURE","CHARM'OSSATURE Aide à l'investissement matériel","1,097,612 €","82,320 €","FEDER ","FRANCHE-COMTE","FRANCHE-COMTE",,,
"COMITE INTERPROFESSIONNEL DU GRUYERE DE COMTE (CIGC)","Programme de développement des Routes du Comté 2007","178,550 €","45,173 €","FEDER ","FRANCHE-COMTE","FRANCHE-COMTE",,"57","Autres outils d'amélioration des services touristiques"
"COMITE REGIONAL DU TOURISME DE FRANCHE-COMTE","Mise en oeuvre du plan marketing de la destination Montagnes du Jura (2007)","518,000 €","179,000 €","FEDER ","FRANCHE-COMTE","FRANCHE-COMTE",,"57","Autres outils d'amélioration des services touristiques"
"COMITE REGIONAL DU TOURISME DE FRANCHE-COMTE","Mise en oeuvre du plan marketing de la destination Montagnes du Jura 2008","518,000 €","179,000 €","FEDER ","FRANCHE-COMTE","FRANCHE-COMTE",,"57","Autres outils d'amélioration des services touristiques"
"Comité Régional du Tourisme de Franche-comté","Mise en oeuvre du Plan Qualité Tourisme Territoriale en Franche-Comté","139,900 €","69,950 €","FEDER ","FRANCHE-COMTE","FRANCHE-COMTE",,"57","Autres outils d'amélioration des services touristiques"
"Comité Régional du Tourisme de Franche-comté","Montagnes du Jura - Programme de communication 2009","577,500 €","205,000 €","FEDER ","FRANCHE-COMTE","FRANCHE-COMTE",,"57","Autres outils d'amélioration des services touristiques"
"COMMUNAUTE D'AGGLOMERATION BELFORTAINE  (CAB)","restauration de l'étang des forges - 2ème tranche","1,118,607 €","170,000 €","FEDER ","FRANCHE-COMTE","FRANCHE-COMTE",,"61","Projets intégrés de réhabilitation urbaine et rurale"
"COMMUNAUTE D'AGGLOMERATION DU GRAND BESANCON (CAGB)","Appel à projets FEDER - Volet urbain - Extension du dépôt GINKO","2,029,414 €","600,000 €","FEDER ","FRANCHE-COMTE","FRANCHE-COMTE",,"25","Transport urbain"
"COMMUNAUTE D'AGGLOMERATION DU GRAND BESANCON (CAGB)","CAGB - Nouveau Conservatoire à Rayonnement régional (CRR) du Grand Besançon, dans le cadre de la Cité des Arts et de la Culture (Volet urbain)","20,427,000 €","2,500,000 €","FEDER ","FRANCHE-COMTE","FRANCHE-COMTE",,"11","Technologies de l'information et la communication (...)"
"COMMUNAUTE D'AGGLOMERATION DU GRAND BESANCON (CAGB)","Etude de faisabilité et de programmation en vue de la relocalisation des locaux de l'association Julienne Javel (amorçage du réaménagement de la ZAC des Marnières)","30,415 €","9,125 €","FEDER ","FRANCHE-COMTE","FRANCHE-COMTE",,"61","Projets intégrés de réhabilitation urbaine et rurale"
"COMMUNAUTE D'AGGLOMERATION DU GRAND BESANCON (CAGB)","Etude de préservation et de valorisation des collines de la vallée du Doubs","167,172 €","66,869 €","FEDER ","FRANCHE-COMTE","FRANCHE-COMTE",,"51","Promotion de la biodiversité et protection de la nature (y compris Natura 2000)"
"COMMUNAUTE D'AGGLOMERATION DU GRAND BESANCON (CAGB)","Etudes préalables à l'aménagement de la zone des Portes de Vesoul (1ère phase avant travaux)","140,360 €","49,000 €","FEDER ","FRANCHE-COMTE","FRANCHE-COMTE",,"61","Projets intégrés de réhabilitation urbaine et rurale"
"COMMUNAUTE D'AGGLOMERATION DU GRAND BESANCON (CAGB)","Etudes préliminaires pour la création d'un Transport Collectif en Site Propre.","3,869,000 €","900,000 €","FEDER ","FRANCHE-COMTE","FRANCHE-COMTE",,"52","Promotion de transports urbains propres"
"COMMUNAUTE D'AGGLOMERATION DU GRAND BESANCON (CAGB)","Passerelle modes doux à la Malate","2,531,401 €","506,280 €","FEDER ","FRANCHE-COMTE","FRANCHE-COMTE",,"54","Autres mesures pour protéger l'environnement et prévenir les risques"
"COMMUNAUTE D'AGGLOMERATION DU PAYS DE MONTBELIARD (CAPM) ","Appel à projets FEDER - Volet urbain - Consolidation du réseau des correspondants emploi formation","153,226 €","42,468 €","FEDER ","FRANCHE-COMTE","FRANCHE-COMTE",,"71","Parcours d'insertion et de retour à l'emploi pour les personnes défavorisées..."
"COMMUNAUTE D'AGGLOMERATION DU PAYS DE MONTBELIARD (CAPM) ","AXONE: tranche deux :  réalisation de salles spécialisées et de bureaux destinés aux associations sportives","3,150,000 €","300,000 €","FEDER ","FRANCHE-COMTE","FRANCHE-COMTE",,"59","Développement d'infrastructures culturelles"
"COMMUNAUTE D'AGGLOMERATION DU PAYS DE MONTBELIARD (CAPM) ","Consolidation et maintient du réseau des correspondants emploi formation implanté dans les zones urbaines sensibles de la CAPM (Espace Jeunes Mission Locale du Pays de Montbéliard)","158,522 €","50,000 €","FEDER ","FRANCHE-COMTE","FRANCHE-COMTE",,"13","Services et applications pour les citoyens (santé, gouvernement, formation en ligne, participation de tous à la société de l'information, etc.)"
"COMMUNAUTE D'AGGLOMERATION DU PAYS DE MONTBELIARD (CAPM) ","Infrastructure verte et bleue du Pays de Montbéliard -programme 2009 d'aménagement de liaisons douces","669,700 €","100,455 €","FEDER ","FRANCHE-COMTE","FRANCHE-COMTE",,"61","Projets intégrés de réhabilitation urbaine et rurale"
"COMMUNAUTE D'AGGLOMERATION DU PAYS DE MONTBELIARD (CAPM) ","La Damassine : maison des vergers, du paysage et de l'énergie","3,461,682 €","300,000 €","FEDER ","FRANCHE-COMTE","FRANCHE-COMTE",,"56","Protection et valorisation du patrimoine naturel"
"COMMUNAUTE D'AGGLOMERATION DU PAYS DE MONTBELIARD (CAPM) ","Protection contre les inondations des lieux habités en basse vallée de l'Allan - tranche ferme","7,837,027 €","1,567,405 €","FEDER ","FRANCHE-COMTE","FRANCHE-COMTE",,"53","Prévention des risques (...)"
"COMMUNAUTE DE COMMUNES AMANCEY-LOUE-LISON","Réalisation d'une chaufferie bois et réseau chaleur","1,751,793 €","150,400 €","FEDER ","FRANCHE-COMTE","FRANCHE-COMTE",,"5","Services de soutien avancé aux sociétés et groupes de sociétés"
"COMMUNAUTE DE COMMUNES DU PAYS DE ROUGEMONT","Construction d'un équipement sportif intercommunal multi-associatif et extra-scolaire","632,076 €","221,226 €","FEDER ","FRANCHE-COMTE","FRANCHE-COMTE",,"11","Technologies de l'information et la communication (...)"
"COMMUNAUTE DE COMMUNES DU PLATEAU D'HAUTEVILLE","Création d'un camping 3 étoiles","1,225,461 €","274,197 €","FEDER ","RHONE-ALPES","RHONE-ALPES",,"57","Autres outils d'amélioration des services touristiques"
"COMMUNAUTE DE COMMUNES DU VAL D'AMOUR","Réaménagement de La Morte des Fontaines à Chamblay","128,000 €","51,200 €","FEDER ","FRANCHE-COMTE","FRANCHE-COMTE",,"6","Soutien aux PME pour la promotion de produits et processus de fabrication écologiques (...)"
"COMMUNAUTE DE COMMUNES DU VALLON DE SANCEY","Etablissement et maintenance d'un réseau de communications électroniques pour la couverture en haut débit des communes de Servin et Crosey-le-Petit","155,000 €","42,200 €","FEDER ","FRANCHE-COMTE","FRANCHE-COMTE",,"10","Infrastructures téléphoniques (y compris réseaux haut débit)"
"COMMUNE D'ARBOIS","Restructuration du camping municipal d'Arbois","677,600 €","135,520 €","FEDER ","FRANCHE-COMTE","FRANCHE-COMTE",,"57","Autres outils d'amélioration des services touristiques"
"COMMUNE D'AUDINCOURT","Appel à projets FEDER - Volet urbain - Aménagement centre d'Audincourt : Requalification des espaces","2,268,860 €","300,000 €","FEDER ","FRANCHE-COMTE","FRANCHE-COMTE",,"61","Projets intégrés de réhabilitation urbaine et rurale"
"COMMUNE DE BOIS D'AMONT","Extension du Centre de vacances Le Val d'Orbe à Bois d'Amont","2,125,100 €","467,522 €","FEDER ","FRANCHE-COMTE","FRANCHE-COMTE",,"57","Autres outils d'amélioration des services touristiques"
"COMMUNE DE CHAMPAGNEY","Déplacement et renaturation du bief de Nacey","227,187 €","68,156 €","FEDER ","FRANCHE-COMTE","FRANCHE-COMTE",,"53","Prévention des risques (...)"
"commune de CHAMPEY","chaufferie bois automatique de Champey et réseau de chaleur public","406,465 €","81,293 €","FEDER ","FRANCHE-COMTE","FRANCHE-COMTE",,"41","Energie renouvelable: biomasse"
"Commune de Dampierre les Bois","Aménagement des entrées et de la traversée de la commune de Dampierre les Bois","821,614 €","200,000 €","FEDER ","FRANCHE-COMTE","FRANCHE-COMTE",,,
"COMMUNE DE FRAISANS","Mise en place d'une chaufferie automatique au bois et d'un silo de stockage.","118,800 €","11,880 €","FEDER ","FRANCHE-COMTE","FRANCHE-COMTE",,"41","Energie renouvelable: biomasse"
"Commune de GOUX-LES-USIERS","Chaufferie bois et réseau de chaleur pour 7 logements communaux","177,573 €","17,757 €","FEDER ","FRANCHE-COMTE","FRANCHE-COMTE",,"41","Energie renouvelable: biomasse"
"Commune de Grand-Charmont","Préparation au changement d'usage du site de l'ancienne annexe de l'hôpital de Grand-Charmont","234,410 €","82,043 €","FEDER ","FRANCHE-COMTE","FRANCHE-COMTE",,"61","Projets intégrés de réhabilitation urbaine et rurale"
"COMMUNE DU LAC DES ROUGES TRUITES","Rénovation du Chalet du Bugnon sur la commune de Lac des Rouges Truites","1,020,507 €","197,204 €","FEDER ","FRANCHE-COMTE","FRANCHE-COMTE",,"57","Autres outils d'amélioration des services touristiques"
"CONSEIL GENERAL DE HAUTE-SAONE (CG70)","Amélioration de la couverture du territoire en haut débit (tranche 1)","750,000 €","300,000 €","FEDER ","FRANCHE-COMTE","FRANCHE-COMTE",,"10","Infrastructures téléphoniques (y compris réseaux haut débit)"
"CONSEIL GENERAL DE HAUTE-SAONE (CG70)","Amélioration de la couverture du territoire en haut débit (tranche 2)","520,000 €","208,000 €","FEDER ","FRANCHE-COMTE","FRANCHE-COMTE",,"10","Infrastructures téléphoniques (y compris réseaux haut débit)"
"CONSEIL GENERAL DU DOUBS (CG25)","Aménagement du site de la source de la Loue","1,105,000 €","221,000 €","FEDER ","FRANCHE-COMTE","FRANCHE-COMTE",,"57","Autres outils d'amélioration des services touristiques"
"CONSEIL GENERAL DU JURA (CG39)","Aménagement foncier agricole et forestier de la rive droite de la zone pilote Loue (Belmont et La Loye) ","405,580 €","162,232 €","FEDER ","FRANCHE-COMTE","FRANCHE-COMTE",,"53","Prévention des risques (...)"
"CONSEIL GENERAL DU JURA (CG39)","Réseau haut débit du département du Jura (secteur bas Jura / 2008-2009)","13,762,924 €","1,500,000 €","FEDER ","FRANCHE-COMTE","FRANCHE-COMTE",,"10","Infrastructures téléphoniques (y compris réseaux haut débit)"
"CONSEIL GENERAL DU TERRITOIRE DE BELFORT (CG90)","Programme de sensibilisation à la biodiversité","756,762 €","378,381 €","FEDER ","FRANCHE-COMTE","FRANCHE-COMTE",,"54","Autres mesures pour protéger l'environnement et prévenir les risques"
"CONSEIL GENERAL DU TERRITOIRE DE BELFORT (CG90)","Réalisation d'un modèle physique des prises d'eau des bassins de rétention de la Savoureuse, dans le","149,930 €","74,965 €","FEDER ","FRANCHE-COMTE","FRANCHE-COMTE",,"53","Prévention des risques (...)"
"CONSEIL GENERAL DU TERRITOIRE DE BELFORT (CG90)","Réaménagement du site départemental du Malsaucy","1,143,000 €","400,000 €","FEDER ","FRANCHE-COMTE","FRANCHE-COMTE",,"61","Projets intégrés de réhabilitation urbaine et rurale"
"CONSEIL GENERAL DU TERRITOIRE DE BELFORT (CG90)","Requalification urbaine des Boulevards Kennedy et Anatole France à Belfort - 3ème tranche","1,812,514 €","600,000 €","FEDER ","FRANCHE-COMTE","FRANCHE-COMTE",,"61","Projets intégrés de réhabilitation urbaine et rurale"
"CONSEIL REGIONAL DE FRANCHE-COMTE","Extension du hall d'agroéquipement dui LEGTA Munier de Vesoul","1,355,385 €","542,154 €","FEDER ","FRANCHE-COMTE","FRANCHE-COMTE",,"64","Développement de services spécifiques d'emploi, de formation et de soutien dans le contexte de restructuration sectorielle..."
"CONSEIL REGIONAL DE FRANCHE-COMTE","Portail régional innovation","925,000 €","406,000 €","FEDER ","FRANCHE-COMTE","FRANCHE-COMTE",,"5","Services de soutien avancé aux sociétés et groupes de sociétés"
"CONSEIL REGIONAL DE FRANCHE-COMTE","TEMIS SCIENCES - Tranche 1 Etudes maîtrise d'oeuvre jusqu'à l'avant projet détaillé","1,284,592 €","642,296 €","FEDER ","FRANCHE-COMTE","FRANCHE-COMTE",,"2","Infrastructure R&DT et centres de compétence pour des technologies spécifiques"
"CONSERVATOIRE BOTANIQUE DE FRANCHE-COMTE","Améliorer la connaissance et évaluer les habitats semi-naturels de franche-comté (2ème phase)","57,167 €","22,866 €","FEDER ","FRANCHE-COMTE","FRANCHE-COMTE",,"51","Promotion de la biodiversité et protection de la nature (y compris Natura 2000)"
"CONSERVATOIRE BOTANIQUE DE FRANCHE-COMTE","CBFC- Alimenter la plateforme environnementale pour la flore- programme 2009","56,712 €","22,101 €","FEDER ","FRANCHE-COMTE","FRANCHE-COMTE",,"51","Promotion de la biodiversité et protection de la nature (y compris Natura 2000)"
"CONSERVATOIRE BOTANIQUE DE FRANCHE-COMTE","Participer à la plateforme environnementale pour la flore et actualiser les outils de la bioévaluation - Programme 2008","60,883 €","24,353 €","FEDER ","FRANCHE-COMTE","FRANCHE-COMTE",,"51","Promotion de la biodiversité et protection de la nature (y compris Natura 2000)"
"CONSERVATOIRE BOTANIQUE DE FRANCHE-COMTE","Réaliser et mettre en oeuvre le plzn de conservation partenarial des espèces les plus menacées - Programme 2009","72,639 €","25,000 €","FEDER ","FRANCHE-COMTE","FRANCHE-COMTE",,"51","Promotion de la biodiversité et protection de la nature (y compris Natura 2000)"
"CONSERVATOIRE BOTANIQUE DE FRANCHE-COMTE","Réaliser et mettre en uvre le plan de conservation partenarial des espèces les plus menacées ... ","64,768 €","25,907 €","FEDER ","FRANCHE-COMTE","FRANCHE-COMTE",,"51","Promotion de la biodiversité et protection de la nature (y compris Natura 2000)"
"Coopérative d'élevage et d'insémination animale Doubs et Territoire de Belfort","Création du premier laboratoire français de sexage de la semence bovine","525,000 €","105,000 €","FEDER ","FRANCHE-COMTE","FRANCHE-COMTE",,"7","Investissements dans les entreprises directement liées à la recherche et l'innovation (...)"
"CPIE DU HAUT-DOUBS","Concertation pour et par l'environnement dans les quartiers urbains et périurbains d'habitat social en Franche-Comté","58,850 €","27,410 €","FEDER ","FRANCHE-COMTE","FRANCHE-COMTE",,"54","Autres mesures pour protéger l'environnement et prévenir les risques"
"CPIE DU HAUT-DOUBS","Réalisation d'une bande dessinée sur les alpages de la Montagne Jurassienne","46,230 €","23,001 €","FEDER ","FRANCHE-COMTE","FRANCHE-COMTE",,"54","Autres mesures pour protéger l'environnement et prévenir les risques"
