"SYNDICAT MIXTE POUR L'AMENAGEMENT D'AREMIS-LURE - SYMA AREMIS - LURE","assistance à maîtrise d'ouvrage pour la création de al zone d'aménagement concerté AREMIS LURE","300,668 €","90,200 €","FEDER ","FRANCHE-COMTE","FRANCHE-COMTE",,"9","Autres mesures pour stimuler la recherche, l'innovation et l'esprit d'entreprise dans les PME"
"SYNDICAT MIXTE POUR L'AMENAGEMENT D'AREMIS-LURE - SYMA AREMIS - LURE","démarche environnementale de charte de qualité avec AEU permettant d'accéder à la certification ISO 14001 pour le Parc d'innovation AREMIS-LURE","71,025 €","21,308 €","FEDER ","FRANCHE-COMTE","FRANCHE-COMTE",,"9","Autres mesures pour stimuler la recherche, l'innovation et l'esprit d'entreprise dans les PME"
"SYNDICAT NATIONAL DES TOURNEURS TABLETIERS ET ACTIVITES CONNEXES (SyNTAC)","La Fabrication d'objets bois, une industrie de tradition et d'innovation","590,000 €","205,998 €","FEDER ","FRANCHE-COMTE","FRANCHE-COMTE",,"3","Transfert de technologie et amélioration des réseaux de coopération..."
"TACTIS TIC ET TERRITOIRES","Etude de diagnostic des TIC en Franche-Comté","93,203 €","43,203 €","FEDER ","FRANCHE-COMTE","FRANCHE-COMTE",,"86","Evaluation et études; information et communication"
"TERRITOIRE HABITAT OFFICE PUBLIC DE L'HABITAT","Réhabilitation de 100 logements situés 4 - 10 rue Parant à Belfort","1,390,981 €","278,196 €","FEDER ","FRANCHE-COMTE","FRANCHE-COMTE",,"43","Efficacité énergétique, cogénération, gestion de l'énergie"
"THOMAS SA","Investissement en plasturgie médicale","3,000,000 €","150,000 €","FEDER ","FRANCHE-COMTE","FRANCHE-COMTE",,"7","Investissements dans les entreprises directement liées à la recherche et l'innovation (...)"
"UNIVERSITE DE FRANCHE-COMTE (UFC)","DIONYSOS","619,070 €","309,535 €","FEDER ","FRANCHE-COMTE","FRANCHE-COMTE",,"3","Transfert de technologie et amélioration des réseaux de coopération..."
"UNIVERSITE DE FRANCHE-COMTE (UFC)","QUARTZ TECH","1,940,000 €","600,000 €","FEDER ","FRANCHE-COMTE","FRANCHE-COMTE",,"2","Infrastructure R&DT et centres de compétence pour des technologies spécifiques"
"UNIVERSITE TECHNOLOGIQUE DE BELFORT MONTBELIARD (UTBM)","F-CITY","837,762 €","316,725 €","FEDER ","FRANCHE-COMTE","FRANCHE-COMTE",,"4","Soutien à la R&DT, en particulier dans les PME (y compris accès à des services de R&DT dans les centres de recherche)"
"VILLE DE BELFORT ","RESTRUCTURATION DE LOCAUX SITUES 25 RUE DE LA 1ERE ARMEE (école Raymond AUBERT à Belfort)","743,672 €","260,285 €","FEDER ","FRANCHE-COMTE","FRANCHE-COMTE",,"61","Projets intégrés de réhabilitation urbaine et rurale"
"VILLE DE LONS LE SAUNIER","Construction d'une chaufferie au bois avec réseau de chaleur à Lons-le-Saunier","2,032,142 €","406,428 €","FEDER ","FRANCHE-COMTE","FRANCHE-COMTE",,"41","Energie renouvelable: biomasse"
"WAMAR ENGINEERING","AIM WAMAR ENGINEERING","3,000,000 €","300,000 €","FEDER ","FRANCHE-COMTE","FRANCHE-COMTE",,"3","Transfert de technologie et amélioration des réseaux de coopération..."
