"Nom ou raison sociale du bénéficiaire","Intitulé du dossier","Montant du projet en coût total","Montant du cofinanceur européen","Fonds européen concerné","Région de localisation du dossier","Localisation","Programme","Catégo- -risation","Libellé catégorisation"
"3DELINEA","Mise au point d'une gamme innovante de protection anti-sudation lavable","153,231 €","42,500 €","FEDER ","NORD-PAS-DE-CALAIS","NORD-PAS-DE-CALAIS",,"4","Soutien à la R&DT, en particulier dans les PME (y compris accès à des services de R&DT dans les centres de recherche)"
"4I-CONCEPT","Développement d'une première machine spéciale. Etude et fabrication d'un dispositif de dispositif de rangement de câbles.","77,500 €","21,000 €","FEDER ","NORD-PAS-DE-CALAIS","NORD-PAS-DE-CALAIS",,"4","Soutien à la R&DT, en particulier dans les PME (y compris accès à des services de R&DT dans les centres de recherche)"
"ACCESS-IT","Intégration des technologies de développement liées au terminal Microsoft Surface et recherche d'applications métiers","46,290 €","8,000 €","FEDER ","NORD-PAS-DE-CALAIS","NORD-PAS-DE-CALAIS",,"4","Soutien à la R&DT, en particulier dans les PME (y compris accès à des services de R&DT dans les centres de recherche)"
"ACTION PLASTURGIE ARTOIS FLANDRES ","Gouvernance du pôle d'Excellence Plasturgie","138,000 €","27,600 €","FEDER ","NORD-PAS-DE-CALAIS","NORD-PAS-DE-CALAIS",,"3","Transfert de technologie et amélioration des réseaux de coopération..."
"ACTION PLASTURGIE ARTOIS FLANDRES ","Pôle d'excellence plasturgie : programme d'actions 2008","50,000 €","10,000 €","FEDER ","NORD-PAS-DE-CALAIS","NORD-PAS-DE-CALAIS",,"3","Transfert de technologie et amélioration des réseaux de coopération..."
"ACTIPAYSAGE","Etude de faisabilité de méthodes de gestion différenciée appliquées aux espaces verts","70,204 €","17,500 €","FEDER ","NORD-PAS-DE-CALAIS","NORD-PAS-DE-CALAIS",,"4","Soutien à la R&DT, en particulier dans les PME (y compris accès à des services de R&DT dans les centres de recherche)"
"ADEELI - CPIE Flandre Maritime"," Un Dragon ! Dans mon jardin ?  et l'Observatoire Batracho-Herpétologique Régional Nord Pas de Calais (OBHER Nord Pas de Clais) CPIE Flandre Maritime","131,900 €","131,500 €","FEDER ","NORD-PAS-DE-CALAIS","NORD-PAS-DE-CALAIS",,"51","Promotion de la biodiversité et protection de la nature (y compris Natura 2000)"
"ADER Initiative","Dotation fonds de prêts au titre de l'année 2008 dans le cadre du Programme Régional de Création Transmission d'Entreprises","325,000 €","22,500 €","FEDER ","NORD-PAS-DE-CALAIS","NORD-PAS-DE-CALAIS",,"9","Autres mesures pour stimuler la recherche, l'innovation et l'esprit d'entreprise dans les PME"
"ADEVIA (ex. SEM ARTOIS DEVELOPPEMENT)","Construction HQE d'un bâtiment tertiaire  Centre d'Affaires Artéa   de la ZAC de l'an 2000 à Liévin","516,312 €","206,524 €","FEDER ","NORD-PAS-DE-CALAIS","NORD-PAS-DE-CALAIS",,"43","Efficacité énergétique, cogénération, gestion de l'énergie"
"ADINOV","Recherche et synthèse assistée par ordinateur de polymères fabriqués à partir d'agro-ressources","242,180 €","50,000 €","FEDER ","NORD-PAS-DE-CALAIS","NORD-PAS-DE-CALAIS",,"4","Soutien à la R&DT, en particulier dans les PME (y compris accès à des services de R&DT dans les centres de recherche)"
"ADITEC","PIVR plan de développement d'aditec","351,800 €","26,300 €","FEDER ","NORD-PAS-DE-CALAIS","NORD-PAS-DE-CALAIS",,"9","Autres mesures pour stimuler la recherche, l'innovation et l'esprit d'entreprise dans les PME"
"ADRIANOR","Plateforme Régionale de l'Innovation - CRT","71,312 €","30,000 €","FEDER ","NORD-PAS-DE-CALAIS","NORD-PAS-DE-CALAIS",,"3","Transfert de technologie et amélioration des réseaux de coopération..."
"ADRINORD","Cardiodiabète Adrinord : Soutien à la création de l'Institut Européen de Génomique du Diabète","135,500 €","31,200 €","FEDER ","NORD-PAS-DE-CALAIS","NORD-PAS-DE-CALAIS",,"1","Activités R&DT dans centres de recherche"
"ADRINORD","INFLUENCE DES CONDITIONS D'ECOULEMENT, PHYSICO-CHIMIE ET PROPRIETES D'INTERFACES SUR L'ADHESION/COHESION DE DEPOTS ALIMENTAIRE EN PAROI D'EQUIPEMENTS ","56,000 €","26,000 €","FEDER ","NORD-PAS-DE-CALAIS","NORD-PAS-DE-CALAIS",,"1","Activités R&DT dans centres de recherche"
"ADVENS","Adguard : développement d'une plateforme technologique d'agrégation des solutions de sécurité du marché et d'analyse","315,289 €","74,000 €","FEDER ","NORD-PAS-DE-CALAIS","NORD-PAS-DE-CALAIS",,"4","Soutien à la R&DT, en particulier dans les PME (y compris accès à des services de R&DT dans les centres de recherche)"
"AEL CREATION","Mise en place et développement de nouvelles formulations et nouveaux packaging en accord avec les nouvelles normes européennes","137,423 €","41,000 €","FEDER ","NORD-PAS-DE-CALAIS","NORD-PAS-DE-CALAIS",,"4","Soutien à la R&DT, en particulier dans les PME (y compris accès à des services de R&DT dans les centres de recherche)"
"A.G.C.France S.A.S.","Reconstruction de la ligne B1: Réduction des émissions d'oxyde d'azote et d'oxyde de soufre.","17,851,700 €","2,400,000 €","FEDER ","NORD-PAS-DE-CALAIS","NORD-PAS-DE-CALAIS",,"43","Efficacité énergétique, cogénération, gestion de l'énergie"
"Agence française de Sécurité Sanitaire des Aliments","ARCIR UMT  Etude de méthodes pour déterminer la fraîcheur des filets de poisson ","198,045 €","66,015 €","FEDER ","NORD-PAS-DE-CALAIS","NORD-PAS-DE-CALAIS",,"1","Activités R&DT dans centres de recherche"
"Agence française de Sécurité Sanitaire des Aliments"," Implication de souches résidentes en IAA au sein de biofilms pathogènes. Conséquences sur la cohésion et la résistance au nettoyage de ces biofilms mixtes","153,940 €","76,970 €","FEDER ","NORD-PAS-DE-CALAIS","NORD-PAS-DE-CALAIS",,"1","Activités R&DT dans centres de recherche"
"AGRATI VIEUX CONDE (ex. ACUMENT Vieux Condé SAS)","Pérénnité du site ACUMENT Vieux Condé","10,900,000 €","500,000 €","FEDER ","NORD-PAS-DE-CALAIS","NORD-PAS-DE-CALAIS",,"8","Autres investissements en entreprises"
"AGRO-LEVURES ET DERIVES","Etude de faisabilité technique de produits phytosanitaires et fertilisants élaborés à partir de levures.","201,500 €","50,000 €","FEDER ","NORD-PAS-DE-CALAIS","NORD-PAS-DE-CALAIS",,"4","Soutien à la R&DT, en particulier dans les PME (y compris accès à des services de R&DT dans les centres de recherche)"
"ALICANTE Sarl","Etude de faisabilité pour le transfert d'un logiciel de gestion du temps passé hospitalier à usage des groupements et établissements de santé, en mode Saas.","97,425 €","24,000 €","FEDER ","NORD-PAS-DE-CALAIS","NORD-PAS-DE-CALAIS",,"4","Soutien à la R&DT, en particulier dans les PME (y compris accès à des services de R&DT dans les centres de recherche)"
"Allevard Rejna Autosuspensions","FSI Allevard Rejna Autosuspensions: investissement innovant dans la suspension automobile","2,962,000 €","200,000 €","FEDER ","NORD-PAS-DE-CALAIS","NORD-PAS-DE-CALAIS",,"8","Autres investissements en entreprises"
"Alliances pour la Responsabilité Sociale et Environnementale","World Forum Lille- Forum Mondial de l'économie responsable","315,079 €","49,000 €","FEDER ","NORD-PAS-DE-CALAIS","NORD-PAS-DE-CALAIS",,"43","Efficacité énergétique, cogénération, gestion de l'énergie"
"ALOATEC","Faisabilité de la diffusion à plus grande échelle des technologies ALOATEC dédiées à l'environnement et à la thermovision","100,000 €","25,000 €","FEDER ","NORD-PAS-DE-CALAIS","NORD-PAS-DE-CALAIS",,"4","Soutien à la R&DT, en particulier dans les PME (y compris accès à des services de R&DT dans les centres de recherche)"
"ALSTOM","Opération de démonstration   diminution des rejets de composés organiques volatils ( COV )","2,790,000 €","697,500 €","FEDER ","NORD-PAS-DE-CALAIS","NORD-PAS-DE-CALAIS",,"43","Efficacité énergétique, cogénération, gestion de l'énergie"
"ALTOO","Développement d'un système de protection amovible contre les risques d'inondation ou de débordement","255,500 €","67,500 €","FEDER ","NORD-PAS-DE-CALAIS","NORD-PAS-DE-CALAIS",,"4","Soutien à la R&DT, en particulier dans les PME (y compris accès à des services de R&DT dans les centres de recherche)"
"AQUARESE INDUSTRIE","Etudes et réalisations dans les domaines de l'Ultra Haute Pression Diesel et du Décochage Fonderie","219,540 €","60,000 €","FEDER ","NORD-PAS-DE-CALAIS","NORD-PAS-DE-CALAIS",,"4","Soutien à la R&DT, en particulier dans les PME (y compris accès à des services de R&DT dans les centres de recherche)"
"ARBS : Association Rotarienne des Bibliothèques Scolaires","Mise en place d'un ERP pour la gestion des prêts et des achats de livres scolaires","1,044,684 €","522,342 €","FEDER ","NORD-PAS-DE-CALAIS","NORD-PAS-DE-CALAIS",,"13","Services et applications pour les citoyens (santé, gouvernement, formation en ligne, participation de tous à la société de l'information, etc.)"
"ARCELOR (ex. SOLLAC ATLANTIQUE)","réduction des rejets atmosphériques de la chaîne d'agglomération 2","655,000 €","98,250 €","FEDER ","NORD-PAS-DE-CALAIS","NORD-PAS-DE-CALAIS",,"43","Efficacité énergétique, cogénération, gestion de l'énergie"
"ARCHIMED","e-marriane : solution de GRC et business model adapté au marché des collectivités locales","1,029,699 €","225,000 €","FEDER ","NORD-PAS-DE-CALAIS","NORD-PAS-DE-CALAIS",,"4","Soutien à la R&DT, en particulier dans les PME (y compris accès à des services de R&DT dans les centres de recherche)"
"ARCHIMED","Lybfly : portail sectoriel web 2.0 communautaire avec une offre culturelle en ligne pour professionnels et particuliers ainsi que les services en ligne associés","874,198 €","185,000 €","FEDER ","NORD-PAS-DE-CALAIS","NORD-PAS-DE-CALAIS",,"4","Soutien à la R&DT, en particulier dans les PME (y compris accès à des services de R&DT dans les centres de recherche)"
"ARC INTERNATIONAL","Acquisition d'un filtre dépoussiéreur traitant également les oxydes d'azote","1,259,500 €","377,850 €","FEDER ","NORD-PAS-DE-CALAIS","NORD-PAS-DE-CALAIS",,"43","Efficacité énergétique, cogénération, gestion de l'énergie"
"ARC INTERNATIONAL","ARC INTERNATIONAL - Demiver - projet de R&D labellisé pôle MAUD","537,116 €","202,615 €","FEDER ","NORD-PAS-DE-CALAIS","NORD-PAS-DE-CALAIS",,"7","Investissements dans les entreprises directement liées à la recherche et l'innovation (...)"
"ARTIFICIAL SOLUTIONS FRANCE","Développemnt d'applications web basées sur le traitement de l'intéraction utilisateur en langage naturel, pour la réalisation d'agents intelligents destinés au e-commerce","624,504 €","200,000 €","FEDER ","NORD-PAS-DE-CALAIS","NORD-PAS-DE-CALAIS",,"4","Soutien à la R&DT, en particulier dans les PME (y compris accès à des services de R&DT dans les centres de recherche)"
"ASSELIN-THIBEAU","Elaboration d'une nouvelle carde permettant une sortie des voiles de fibres à des vitesses de 270 à  300 m/min tout en conservant les mêmes performances techniques","1,044,633 €","200,000 €","FEDER ","NORD-PAS-DE-CALAIS","NORD-PAS-DE-CALAIS",,"4","Soutien à la R&DT, en particulier dans les PME (y compris accès à des services de R&DT dans les centres de recherche)"
"Association AA Lys Audomarois Initiative","renforcement fonds de prêt 2007","450,015 €","30,000 €","FEDER ","NORD-PAS-DE-CALAIS","NORD-PAS-DE-CALAIS",,"8","Autres investissements en entreprises"
"ASSOCIATION APCE","Développement de la sensibilisation des habitants du Nord-Pas de Calais à l'esprit d'entrepreneuriat grâce au site www.demainjecree.com","120,000 €","100,000 €","FEDER ","NORD-PAS-DE-CALAIS","NORD-PAS-DE-CALAIS",,"68","Aide au travail indépendant et à la création d'entreprise"
"ASSOCIATION APCE","Programme d'activité 2008","150,000 €","75,000 €","FEDER ","NORD-PAS-DE-CALAIS","NORD-PAS-DE-CALAIS",,"8","Autres investissements en entreprises"
"ASSOCIATION APCE","sensibiliser et améliorer l'accès vers la création d'entreprises 2007","140,000 €","70,000 €","FEDER ","NORD-PAS-DE-CALAIS","NORD-PAS-DE-CALAIS",,"9","Autres mesures pour stimuler la recherche, l'innovation et l'esprit d'entreprise dans les PME"
"ASSOCIATION BOBARDS ET COMPAGNIE","Conte musical écologique pour la sensibilisation à l'environnement","46,789 €","33,806 €","FEDER ","NORD-PAS-DE-CALAIS","NORD-PAS-DE-CALAIS",,"51","Promotion de la biodiversité et protection de la nature (y compris Natura 2000)"
"ASSOCIATION CREATIVALLEE","Lancement opérationnel et promotion de la marque  Nord Pas de Calais, La Créativallée  - Programme 2","254,000 €","64,000 €","FEDER ","NORD-PAS-DE-CALAIS","NORD-PAS-DE-CALAIS",,"9","Autres mesures pour stimuler la recherche, l'innovation et l'esprit d'entreprise dans les PME"
"ASSOCIATION CREATIVALLEE","opération  Donner Envie d'Entreprendre ","173,445 €","80,000 €","FEDER ","NORD-PAS-DE-CALAIS","NORD-PAS-DE-CALAIS",,"9","Autres mesures pour stimuler la recherche, l'innovation et l'esprit d'entreprise dans les PME"
"ASSOCIATION CREATIVALLEE","Opération Nord Pas de Calais La Créativallée 2008","322,000 €","202,000 €","FEDER ","NORD-PAS-DE-CALAIS","NORD-PAS-DE-CALAIS",,"8","Autres investissements en entreprises"
"ASSOCIATION CREATIVALLEE","Programme d'activité 2007 - sensibilisation à l'entrepreneuriat","472,022 €","115,000 €","FEDER ","NORD-PAS-DE-CALAIS","NORD-PAS-DE-CALAIS",,"9","Autres mesures pour stimuler la recherche, l'innovation et l'esprit d'entreprise dans les PME"
"ASSOCIATION CREATIVALLEE","Programme d'activité Donner envie d'entreprendre 2008","411,650 €","115,000 €","FEDER ","NORD-PAS-DE-CALAIS","NORD-PAS-DE-CALAIS",,"8","Autres investissements en entreprises"
"ASSOCIATION CREATIVALLEE","Promotion de la marque  Nord-Pas de Calais, La Créativallée ","248,135 €","193,135 €","FEDER ","NORD-PAS-DE-CALAIS","NORD-PAS-DE-CALAIS",,"9","Autres mesures pour stimuler la recherche, l'innovation et l'esprit d'entreprise dans les PME"
"Association Douaisienne pour la promotion des Techniques Alternatives en matière d'eaux pluviales ( ADOPTA )","Etude sur l'efficacité d'une bouche d'injection","105,000 €","84,000 €","FEDER ","NORD-PAS-DE-CALAIS","NORD-PAS-DE-CALAIS",,"43","Efficacité énergétique, cogénération, gestion de l'énergie"
"Association GDEAM","ATLAS DES PAPILLONS DE NUIT du NPDC LEPIDOPTERES MACROHETEROCERES","48,974 €","39,178 €","FEDER ","NORD-PAS-DE-CALAIS","NORD-PAS-DE-CALAIS",,"51","Promotion de la biodiversité et protection de la nature (y compris Natura 2000)"
"Association GDEAM","Evolution de l'occupation des sols du littoral Canche et Authie - Partie Nord ","57,453 €","26,464 €","FEDER ","NORD-PAS-DE-CALAIS","NORD-PAS-DE-CALAIS",,"51","Promotion de la biodiversité et protection de la nature (y compris Natura 2000)"
"Association GDEAM","Evolution de l'occupation du sol entre Canche et Authie - Partie Nord - Troisième année","23,713 €","18,970 €","FEDER ","NORD-PAS-DE-CALAIS","NORD-PAS-DE-CALAIS",,"51","Promotion de la biodiversité et protection de la nature (y compris Natura 2000)"
"Association GDEAM","Inventaire de Vertigo Angustior sur le Littoral du Pas de Calais ","22,382 €","11,191 €","FEDER ","NORD-PAS-DE-CALAIS","NORD-PAS-DE-CALAIS",,"51","Promotion de la biodiversité et protection de la nature (y compris Natura 2000)"
"ASSOCIATION IDEE LITTORAL","Coeur de métiers du PRCTE 2009","263,370 €","210,696 €","FEDER ","NORD-PAS-DE-CALAIS","NORD-PAS-DE-CALAIS",,"9","Autres mesures pour stimuler la recherche, l'innovation et l'esprit d'entreprise dans les PME"
"ASSOCIATION IDEE LITTORAL","PRCTE 2007","428,070 €","128,421 €","FEDER ","NORD-PAS-DE-CALAIS","NORD-PAS-DE-CALAIS",,"9","Autres mesures pour stimuler la recherche, l'innovation et l'esprit d'entreprise dans les PME"
"ASSOCIATION IDEE LITTORAL","PRCTE 2008","189,550 €","56,865 €","FEDER ","NORD-PAS-DE-CALAIS","NORD-PAS-DE-CALAIS",,"8","Autres investissements en entreprises"
"Association Industries du Commerce","PICOM - Animation 2008 du pôle de compétitivité Industries du Commerce","458,500 €","101,132 €","FEDER ","NORD-PAS-DE-CALAIS","NORD-PAS-DE-CALAIS",,"3","Transfert de technologie et amélioration des réseaux de coopération..."
"Association Industries du Commerce","PICOM - Animation 2009 du pôle de compétitivité Industries du Commerce","434,906 €","120,000 €","FEDER ","NORD-PAS-DE-CALAIS","NORD-PAS-DE-CALAIS",,"3","Transfert de technologie et amélioration des réseaux de coopération..."
"Association locale d'aide à la mobilité","Création pôle régional pour développement de services de transport collectifs -Lien Plus-","104,905 €","36,716 €","FEDER ","NORD-PAS-DE-CALAIS","NORD-PAS-DE-CALAIS",,"25","Transport urbain"
"association MITI","Financement de l'incubateur MITI pour sa mission 2009  de soutien à la création d'entreprises liée à la recherche régionale","204,050 €","163,240 €","FEDER ","NORD-PAS-DE-CALAIS","NORD-PAS-DE-CALAIS",,"9","Autres mesures pour stimuler la recherche, l'innovation et l'esprit d'entreprise dans les PME"
"association MITI","MITI programme d'activités 2007-2008","778,400 €","225,000 €","FEDER ","NORD-PAS-DE-CALAIS","NORD-PAS-DE-CALAIS",,"9","Autres mesures pour stimuler la recherche, l'innovation et l'esprit d'entreprise dans les PME"
"Association Nationale des Risques Technologiques","Les troisièmes assises nationales des risques technologiques","417,725 €","104,462 €","FEDER ","NORD-PAS-DE-CALAIS","NORD-PAS-DE-CALAIS",,"53","Prévention des risques (...)"
"Association Nord Nature Chico Mendès","Pour un développement de la Gestion Différenciée dans le Nord/Pas de Calais","39,518 €","19,298 €","FEDER ","NORD-PAS-DE-CALAIS","NORD-PAS-DE-CALAIS",,"51","Promotion de la biodiversité et protection de la nature (y compris Natura 2000)"
"Association pour la Prévention de la Pollution Atmosphérique","Cartographie régionale de la qualité globale de l'air à l'aide des lichens épiphytes","72,797 €","58,237 €","FEDER ","NORD-PAS-DE-CALAIS","NORD-PAS-DE-CALAIS",,"47","Qualité de l'air"
"Association Régionale de l 'Industrie Automobile du Nord - Pas de Calais - ARIA","ASPARANCE : Accompagnement structuré et partenarial pour l'automobile régionale par des actions nécessaires et complémentaires au profit des entreprises","884,100 €","165,768 €","FEDER ","NORD-PAS-DE-CALAIS","NORD-PAS-DE-CALAIS",,"3","Transfert de technologie et amélioration des réseaux de coopération..."
"ATANEO FRANCE","Construction d'un démonstrateur servant à valider un procédé physico-chimique de traitement des déchets organiques et inorganiques","635,225 €","190,000 €","FEDER ","NORD-PAS-DE-CALAIS","NORD-PAS-DE-CALAIS",,"4","Soutien à la R&DT, en particulier dans les PME (y compris accès à des services de R&DT dans les centres de recherche)"
"ATMO NORD PAS DE CALAIS","Campagne de mesure des pesticides en air intérieur chez les agriculteurs","218,365 €","65,509 €","FEDER ","NORD-PAS-DE-CALAIS","NORD-PAS-DE-CALAIS",,"47","Qualité de l'air"
"Atos Origin Intégration","PICOM - Projet de R&D déposés au titre du FUI - Participation d'Atos Origin Intégration au projet ICOM","314,804 €","47,704 €","FEDER ","NORD-PAS-DE-CALAIS","NORD-PAS-DE-CALAIS",,"7","Investissements dans les entreprises directement liées à la recherche et l'innovation (...)"
"AUCHAN FRANCE","Opération exemplaire photovoltaïque 93,04 Kwc","551,608 €","137,902 €","FEDER ","NORD-PAS-DE-CALAIS","NORD-PAS-DE-CALAIS",,"43","Efficacité énergétique, cogénération, gestion de l'énergie"
"AUCHAN FRANCE","PICOM - Projet de R&D déposés au titre du FUI - Participation d'Auchan au projet ICOM","373,000 €","56,911 €","FEDER ","NORD-PAS-DE-CALAIS","NORD-PAS-DE-CALAIS",,"7","Investissements dans les entreprises directement liées à la recherche et l'innovation (...)"
"AUCHAN FRANCE","Projet U-Shopping","1,582,450 €","632,980 €","FEDER ","NORD-PAS-DE-CALAIS","NORD-PAS-DE-CALAIS",,"1","Activités R&DT dans centres de recherche"
"AVD","Conception et déploiement d'une cartographie trois dimensions avec mise à jour des données en temps réel dans un environnement industriel","577,427 €","100,000 €","FEDER ","NORD-PAS-DE-CALAIS","NORD-PAS-DE-CALAIS",,"4","Soutien à la R&DT, en particulier dans les PME (y compris accès à des services de R&DT dans les centres de recherche)"
"A-VOLUTE","Etude et développement d'un moteur de son 3D pour les domaines du jeu vidéo et de la réalité virtuelle","330,250 €","90,000 €","FEDER ","NORD-PAS-DE-CALAIS","NORD-PAS-DE-CALAIS",,"4","Soutien à la R&DT, en particulier dans les PME (y compris accès à des services de R&DT dans les centres de recherche)"
"BARON ETCOMA","A1002024N : Etude d'un ensemble standard destiné au contrôle des pièces plastiques automobiles de grandes dimensions (type pare-chocs, hayon, planche de bord).","145,236 €","25,000 €","FEDER ","NORD-PAS-DE-CALAIS","NORD-PAS-DE-CALAIS",,"4","Soutien à la R&DT, en particulier dans les PME (y compris accès à des services de R&DT dans les centres de recherche)"
"BATI-ENERGIES SA","Elaboration et mise en place d'une plateforme technique fédérant un ensemble de services à destination des artisants, plateforme qui permettra parallèlement le développement de bases de données et la vente de certificats d'économies d'énergie.","1,461,657 €","300,000 €","FEDER ","NORD-PAS-DE-CALAIS","NORD-PAS-DE-CALAIS",,"4","Soutien à la R&DT, en particulier dans les PME (y compris accès à des services de R&DT dans les centres de recherche)"
"BIENCOURT SYLVIE","Opération exemplaire photovoltaïque 10,5Kwc","61,200 €","18,360 €","FEDER ","NORD-PAS-DE-CALAIS","NORD-PAS-DE-CALAIS",,"40","Energie renouvelable: én. solaire"
"BIFINOVE SAS","Développement d'un ingrédient destiné à ralentir la progression des rhumatismes liés à un déséquilibre de la flore intestinale","446,440 €","130,000 €","FEDER ","NORD-PAS-DE-CALAIS","NORD-PAS-DE-CALAIS",,"4","Soutien à la R&DT, en particulier dans les PME (y compris accès à des services de R&DT dans les centres de recherche)"
"Bigot Martiall","Opération exemplaire photovoltaïque 34 Kwc","195,840 €","45,043 €","FEDER ","NORD-PAS-DE-CALAIS","NORD-PAS-DE-CALAIS",,"40","Energie renouvelable: én. solaire"
"BIOGESTA","Mise au point et conception de solutions d'enregistrement multi-vidéo rapide","30,120 €","7,500 €","FEDER ","NORD-PAS-DE-CALAIS","NORD-PAS-DE-CALAIS",,"4","Soutien à la R&DT, en particulier dans les PME (y compris accès à des services de R&DT dans les centres de recherche)"
"BOMBARDIER Transport France SA","BOMBARDIER TRANSPORT FRANCE: soutien à l'effort de R&D de l'entreprise dans le cadre du projet FERROCOTS (i-Trans)","713,388 €","197,395 €","FEDER ","NORD-PAS-DE-CALAIS","NORD-PAS-DE-CALAIS",,"7","Investissements dans les entreprises directement liées à la recherche et l'innovation (...)"
"BOUILLET Bruno","Opération exemplaire photovoltaïque : 119,88 Kwc","631,144 €","132,540 €","FEDER ","NORD-PAS-DE-CALAIS","NORD-PAS-DE-CALAIS",,"40","Energie renouvelable: én. solaire"
"Boutique de Gestion Espace","BGE Lille : Plateforme de créateurs d'entreprises en ligne","203,353 €","115,506 €","FEDER ","NORD-PAS-DE-CALAIS","NORD-PAS-DE-CALAIS",,"11","Technologies de l'information et la communication (...)"
"Boutique de Gestion Espace","Coeur de Métiers du PRCTE 2009","1,828,350 €","1,462,680 €","FEDER ","NORD-PAS-DE-CALAIS","NORD-PAS-DE-CALAIS",,"9","Autres mesures pour stimuler la recherche, l'innovation et l'esprit d'entreprise dans les PME"
"Boutique de Gestion Espace","Couveuse d'entreprise à l'essai 2009","663,652 €","326,068 €","FEDER ","NORD-PAS-DE-CALAIS","NORD-PAS-DE-CALAIS",,"9","Autres mesures pour stimuler la recherche, l'innovation et l'esprit d'entreprise dans les PME"
"Boutique de Gestion Espace","PRCTE 2008","1,513,250 €","756,625 €","FEDER ","NORD-PAS-DE-CALAIS","NORD-PAS-DE-CALAIS",,"8","Autres investissements en entreprises"
"BRIQUETERIES DU NORD","Caractérisation des performances techniques des produits en terre cuite et en terre crue qui doit conduire à l'élaboration de produits améliorés ou de nouveaux produits cuits et/ou crus utilisables dans l'habitat de demain.","381,750 €","100,000 €","FEDER ","NORD-PAS-DE-CALAIS","NORD-PAS-DE-CALAIS",,"4","Soutien à la R&DT, en particulier dans les PME (y compris accès à des services de R&DT dans les centres de recherche)"
"CALAISIS INITIATIVE","DOTATION EN FONDS DE PRETS AU TITRE DE L'ANNEE 2008","375,000 €","37,500 €","FEDER ","NORD-PAS-DE-CALAIS","NORD-PAS-DE-CALAIS",,"9","Autres mesures pour stimuler la recherche, l'innovation et l'esprit d'entreprise dans les PME"
"CAMBRESIS INITIATIVE","Renforcement fonds de prêt 2007","641,500 €","42,275 €","FEDER ","NORD-PAS-DE-CALAIS","NORD-PAS-DE-CALAIS",,"8","Autres investissements en entreprises"
"CANAPE SERVICE","Développement d'outils logiciels pour faciliter l'acte d'achat dans le domaine de l'ameublement","160,590 €","25,000 €","FEDER ","NORD-PAS-DE-CALAIS","NORD-PAS-DE-CALAIS",,"4","Soutien à la R&DT, en particulier dans les PME (y compris accès à des services de R&DT dans les centres de recherche)"
"CANCHE AUTHIE INITIATIVE","Renforcement de fonds de prêt 2007","232,500 €","20,000 €","FEDER ","NORD-PAS-DE-CALAIS","NORD-PAS-DE-CALAIS",,"8","Autres investissements en entreprises"
"CANIFRANCE","Mise au point et développement d'une gamme de produits d'hygiène naturels pour chiens et chats","120,420 €","35,000 €","FEDER ","NORD-PAS-DE-CALAIS","NORD-PAS-DE-CALAIS",,"4","Soutien à la R&DT, en particulier dans les PME (y compris accès à des services de R&DT dans les centres de recherche)"
