"Lille Métropole Initiative","Dotation fonds de prêts au titre de l'année 2008 dans le cadre du Programme Régional de Création Transmission d'Entreprises","806,050 €","37,000 €","FEDER ","NORD-PAS-DE-CALAIS","NORD-PAS-DE-CALAIS",,"9","Autres mesures pour stimuler la recherche, l'innovation et l'esprit d'entreprise dans les PME"
"Lille Métropole Initiative","renforcement fonds de prêts","686,000 €","54,674 €","FEDER ","NORD-PAS-DE-CALAIS","NORD-PAS-DE-CALAIS",,"8","Autres investissements en entreprises"
"LIXX BAIL - Crédit Agricole Leasing"," DEVAREM 150 : Process mobile de traitement et de valorisation des déblais de terrassements ","500,000 €","125,000 €","FEDER ","NORD-PAS-DE-CALAIS","NORD-PAS-DE-CALAIS",,"43","Efficacité énergétique, cogénération, gestion de l'énergie"
"LL TECH MANAGEMENT","APTI : Etudes d'implantation sur le marché américain : évaluation de la technologie, valeur clinique, opportunité de marché, contraintes juridiques et réglementaires, modèle économique, recherche de partenaires","106,600 €","25,000 €","FEDER ","NORD-PAS-DE-CALAIS","NORD-PAS-DE-CALAIS",,"4","Soutien à la R&DT, en particulier dans les PME (y compris accès à des services de R&DT dans les centres de recherche)"
"LOMAROUTE","Développement et fabrication d'une nouvelle machine de tranchage","407,492 €","110,000 €","FEDER ","NORD-PAS-DE-CALAIS","NORD-PAS-DE-CALAIS",,"4","Soutien à la R&DT, en particulier dans les PME (y compris accès à des services de R&DT dans les centres de recherche)"
"LUC SOCKEEL EMBALLAGES","Etude de faisabilité d'un moyen de transport alternatif pour les fruits et léhumes, environnementalement moins impactant et économiquement plus rentable","97,400 €","24,000 €","FEDER ","NORD-PAS-DE-CALAIS","NORD-PAS-DE-CALAIS",,"4","Soutien à la R&DT, en particulier dans les PME (y compris accès à des services de R&DT dans les centres de recherche)"
"LUXYOL","Faisabilité de la mise en place et du développement de la supervision en terme d'optimisation de la consommation électrique","101,000 €","25,000 €","FEDER ","NORD-PAS-DE-CALAIS","NORD-PAS-DE-CALAIS",,"4","Soutien à la R&DT, en particulier dans les PME (y compris accès à des services de R&DT dans les centres de recherche)"
"MAC CAIN ALIMENTAIRE","FSI : création d'une plate-forme logistique frigorifique à vocation alimentaire","5,736,000 €","400,000 €","FEDER ","NORD-PAS-DE-CALAIS","NORD-PAS-DE-CALAIS",,"8","Autres investissements en entreprises"
"Mairie de Blessy","Résorption de la zone d'ombre ADSL de la commune de Blessy","111,116 €","32,549 €","FEDER ","NORD-PAS-DE-CALAIS","NORD-PAS-DE-CALAIS",,"10","Infrastructures téléphoniques (y compris réseaux haut débit)"
"Mairie de CARENCY","Résorption des zones d'ombre en ADSL","117,700 €","58,850 €","FEDER ","NORD-PAS-DE-CALAIS","NORD-PAS-DE-CALAIS",,"11","Technologies de l'information et la communication (...)"
"Mairie d'Ecurie","Résorption des zones d'ombre haut débit de la commune d'Ecurie","61,480 €","30,740 €","FEDER ","NORD-PAS-DE-CALAIS","NORD-PAS-DE-CALAIS",,"11","Technologies de l'information et la communication (...)"
"MAIRIE DE LESTREM","Aménagement d'un corridor boisé","35,742 €","28,591 €","FEDER ","NORD-PAS-DE-CALAIS","NORD-PAS-DE-CALAIS",,"51","Promotion de la biodiversité et protection de la nature (y compris Natura 2000)"
"Mairie de Maresches","Résorption des zones d'ombre en ADSL","184,030 €","92,015 €","FEDER ","NORD-PAS-DE-CALAIS","NORD-PAS-DE-CALAIS",,"11","Technologies de l'information et la communication (...)"
"MAIRIE DE POTELLE","Opération photovoltaïque 5,4 Kwc","35,816 €","14,326 €","FEDER ","NORD-PAS-DE-CALAIS","NORD-PAS-DE-CALAIS",,"40","Energie renouvelable: én. solaire"
"Maison Régionale de l'Environnement et des Solidarités (ex . M.N.E.)","Opération d'aide à la décision : Comment lutter contre le réchauffement climatique?","105,000 €","37,000 €","FEDER ","NORD-PAS-DE-CALAIS","NORD-PAS-DE-CALAIS",,"54","Autres mesures pour protéger l'environnement et prévenir les risques"
"MALAUS","Faisabilité sur un dispositif de protection incendie destiné à des éléments mobiles vannes, robinets...qui devront résister pendant 1 heure à des températures de 1100°C.","204,375 €","55,000 €","FEDER ","NORD-PAS-DE-CALAIS","NORD-PAS-DE-CALAIS",,"4","Soutien à la R&DT, en particulier dans les PME (y compris accès à des services de R&DT dans les centres de recherche)"
"MECANESCAUT","A1002002N : Etude de chariots de transfert automatisés pour la manutention de rails en atelier.","72,500 €","12,500 €","FEDER ","NORD-PAS-DE-CALAIS","NORD-PAS-DE-CALAIS",,"4","Soutien à la R&DT, en particulier dans les PME (y compris accès à des services de R&DT dans les centres de recherche)"
"MECANESCAUT","Etude de faisabilité d'une machine d'usinage permettant de reconditionner le champignon des rails de voie ferrée usagés par le procédé de reprofilage par fraisage","65,100 €","13,000 €","FEDER ","NORD-PAS-DE-CALAIS","NORD-PAS-DE-CALAIS",,"4","Soutien à la R&DT, en particulier dans les PME (y compris accès à des services de R&DT dans les centres de recherche)"
"MECATEXTILES","Etude et réalisation d'une machine à polir les chariots des métiers leavers à chargement et déchargement automatique","38,200 €","8,500 €","FEDER ","NORD-PAS-DE-CALAIS","NORD-PAS-DE-CALAIS",,"4","Soutien à la R&DT, en particulier dans les PME (y compris accès à des services de R&DT dans les centres de recherche)"
"MECCANO","Conception et développement d'un robot  SPYKEE génération II ","2,542,900 €","490,000 €","FEDER ","NORD-PAS-DE-CALAIS","NORD-PAS-DE-CALAIS",,"4","Soutien à la R&DT, en particulier dans les PME (y compris accès à des services de R&DT dans les centres de recherche)"
"MEDCOM","Etude de faisabilité d'un dispositif innovant de réalisation de prothèses dentaires","83,500 €","20,000 €","FEDER ","NORD-PAS-DE-CALAIS","NORD-PAS-DE-CALAIS",,"4","Soutien à la R&DT, en particulier dans les PME (y compris accès à des services de R&DT dans les centres de recherche)"
"METROVISION","Aide au partenariat technologique européen : recherche de partenaires etd éfinition du cahier des charges en vue de répondre à un programme européen (7ème PCRD, Léonard Da Vinci, IMI...)","60,260 €","15,000 €","FEDER ","NORD-PAS-DE-CALAIS","NORD-PAS-DE-CALAIS",,"4","Soutien à la R&DT, en particulier dans les PME (y compris accès à des services de R&DT dans les centres de recherche)"
"METROVISION","Développement d'une nouvelle génération d'appareils d'exploration des fonctions visuelles","404,766 €","100,000 €","FEDER ","NORD-PAS-DE-CALAIS","NORD-PAS-DE-CALAIS",,"4","Soutien à la R&DT, en particulier dans les PME (y compris accès à des services de R&DT dans les centres de recherche)"
"MICROWAVE CHARACTERISATION CENTER","Etude et choix d'architecture d'un détecteur radiométriqueà 2 canaux en gamme d'onde millimétrique, dispositif à balayage spatial destiné à la conception puis au développement d'une caméra radiométrique portable","290,800 €","100,000 €","FEDER ","NORD-PAS-DE-CALAIS","NORD-PAS-DE-CALAIS",,"4","Soutien à la R&DT, en particulier dans les PME (y compris accès à des services de R&DT dans les centres de recherche)"
"MINAKEM ","LICAPO : Microparticules d'apomorphine à libération contrôlée","1,008,975 €","200,000 €","FEDER ","NORD-PAS-DE-CALAIS","NORD-PAS-DE-CALAIS",,"4","Soutien à la R&DT, en particulier dans les PME (y compris accès à des services de R&DT dans les centres de recherche)"
"Ministère Jeunesse, Education, Recherche (RECTORAT)","CARDIO-DIABETE : Aménagement du 2è et 3è étage du Pôle recherche de la faculté de médecine dans le cadre d'EGID","6,000,000 €","3,000,000 €","FEDER ","NORD-PAS-DE-CALAIS","NORD-PAS-DE-CALAIS",,"2","Infrastructure R&DT et centres de compétence pour des technologies spécifiques"
"MINOT RECYCLAGE TEXTILE","Licorve : développement de garnitures légères pour les coffres de véhicules automobiles","191,500 €","62,500 €","FEDER ","NORD-PAS-DE-CALAIS","NORD-PAS-DE-CALAIS",,"4","Soutien à la R&DT, en particulier dans les PME (y compris accès à des services de R&DT dans les centres de recherche)"
"Mission Bassin Minier Nord- Pas de Calais","Diagnostic écologique et paysager de la continuité verte entre le Parc Marcel CABIDDU et le Parc de le Deûle","47,972 €","40,500 €","FEDER ","NORD-PAS-DE-CALAIS","NORD-PAS-DE-CALAIS",,"51","Promotion de la biodiversité et protection de la nature (y compris Natura 2000)"
"Mission Bassin Minier Nord- Pas de Calais","lutte contre les risques d'innondation dans le bassin minier - etude détaillé des stations de relevage des eaux ","800,000 €","240,000 €","FEDER ","NORD-PAS-DE-CALAIS","NORD-PAS-DE-CALAIS",,"53","Prévention des risques (...)"
"Monsieur CAZIER Eric","Opération exemplaire photovoltaïqe 38,25Kwc","154,254 €","38,563 €","FEDER ","NORD-PAS-DE-CALAIS","NORD-PAS-DE-CALAIS",,"43","Efficacité énergétique, cogénération, gestion de l'énergie"
"Monsieur DEDOURGE  Michel","Opération exemplaire photovoltaïque 65,28Kwc","130,753 €","24,843 €","FEDER ","NORD-PAS-DE-CALAIS","NORD-PAS-DE-CALAIS",,"40","Energie renouvelable: én. solaire"
"Monsieur LECLERCQ CHRISTOPHE","Opération exemplaire photovltaïque 11,194KWc","64,927 €","15,582 €","FEDER ","NORD-PAS-DE-CALAIS","NORD-PAS-DE-CALAIS",,"40","Energie renouvelable: én. solaire"
"Monsieur LECOCQ David","Opération exemplaire photovoltaïque : 25,92 Kwc","163,968 €","65,587 €","FEDER ","NORD-PAS-DE-CALAIS","NORD-PAS-DE-CALAIS",,"40","Energie renouvelable: én. solaire"
"MONSIEUR PLANCKE BENJAMIN","Opération exemplaire photovoltaïque 22,05Kwc","152,580 €","61,032 €","FEDER ","NORD-PAS-DE-CALAIS","NORD-PAS-DE-CALAIS",,"40","Energie renouvelable: én. solaire"
"MOY PARK","FSI : AUGMENTATION DES CAPACITES DE PRODUCTION DE L'ENTREPRISE","5,484,000 €","450,000 €","FEDER ","NORD-PAS-DE-CALAIS","NORD-PAS-DE-CALAIS",,"8","Autres investissements en entreprises"
"MR JEAN RENE GOMEL","Opération exemplaire photovoltaïque 18 KWc","117,354 €","44,594 €","FEDER ","NORD-PAS-DE-CALAIS","NORD-PAS-DE-CALAIS",,"40","Energie renouvelable: én. solaire"
"NAUSICAA","Actions régionales d'information et d'éducation sur la biodiversité littorale et marine","346,766 €","173,382 €","FEDER ","NORD-PAS-DE-CALAIS","NORD-PAS-DE-CALAIS",,"51","Promotion de la biodiversité et protection de la nature (y compris Natura 2000)"
"NAUSICAA","Biodiversité marine : sensibilisation du public à l'occasion de l'année internationale de la biodiversité. ","635,761 €","317,880 €","FEDER ","NORD-PAS-DE-CALAIS","NORD-PAS-DE-CALAIS",,"51","Promotion de la biodiversité et protection de la nature (y compris Natura 2000)"
"NCS Nord de France","SIS Vitalité - Projet  3 Mondes ","1,892,563 €","500,000 €","FEDER ","NORD-PAS-DE-CALAIS","NORD-PAS-DE-CALAIS",,"11","Technologies de l'information et la communication (...)"
"NETASQ","Développement d'un firewall UTM/IPS aux normes, en débit supérieur à 10 Gb/s, avec sa procédure de tests.","328,223 €","74,000 €","FEDER ","NORD-PAS-DE-CALAIS","NORD-PAS-DE-CALAIS",,"4","Soutien à la R&DT, en particulier dans les PME (y compris accès à des services de R&DT dans les centres de recherche)"
"NORD ENTREPRENDRE","renforcement du fonds de prêts 2007","800,016 €","50,000 €","FEDER ","NORD-PAS-DE-CALAIS","NORD-PAS-DE-CALAIS",,"8","Autres investissements en entreprises"
"NORD ENTREPRENDRE","Renforcement du fonds de prêts pour 2008","1,200,000 €","35,000 €","FEDER ","NORD-PAS-DE-CALAIS","NORD-PAS-DE-CALAIS",,"7","Investissements dans les entreprises directement liées à la recherche et l'innovation (...)"
"Nord France eXperts","Programme de promotion prospection 2008","586,294 €","293,147 €","FEDER ","NORD-PAS-DE-CALAIS","NORD-PAS-DE-CALAIS",,"8","Autres investissements en entreprises"
"Nord France eXperts","Programme de promotion prospection 2009","520,000 €","260,000 €","FEDER ","NORD-PAS-DE-CALAIS","NORD-PAS-DE-CALAIS",,"8","Autres investissements en entreprises"
"Nord France Innovation Développement  (ex. Réseau de Développement Technologique Nord-Pas de Calais)","Animation 2008 - RDT","949,187 €","400,000 €","FEDER ","NORD-PAS-DE-CALAIS","NORD-PAS-DE-CALAIS",,"3","Transfert de technologie et amélioration des réseaux de coopération..."
"Nord France Innovation Développement  (ex. Réseau de Développement Technologique Nord-Pas de Calais)","Financement, dans le cadre de la Plateforme Innovation Valorisation de la Recherche, d'une action dédiée à la communication, aux systèmes d'information internes et externes et à la réalisation d'une étude  Stratégie Régionale Automobile ","879,597 €","523,000 €","FEDER ","NORD-PAS-DE-CALAIS","NORD-PAS-DE-CALAIS",,"3","Transfert de technologie et amélioration des réseaux de coopération..."
"Nord France Innovation Développement  (ex. Réseau de Développement Technologique Nord-Pas de Calais)","Financement des fonctions de back office de NFID au service des opérateurs, dans le cadre de la Stratégie Régionale de l'Innovation","1,047,721 €","900,000 €","FEDER ","NORD-PAS-DE-CALAIS","NORD-PAS-DE-CALAIS",,"9","Autres mesures pour stimuler la recherche, l'innovation et l'esprit d'entreprise dans les PME"
"Nord France Terminal International","Pôle de compétitivité i-Trans: Soutien à l'effort de R&D de la société NFTIou (Sochart)","149,235 €","29,847 €","FEDER ","NORD-PAS-DE-CALAIS","NORD-PAS-DE-CALAIS",,"4","Soutien à la R&DT, en particulier dans les PME (y compris accès à des services de R&DT dans les centres de recherche)"
"NORD-PAL-PLAST","Dispositif de lavage à chaud de flaconnages PET","1,045,000 €","209,000 €","FEDER ","NORD-PAS-DE-CALAIS","NORD-PAS-DE-CALAIS",,"43","Efficacité énergétique, cogénération, gestion de l'énergie"
"NPC","Fabrication de joints d'étanchéité sans bulles d'air avec utilisation de PU transparent et ne nécessitant pas d'opération de recoupe de lèvres après injection.","255,484 €","60,000 €","FEDER ","NORD-PAS-DE-CALAIS","NORD-PAS-DE-CALAIS",,"4","Soutien à la R&DT, en particulier dans les PME (y compris accès à des services de R&DT dans les centres de recherche)"
"NT (Nord Technique)","Eco-conception et prototypage d'un poteau d'arret de bus modulaire et adaptable dans une logique de développement durable incluant des fonctionnalités innovantes","198,637 €","50,000 €","FEDER ","NORD-PAS-DE-CALAIS","NORD-PAS-DE-CALAIS",,"4","Soutien à la R&DT, en particulier dans les PME (y compris accès à des services de R&DT dans les centres de recherche)"
"ONCOVET","AAP France-Russie : mise e, place d'essais cliniques sur des modèles sponténés canins et félins de tumeurs mammaires et prostatiques pour le développement de vaccins antitumoraux produits par Epitec, partenaire russe d'Oncovet.","228,900 €","70,000 €","FEDER ","NORD-PAS-DE-CALAIS","NORD-PAS-DE-CALAIS",,"4","Soutien à la R&DT, en particulier dans les PME (y compris accès à des services de R&DT dans les centres de recherche)"
"ONCOVET","Eurotransbio - Ancabor","618,881 €","190,400 €","FEDER ","NORD-PAS-DE-CALAIS","NORD-PAS-DE-CALAIS",,"4","Soutien à la R&DT, en particulier dans les PME (y compris accès à des services de R&DT dans les centres de recherche)"
"ONERA","Cisit phase 3","209,333 €","88,333 €","FEDER ","NORD-PAS-DE-CALAIS","NORD-PAS-DE-CALAIS",,"1","Activités R&DT dans centres de recherche"
"ONERA","Transports - Interopérabilité et sécurité : CISIT Programmation 2007-2008","428,000 €","118,000 €","FEDER ","NORD-PAS-DE-CALAIS","NORD-PAS-DE-CALAIS",,"1","Activités R&DT dans centres de recherche"
"Optimis","Opération collective : Bilan carbone collectif de 30 entreprises dans la ZFU Néoval à Valenciennes","304,358 €","142,526 €","FEDER ","NORD-PAS-DE-CALAIS","NORD-PAS-DE-CALAIS",,"43","Efficacité énergétique, cogénération, gestion de l'énergie"
"OSEO Financement","Création de la société Nord Broyage","5,468,000 €","137,420 €","FEDER ","NORD-PAS-DE-CALAIS","NORD-PAS-DE-CALAIS",,"8","Autres investissements en entreprises"
"OSYRIS MEDICAL","Conception et développement d'un laser médical innovant pour la stimulation du cartilage","1,480,800 €","350,000 €","FEDER ","NORD-PAS-DE-CALAIS","NORD-PAS-DE-CALAIS",,"4","Soutien à la R&DT, en particulier dans les PME (y compris accès à des services de R&DT dans les centres de recherche)"
"Outinord Saint Amand","Réduction des COV suite à la mise en service d'un process de peinture utilisant une  technologie propre ","1,711,603 €","513,480 €","FEDER ","NORD-PAS-DE-CALAIS","NORD-PAS-DE-CALAIS",,"40","Energie renouvelable: én. solaire"
"PAPERFLOW","Conception d'une nouvelle gamme de matériel et mobilier de bureau","693,429 €","200,000 €","FEDER ","NORD-PAS-DE-CALAIS","NORD-PAS-DE-CALAIS",,"4","Soutien à la R&DT, en particulier dans les PME (y compris accès à des services de R&DT dans les centres de recherche)"
"PASCHAL","Création, fabrication et commercialisation d'horloge monumentale haut de gamme pour le particulier","176,576 €","47,000 €","FEDER ","NORD-PAS-DE-CALAIS","NORD-PAS-DE-CALAIS",,"4","Soutien à la R&DT, en particulier dans les PME (y compris accès à des services de R&DT dans les centres de recherche)"
"Pays Coeur de Flandre","Développement du commerce et de l'artisanat en Pays Coeur de Flandre","103,540 €","30,900 €","FEDER ","NORD-PAS-DE-CALAIS","NORD-PAS-DE-CALAIS",,"8","Autres investissements en entreprises"
"PAYS DES MOULINS DE FLANDRES","Programme de Développement de l'Artisanat et du Commerce - 2008","61,231 €","24,614 €","FEDER ","NORD-PAS-DE-CALAIS","NORD-PAS-DE-CALAIS",,"9","Autres mesures pour stimuler la recherche, l'innovation et l'esprit d'entreprise dans les PME"
"PAYS DES MOULINS DE FLANDRES","Programme de l'artisanat et du commerce - 2009","96,543 €","38,088 €","FEDER ","NORD-PAS-DE-CALAIS","NORD-PAS-DE-CALAIS",,"9","Autres mesures pour stimuler la recherche, l'innovation et l'esprit d'entreprise dans les PME"
"PETCO INTERNATIONAL","Etude, développement et mise au point d'une gamme d'aliments pour chiens et chats de compagnie, élaborés uniquement à partir de poisson, et du process de fabrication associé","1,384,720 €","450,000 €","FEDER ","NORD-PAS-DE-CALAIS","NORD-PAS-DE-CALAIS",,"4","Soutien à la R&DT, en particulier dans les PME (y compris accès à des services de R&DT dans les centres de recherche)"
"PLAGE HOLDING","A1002014N : Etude de faisabilité sur le traitement et la valorisation des ordures ménagères à domicile.","56,050 €","14,000 €","FEDER ","NORD-PAS-DE-CALAIS","NORD-PAS-DE-CALAIS",,"4","Soutien à la R&DT, en particulier dans les PME (y compris accès à des services de R&DT dans les centres de recherche)"
"PLAGE SA","Recherche d'un complexe d'adhésif mural issu de ressource renouvelable et biodégradable","1,000,000 €","180,000 €","FEDER ","NORD-PAS-DE-CALAIS","NORD-PAS-DE-CALAIS",,"4","Soutien à la R&DT, en particulier dans les PME (y compris accès à des services de R&DT dans les centres de recherche)"
"PLANCKE Christian","Opération exemplaire photovoltaïque 31,5 Kwc","165,444 €","30,694 €","FEDER ","NORD-PAS-DE-CALAIS","NORD-PAS-DE-CALAIS",,"40","Energie renouvelable: én. solaire"
"PLASTYLUX","Support applique sans pont thermique","75,761 €","17,000 €","FEDER ","NORD-PAS-DE-CALAIS","NORD-PAS-DE-CALAIS",,"4","Soutien à la R&DT, en particulier dans les PME (y compris accès à des services de R&DT dans les centres de recherche)"
"Pôle AQUIMER","Centre de veille du Pôle Aquimer","322,880 €","208,304 €","FEDER ","NORD-PAS-DE-CALAIS","NORD-PAS-DE-CALAIS",,"3","Transfert de technologie et amélioration des réseaux de coopération..."
"Pôle AQUIMER","Mise en place et coordination d'actions collectives et individuelles à destination des entreprises ","523,215 €","64,200 €","FEDER ","NORD-PAS-DE-CALAIS","NORD-PAS-DE-CALAIS",,"3","Transfert de technologie et amélioration des réseaux de coopération..."
"Pôle AQUIMER","Rayonnement national et international du pôle de compétitivité AQUIMER","167,657 €","134,125 €","FEDER ","NORD-PAS-DE-CALAIS","NORD-PAS-DE-CALAIS",,"3","Transfert de technologie et amélioration des réseaux de coopération..."
"Pôle MAUD","Opération Intelligence économique et veille stratégique du Pôle MAUD","142,720 €","114,176 €","FEDER ","NORD-PAS-DE-CALAIS","NORD-PAS-DE-CALAIS",,"3","Transfert de technologie et amélioration des réseaux de coopération..."
"Préfecture de Région Nord - Pas-de-Calais","Assistance technique du PO 2007-2013 ","8,091,700 €","5,650,200 €","FEDER ","NORD-PAS-DE-CALAIS","NORD-PAS-DE-CALAIS",,"85","Préparation, mise en oeuvre, suivi et inspection "
"Préfecture de Région Nord - Pas-de-Calais","Communication et sensibilisation du PO 2007-2013","627,800 €","627,800 €","FEDER ","NORD-PAS-DE-CALAIS","NORD-PAS-DE-CALAIS",,"86","Evaluation et études; information et communication"
"PRODIFA","Conception et fabrication de cendriers avec sacs jetables résistants à la flamme","200,158 €","57,500 €","FEDER ","NORD-PAS-DE-CALAIS","NORD-PAS-DE-CALAIS",,"4","Soutien à la R&DT, en particulier dans les PME (y compris accès à des services de R&DT dans les centres de recherche)"
"PROMOTEX","NORTEX COMMERCIAL","361,850 €","90,462 €","FEDER ","NORD-PAS-DE-CALAIS","NORD-PAS-DE-CALAIS",,"3","Transfert de technologie et amélioration des réseaux de coopération..."
"PRONAL","Dans le cadre du process de vulcanisation, intégration dans l'outimmage de la fonction  démoulage . Elimination du  papier  siliconé gaufré.","258,012 €","60,000 €","FEDER ","NORD-PAS-DE-CALAIS","NORD-PAS-DE-CALAIS",,"4","Soutien à la R&DT, en particulier dans les PME (y compris accès à des services de R&DT dans les centres de recherche)"
"RAMERY ENVIRONNEMENT","Etude de faisabilité pour la gazéification de déchets ultimes issus de centre de tri de déchets industriels banals","75,198 €","18,500 €","FEDER ","NORD-PAS-DE-CALAIS","NORD-PAS-DE-CALAIS",,"4","Soutien à la R&DT, en particulier dans les PME (y compris accès à des services de R&DT dans les centres de recherche)"
"REALISATIONS ELECTRONIQUES ET INFORMATIQUES","Etude et réalisation d'un polarimètre multi-longueur d'onde et d'un photomètre de flamme sécurisé","326,300 €","85,000 €","FEDER ","NORD-PAS-DE-CALAIS","NORD-PAS-DE-CALAIS",,"4","Soutien à la R&DT, en particulier dans les PME (y compris accès à des services de R&DT dans les centres de recherche)"
"RESEAU IDEAL","1er Forum National Nord Européen sur les Quartiers Durables","26,503 €","13,252 €","FEDER ","NORD-PAS-DE-CALAIS","NORD-PAS-DE-CALAIS",,"40","Energie renouvelable: én. solaire"
"Réseau pour le développement et la pérennisation des entreprises","Programme d'actions 2008","347,200 €","117,515 €","FEDER ","NORD-PAS-DE-CALAIS","NORD-PAS-DE-CALAIS",,"9","Autres mesures pour stimuler la recherche, l'innovation et l'esprit d'entreprise dans les PME"
"ROXANE NORD","Acquisition d'une unité de recyclage de bouteilles PET","5,896,835 €","1,238,335 €","FEDER ","NORD-PAS-DE-CALAIS","NORD-PAS-DE-CALAIS",,"43","Efficacité énergétique, cogénération, gestion de l'énergie"
"SA CENTAURE SYSTEMS","Développement d'un afficheur électronique destiné au mobilier urbain, piloté et communiquant en mode TCP/IP","241,692 €","68,000 €","FEDER ","NORD-PAS-DE-CALAIS","NORD-PAS-DE-CALAIS",,"4","Soutien à la R&DT, en particulier dans les PME (y compris accès à des services de R&DT dans les centres de recherche)"
"SAEM LILLE GRAND PALAIS","2ème édition du Salon Créer du 8 au 10 septembre 2008","893,525 €","300,000 €","FEDER ","NORD-PAS-DE-CALAIS","NORD-PAS-DE-CALAIS",,"8","Autres investissements en entreprises"
"SAEM LILLE GRAND PALAIS","3ème édition Salon CREER, 14, 15 et 16 septembre 2009","902,000 €","300,000 €","FEDER ","NORD-PAS-DE-CALAIS","NORD-PAS-DE-CALAIS",,"9","Autres mesures pour stimuler la recherche, l'innovation et l'esprit d'entreprise dans les PME"
"SAEM SORELI","Zac du 1er secteur opérationnel des rives de la haute deûle","1,467,014 €","880,208 €","FEDER ","NORD-PAS-DE-CALAIS","NORD-PAS-DE-CALAIS",,"50","Réhabilitation de sites industriels et de sols contaminés"
"SAEM SORELI","Zac du 1er secteur opérationnel des rives de la haute deûle 'exell territ'","3,006,332 €","1,503,166 €","FEDER ","NORD-PAS-DE-CALAIS","NORD-PAS-DE-CALAIS",,"61","Projets intégrés de réhabilitation urbaine et rurale"
"SAMBRE AVESNOIS INITIATIVE","renforcement du fonds de prêts 2007","391,986 €","40,000 €","FEDER ","NORD-PAS-DE-CALAIS","NORD-PAS-DE-CALAIS",,"8","Autres investissements en entreprises"
"SAMBRE AVESNOIS INITIATIVE","Renforcement du fonds de prêts au titre de l'année 2008","410,020 €","30,000 €","FEDER ","NORD-PAS-DE-CALAIS","NORD-PAS-DE-CALAIS",,"5","Services de soutien avancé aux sociétés et groupes de sociétés"
"SARASIN ACTOR","Reconception d'un actionneur oléopneumatique (ensemble pompe hydraulique et distributeur)","79,563 €","18,000 €","FEDER ","NORD-PAS-DE-CALAIS","NORD-PAS-DE-CALAIS",,"4","Soutien à la R&DT, en particulier dans les PME (y compris accès à des services de R&DT dans les centres de recherche)"
"SARL CANDELEC","Opération exemplaire photovoltaïque 38,25Kwc","205,173 €","47,190 €","FEDER ","NORD-PAS-DE-CALAIS","NORD-PAS-DE-CALAIS",,"43","Efficacité énergétique, cogénération, gestion de l'énergie"
"SARL PODY CONCEPT","Réalisation et test d'un outil de rééducation et soulagement de l'Hallus Valgus","44,400 €","11,000 €","FEDER ","NORD-PAS-DE-CALAIS","NORD-PAS-DE-CALAIS",,"4","Soutien à la R&DT, en particulier dans les PME (y compris accès à des services de R&DT dans les centres de recherche)"
