MLOZ-ZorgTV,Landsbond van de onafhankelijke ziekenfondsen,"Het pilootproject MLOZ-zorgTV beoogt de creatie van een digitaal interactief TV-kanaal dat toelaat om gepersonaliseerde informatie en gepersonaliseerde diensten ( o.m. coaching) te bieden aan een geselecteerde groep patiënten met één of meerdere chronische aandoeningen en/of een zorgbehoefte. Via deze vernieuwende methode van informatie- en kennisoverdracht wordt gewerkt aan de empowerment van de patiënt en aan de compliance, wat op langere termijn resulteert in een betere medische outcome.","70,854.61","177,136.52",40.00%,4/1/08,3/31/10Ritchie,Universiteit Hasselt - Instituut EDM,"Om tegemoet te komen aan de nood van de erfgoed- en cultuurtoeristische sector aan advies over inzet en bruikbaarheid van mobiele ICT toepassingen en een goede afstemming van dergelijke technologieën op de doelomgeving, willen het EDM en het PGRM gezamenlijk een kenniscentrum uitbouwen. De expertise van beide partners binnen dit domein zal via het kenniscentrum optimaal verspreid kunnen worden, o.m. door middel van adviesverlening en demonstraties. Door hun gezamenlijke uitvoering van het EFRO onderzoeksproject ARCHIE hebben het EDM, als onderzoeksinstituut toegepaste informatica, en het PGRM als toonaangevend museum op het vlak van publiekswerking, deze expertise vergaard. Binnen dit project werden vier belangrijke aspecten ontdekt en gedefinieerd die meespelen in de slaagkans van een mobiele ICT toepassing voor erfgoedontsluiting, namelijk mobiliteit, sociale interactie, personalisatie en lokalisatie. Vanuit een informatiepunt wil men de mogelijke aanbieders van dergelijke technologieën uit de erfgoed- en cultuurtoeristische sector sensibiliseren met betrekking tot deze vier aspecten. Door de uitbouw van een demo- en testinfrastructuur biedt men de mogelijkheid om elk van deze aspecten via een prototype toepassing te testen en te evalueren, waarbij ze aandacht schenken aan de ondersteuning van specifieke gebruikersgroepen. Een belangrijke doelstelling is de verankering van het beoogde kenniscentrum binnen het PGRM. Dit houdt onder meer in dat het kenniscentrum zoveel mogelijk zelfbedruipend is na afloop van dit project.","294,625.00","736,563.00",40.00%,9/1/08,8/31/10Challenge-me,VOKA - Kamer van Koophandel West-Vlaanderen,"Ondernemingen hebben steeds meer behoefte aan open innovatie en externe input bij hun innovatie-inspanningen. Om mee aan deze nood tegemoet te komen, zijn in het buitenland sinds enkele jaren 'Creation Nets' actief. Op een Creation Net doen bedrijven aan Crowd Sourcen: ze plaatsen op het internet een open oproep om oplossingen te vinden bij innovatie struikelblokken. In Vlaanderen is deze tool nog ongekend. www.challenge-me.be wil een Vlaamse vertaling zijn van een dergelijk Creation Net. West-Vlaanderen kmo's zullen er 'challenges' (vragen/oproepen) kunnen richten naar hogeschoolstudenten in West-Vlaanderen. Het project sluit aan bij de samenwerkingsinitiatieven tussen industrie en hogescholen. Challenge-Me voorziet de opbouw, bekendmaking, gebruik, coördinatie, evaluatie van het Creation Net, het noteren van best practices en de disseminatie van de resultaten. Doelstellingen van het project zijn het fenomeen Creation Net bekend te maken bij West-Vlaamse kmo's en hogeschoolstudenten en Vlaamse variant creëren en zo de drempel verlagen om beroep te doen op/mee te werken aan een Creation Net. Op deze manier willen ze ondernemingen helpen in hun zoektocht naar externe input. Expertise opdoen en best practices verzamelen om zo mogelijkheden te bieden voor een self-supporting Creation Net in Vlaanderen is een andere doelstelling.","76,477.56","191,193.90",40.00%,9/1/08,8/31/10"Woonlabo: kennisvalorisatie gericht op levenslang wonen, aanpasbaar bouwen en universal design",Provinciale Hogeschool Limburg,"Dit project wil gebaseerd op een fysieke locatie, het Woonlabo, de kennis bundelen en verspreiden rond levenslang wonen, aanpasbaar bouwen en Universal design. Het beschikbaar stellen en verspreiden van deze kennis is noodzakelijk om voor iedereen de mogelijkheid te bieden op een aangepaste woning, van goede kwaliteit, in een behoorlijke woonomgeving en tegen een betaalbare prijs.","294,200.00","735,500.00",40.00%,12/15/08,12/14/10De ontwikkeling en realisatie van een multitouch interface,Provincie Limburg,"Z33 wil een digitale multitouch interface ontwikkelen, vormgeven en realiseren die op een vernieuwende interactieve manier bezoekers in de tentoonstellingsruimtes informeert en begeleidt. Voor de realisatie van dit project wordt beroep gedaan op 2 partners: EDM en de KHLim, afdeling Media en Design. Z33 levert inhoud aan, coördineert het project en verzorgt disseminatie van resultaten in de context van tentoonstellingsprojecten. EDM staat in voor het functionele ontwerp en de bouw van de multitouchtafel, het technologisch onderzoek en de ontwikkeling van het softwareplatform dat zal toelaten om mediarijke netwerktoepassingen te ontwikkelen die van de multitouch functionaliteit gebruik maken. KHLim, MDA zal de multitouchtafel vormelijk ontwerpen en de nodige toepassingen ontwikkelen voor Z33 op basis van het softwareplatform dat EDM ontwikkelt en de bezoekersgegeven bekomen uit de toepassingen analyseren en interpreteren.","120,000.00","300,000.00",40.00%,12/1/08,11/30/10KIK-off,Katholieke Hogeschool Limburg,"Met behulp van netwerkacties binnen het project KIK-off wil I refrigeration, de expertisecel van de Katholieke hogeschool Limburg de kennis over eco-innovatieve koeltechnieken valoriseren met behulp van een demonstratielabo met duurzame koelinstallaties, kennisplatform en virtueel labo. Nu werkt meer dan 20% van de commerciële koelinstallaties nog met milieuonvriendelijke koelmiddelen die het broeikaseffect versterken. Vanaf 2015 moeten die vervangen worden door natuurlijke koelmiddelen zoals CO2.","154,254.00","385,636.00",40.00%,9/1/08,8/31/10Innovation Wizard: contextuele creativiteit,Hogeschool West-Vlaanderen,"De Innowiz software wordt tijdens het lopende TETRA project ontwikkeld en resulteert in een praktische, laagdrempelige webgebaseerde creativiteitssoftware die de gebruiker aanspoort op regelmatige basis creatieve technieken toe te passen binnen de concrete bedrijfsomgeving. De software stelt op basis van een beknopte contextbeschrijving een creativiteitstechniek voor die de meeste kans op slagen zal hebben in die specifieke omstandigheden. Daaraan worden praktische visualisatie en concretisering instrumenten gekoppeld. Dit project is een vervolgtraject van het huidige TETRA project. De opgedane kennis, ontwikkelde instrumenten en expertise moet nu verspreid worden onder de beoogde doelgroep. Ondertussen wordt de software verder uitgebreid met een logging- en feedbacksysteem, waarmee op termijn een intelligent systeem uitgebouwd kan worden.","63,800.00","159,500.00",40.00%,12/1/08,1/30/10Sint-Vincentiusziekenhuis,Sint-Vincentiusziekenhuis te Antwerpen,"Het project beoogt een duurzame energie-efficiënte verwarming en koeling aan een hoog rendement en aan een lagere energie- en exploitatiekost dan een referentie installatie voor een algemeen stedelijk ziekenhuis. Door uniek gebruik te maken van betrouwbare technologieën van BoorgatenEnergieOpslag (BEO) met Warmte Pomp(WP), gekoppeld aan een bestaande installatie met Warmtekrachtkoppeling (WKK) en condenserende ketel zal het mogelijk zijn een maximum optimaal comfort te leveren aan patiënten, personeel en bezoekers. Een maximale reductie van de primaire energie zal de afhankelijk ervan verminderen Een goed energiebeheer begint bij de bouwschil en daarom zal naast de introductie meer dan gewone isolatie in vloeren, wanden en daken worden voorzien. Bovendien zal alle aandacht worden geschonken aan het luchtdicht bouwen. De bedoeling is om het verlies aan warmte via de gevel te minimaliseren. Een optimaal pulsie- en extractiesysteem zal zorgen voor een perfect binnenklimaat","199,842.68","499,606.68",40.00%,10/1/08,9/30/10Economische kaart West-Vlaanderen,Provincie West-Vlaanderen,"Deze provinciale kaart wil een overzicht bieden van alle economische activiteit, van landbouwer en bakker tot industriële multinational en (non-) profit dienstverlener (ruim 100.000), die voldoet aan met gebruikers geformuleerde kwaliteitseisen. Met de Economische Kaart wil de Provincie West-Vlaanderen in samenwerking met de gemeenten de data uit het VKBO uitzuiveren, vervolledigen, actualiseren, eventueel verrijken, en ontsluiten. Het project beoogt te komen tot een bedrijvendatabank, in eerste instantie te benutten door de lokale en provinciale overheid, te verrijken met een Giscomponent en te ontsluiten via het net, waardoor er ook een winsituatie ontstaat voor bedrijven en burger.","115,038.00","287,598.00",40.00%,12/1/08,11/30/10Profoto,Hogeschool West-Vlaanderen,"Het project beoogt het opstellen van een proefveld voor fotovoltaïsche panelen van de verschillende hedendaagse technologieën. Hierin worden niet alleen de fotovoltaïsche panelen naar efficiëntie en opbrengst onder verschillende klimatologische omstandigheden met elkaar aangetoond, maar ook de impact van de netkoppeling op de efficiëntie van de fotovoltaïsche panelen en zijn impact op het openbaar voedingsnet wordt gedemonstreerd.","60,000.00","150,000.00",40.00%,11/3/08,10/30/10TEB - THE ENERGY BOX,GREENBRIDGE INNOVATIECENTRUM,"The Energy Box van Greenbridge Innovatiecentrum is een demonstrator van nieuwe technologieën op het vlak van duurzame energie, producten, concepten, processen en diensten (PCPD). Het richt zich specifiek naar kmo’s, waaronder start-ups en (academische) spin-offs, R&D centra & platformen, die marktrijpe prototypes in de cleantech sector ontwikkelden, doch niet het kader hebben of vinden om de markt daadwerkelijk te betreden. ","599,813.37","1,499,533.42",40.00%,2/1/10,1/31/12Milieuvriendelijke teeltwijzen ter productie van residu-arm fruit,Proefcentrum Fruitteelt,Met het project Milieuvriendelijke teeltwijzen ter productie van residu-arm fruit wil het Proefcentrum Fruitteelt het gebruik van recent ontwikkelde alternatieve milieuvriendelijke teeltwijzen stimuleren door overdracht van de binnen pcfruit aanwezige kennis en expertise omtrent deze alternatieve strategieën en het aanleggen van proefpercelen ter demonstratie. ,"101,580.00","253,950.00",40.00%,1/1/10,12/31/11GameHUB,Provinciale Hogeschool Limburg,"Het project GameHUB van de Provinciale Hogeschool Limburg beoogt de valorisatie van bestaande kennis op het vlak van de ontwikkeling van games en wil (startende) KMO's de nodige kennistools bieden om vernieuwende producten en/of diensten met economische meerwaarde te ontwikkelen. Het project focust op drie primaire doelstellingen: kennisdiffusie, kennistoepassing en kennisverwerking. ","505,967.00","1,264,917.50",40.00%,1/1/10,12/31/12Mobiele pilootopstellingen voor waterbehandeling,Katholieke Hogeschool Brugge-Oostende,KaHo West-Vlaanderen beoogt met het project Mobiele pilootopstellingen voor waterbehandeling moderne waterbehandelingstechnieken mobiel in te zetten bij KMO’s en land- en tuinbouwbedrijven. Verscheidene technieken en combinaties kunnen zo gedurende een korte periode getest worden op maat van de deelnemende bedrijven. Nadien worden deze bedrijven verder begeleid in het vinden van vergelijkbare technologie op de markt. Het uiteindelijke doel is de watervraag van de begeleide bedrijven te verminderen en hen te helpen de milieunormen voor lozing te respecteren. ,"120,000.00","300,000.00",40.00%,3/1/10,2/28/11ISSI - Innovatie Systeem voor Systeem Innovatie,I-PROPELLER,"Het project ISSI-Innovatie Systeem voor Systeem Innovatie van I-PROPELLER wil een continue samenwerking uitbouwen tussen twee bestaande innovatienetwerken Plan C (duurzaam materiaal-beheer) en DuWoBo (duurzaam wonen en bouwen) door het ontwikkelen van een gemeenschappelijke methodologie voor het ondersteunen van transitie-experimenten, een participatieve kennisdatabank over de innovatienetwerken heen en een toolkit die een multiplicator effect genereert voor systeeminnovaties en die de innovatienetwerken versterkt in hun management","295,506.18","738,765.45",40.00%,11/1/09,11/1/11Duurzame verpakkingstechnologie,PROCTER & GAMBLE EUROCOR,"Kunststof flessen zijn een populaire verpakking van consumentenproducten. Procter & Gamble is er vorig jaar in geslaagd om een technologie te ontwikkelen die toelaat om flessen in polypropyleen (PP), die milieuvriendelijker zijn dan PET-flessen, te produceren via de ISBM-technologie, wat een ecologischer proces is dan de gangbare EBM-technologie. Tot op heden was de ISBM-technologie enkel bruikbaar voor de productie van PET-flessen. De gecombineerde voordelen (productie van PP-flessen met de ISBM-technologie) leveren een flinke ecologische meerwaarde op (15 tot 20% Met het project Duurzame verpakkingstechnologie willen Procter & Gamble en ESSENCIA de voordelen van de nieuwe technologie demonstreren aan de Vlaamse bedrijven, de onderwijs-, opleidings- en onderzoeksinstellingen en aan hun intermediairen aan de hand van een demonstratielijn. ","307,826.50","769,566.30",40.00%,1/1/10,12/31/12"Closing the Circle, een demonstratie van Enhanced Landfill Mining (ELFM)",Universiteit Hasselt - Instituut CMK,"Met het project Closing the Circle, een demonstratie van Enhanced Landfill Mining (ELFM) wil Universiteit Hasselt- Instituut CMK demonstreren dat het integraal valoriseren van materialen en energie uit stortplaatsen mogelijk. Het project is een voorstel om een afvalopslagplaats van de Remo Milieubeheer (dochter Group Machiels), te valoriseren door maximale recyclage van materialen en valorisatie van het energiepotentieel van het recyclageresidu voor de productie van duurzame elektriciteit en warmte. Naar schatting 45% van de aanwezige 15 miljoen ton afvalstoffen kunnen rechtstreeks of na behandeling als materiaal gerecupereerd worden. ","200,000.00","500,000.00",40.00%,10/1/09,9/30/11Hybride Ventilatie @ Creative Minds,Den Hoorn,"Actieve koeling en mechanische ventilatie zijn in kantoorgebouwen verantwoordelijk voor een zeer grote energieconsumptie en meestal weinig comfortabel. Het project Hybride Ventilatie @ Creative Minds van Den Hoorn nv introduceert ‘hybride ventilatie’, een cleantech oplossing die op een intelligente manier de mogelijkheid van natuurlijke ventilatie maximaal benut. Ze bestaat uit een computergestuurde bediening van raammotoren met permanente meting van buiten- en binnencondities. ","159,350.00","398,376.00",40.00%,4/1/10,3/30/12VEHIKel,Groep T,Elektrisch vervoer wordt steeds duidelijker als essentieel onderdeel van duurzame mobiliteit ervaren. In Vlaanderen laat de doorbraak echter op zich wachten. Geïnteresseerde gebruikers zijn terughoudend door het onbekende en het gebrek aan degelijk uitgebouwde oplaadinfrastructuur. Omgekeerd wordt de oplaadinfrastructuur niet grootschalig uitgebouwd wegens het beperkt aantal bestaande gebruikers. In het project VEHIKeL van Campus Vesalius wordt de elektrische scooter als betaalbaar en technisch rijp voorbeeld naar voren geschoven. ,"210,982.17","527,455.42",40.00%,11/1/09,10/31/11Ondersteuning en coördinatie van het actieplan 'De Romeinse Weg',Provincie Limburg,"Dit project wil de realisatie van het actieplan 'De Romeinse Weg' faciliteren: d.w.z. de nodige ondersteuning, coördinatie en gemeenschappelijke bovenlokale aspecten bieden die nodig zijn voor het welslagen van de realisatie van het actieplan door de lokale actoren. Het project beperkt zich in de pilootfase.","144,087.16","360,217.90",40.00%,1/1/08,12/31/09Landbouwwegen in de Westhoek,Vlaamse Landmaatschappij,"De mobiliteit in de Westhoek is belangrijk en draagt bij tot de economische en sociale cohesie van het platteland. De laatste jaren is het gebruik van de landbouwwegen fel gewijzigd. Door evoluties in de landbouw is de mobiliteitsdruk op de landelijke wegen gevoelig toegenomen (toenemend zwaar verkeer van en naar een landbouwbedrijf o.a. omwille van grotere omvang bedrijven en nieuwe functies o.a. mestverwerking). Ook profileert de Westhoek zich meer en meer als een regio met belangrijke economische troeven inzake plattelands- en cultuurtoerisme. M.a.w. door een veranderende situatie in de plattelandseconomie (toeristisch/recreatief en (para-) agrarisch) wijzigt het gebruik van de landbouwwegen. Naast bovenstaande worden de landbouwwegen meer en meer gebruikt als sluipweg. Al deze functies zijn niet wenselijk op een landelijke weg. Met dit project is het de bedoeling in de Westhoekgemeenten de landbouwwegen met bijhorend verkeer te inventariseren, aan de landbouwwegen een functie toe te kennen en vervolgens een aantal knelpunten op te lijsten. Dit zal gebeuren aan de hand van een studie waarbij een gebiedsdekkende visie met betrekking tot de mobiliteit en het beheer van de landbouwwegen in de Westhoek zal ontwikkeld worden. Aan de hand van die studie worden richtlijnen opgemaakt voor gemeentebesturen voor een goed beheer van hun landelijk wegennet. Naast de studie worden in 4-tal gemeenten pilots voor investeringen in landbouwwegen uitgevoerd.","504,210.48","1,260,526.48",40.00%,11/1/08,10/31/10Regionale branding,Rurant,"Er is nood aan een totaalconcept op basis van streekidentiteit waarin economische initiatieven kunnen ontwikkeld worden en hun marktwaarde verhogen. Primaire doelgroepen: plattelandsondernemers en intermediaire organisaties. Secondair: inwoners en consumenten. Met dit project wil met van de streekidentiteit een economische hefboom maken voor plattelandsondernemers. Andere doelstellingen zijn het delen van bestaande kennis, het verwerken ervan in de ontwikkeling van regiobrands en de toepassing in productontwikkeling.","318,560.00","796,400.00",40.00%,7/1/08,6/30/10Kempen Duurzaam,Strategische Projectenorganisatie Kempen,"Eén van de pijlers waarop de Kempen zich het komende decennium sterk kan ontwikkelen is die van 'duurzame energie- en milieutechnologie'. Om een sterke kenniseconomie uit te bouwen, is een gecoördineerd strategisch toekomstprogramma nodig, waarvoor dit projectvoorstel bedoeld is. Het beoogt de creatie van dit strategische toekomstprogramma - onder de werktitel 'Kempen Duurzaam' - de coördinatie en uitbouw van het programma, en de externe communicatie. 'Kempen Duurzaam' is een toekomstprogramma om de Kempen tegen 2020 uit te bouwen tot een internationaal toonaangevende regio op het vlak van duurzame energie- en milieutechnologie. Deze ambitie kan worden vertaald voor de kenniscentra, de bedrijven als voor de duurzaamheidsprestatie in de regio zelf.","152,983.00","382,456.00",40.00%,7/1/08,6/30/10Masterplan Mijnstreek,Provincie Limburg,"Het masterplan Mijnstreek moet een visie, doelstellingen en strategieën aanreiken voor het ontsluiten van de Mijnstreek. Belangrijk hierbij is dat het masterplan een beleidsmatig en theoretisch kader aanbiedt voor het omgaan met erfgoed. Onderdelen van het masterplan zijn: (1) Hoe omgaan met welke delen van het erfgoed (2) actoren en hun rol (3) bewoners en hun rol (4) het ontwikkelen van een huisstijl, een eigen identiteit voor de Mijnstreek (5) het formuleren van beleidsaanbevelingen.","31,040.00","77,600.00",40.00%,11/4/07,3/31/09ECO_,B B Consult,"Dit project richt zich op het ontwikkelen van nieuwe marktgerichte activiteiten en ontwikkelingsstrategieën voor plattelandsgebieden die de typische plattelandskwaliteiten vrijwaren en versterken. Dit gebeurt door (agrarisch) natuurbeheer in de economische sfeer te trekken, wat enerzijds een economische meerwaarde creëert en anderzijds duurzaamheid in de tijd garandeert.","652,640.00","1,631,600.00",40.00%,10/1/08,9/30/10Green Valley Kempen,GPB Kamp C - Provinciebestuur Antwerpen,Green Valley Kempen van GPB Kamp C - Provinciebestuur Antwerpen heeft als doel de regio Kempen te promoten als toonaangevende duurzame regio via het bekend maken van duurzame voorbeeldprojecten. ,"117,680.00","294,200.00",40.00%,1/1/10,12/31/11De kolonies in de Noorderkempen,Kempens Landschap,De voormalige landloperskolonies van Wortel en Merksplas hebben door hun uniek landschappelijk karakter een enorm ecologisch en toeristisch-recreatief potentieel. Het project De Kolonies in de Noorderkempen van Kempens Landschap wil een aanzet geven om dit potentieel te ontwikkelen via innovatieve landinrichting en zo een hefboom creëren voor de regio; doch steeds met respect voor het landschap en de landschappelijke eenheid.,"152,522.64","500,238.25",30.49%,1/1/10,12/31/11De Westhoek inspireert,Provincie West-Vlaanderen,Centraal in het project De Westhoek Inspireert van Streekhuis Essenkasteel staat hoe de streek de Westhoek kan gepromoot worden en hoe die eigenheid vervolgens kan omgezet worden in een economische ontwikkeling. ,"313,328.00","783,320.00",40.00%,11/1/09,10/31/11Regional Branding Hageland,Leaderwerking Hageland vzw,"Het project Regional Branding Hageland van Leaderwerking Hageland vzw heeft twee doelstellingen. Ten eerste wordt in een zo breed mogelijk forum een nieuw regionaal merk ontwikkeld, waarin de eigenheid van het Hageland tot uitdrukking komt. De tweede doelstelling betreft de implementatie en optimale benutting van het merk, via tal van concrete activiteiten.","199,800.00","499,500.00",40.00%,1/1/10,12/31/11Thought 4 Food,Provincie West-Vlaanderen,"Bottum-up vertrekkend vanuit de concrete behoefte aan een grotere maatschappelijke en economische visibiliteit in het betrokken projectgebied en steunend op de feitelijkheid van de enorme toegevoegde waarde die het agrocomplex er genereert, beoogt het project Thought 4 food van Provinciehuis Olympia de creatie van een aantrekkelijk en wervend imago voor de regio Midden-West-Vlaanderen - Westhoek. Het project zet bijkomend in op de versterking van de economische dynamiek via de detectie en ondersteuning van innovatieve toepassingen in de land- en tuinbouwsector en de voedingsindustrie en op landschapsherwaardering in zowel agrarische als agro-industriële gebieden, vertrekkend vanuit een globale geïntegreerde visie.","552,000.00","1,380,000.00",40.00%,2/1/10,1/31/12GENT BLOEMENREGIO,Boerenbondvereniging voor Projecten,De stad Gent en haar omgeving is van oudsher de bakermat van de sierteeltsector in Vlaanderen. Nochtans is dit gegeven nooit optimaal benut als merknaam waarrond gezamenlijk promotie gevoerd kon worden. Boerenbond Vereniging voor Projecten wil met het project Gent Bloemenregio een regionale merknaam creëren waaronder verschillende activiteiten kunnen gebundeld worden tot een totaalconcept dat van streekidentiteit een economische hefboom maakt.,"410,653.44","1,026,633.61",40.00%,1/1/10,12/31/11ondernemers.tv,Unie van Zelfstandige Ondernemers,"Ondernemers.TV wil het ondernemerschap in een positief daglicht stellen. Een positiever beeld van ondernemers en correcte en aantrekkelijk weergegeven informatie kan mensen ertoe brengen om toch de stap naar het ondernemerschap te zetten. De promotor wil een innovatief project ontwikkelen dat ondernemende en jonge mensen kennis laat maken met de uitdagingen en mogelijkheden van het ondernemerschap door middel van attractieve communicatievormen. Ze richten zich tot jonge en dynamische mensen met zin om hun creativiteit te uiten die spontaan neigen naar webmedia (webtv, blog, discussiefora, ...); bestaande ondernemers op zoek naar een extra informatiekanaal op hun maat boven de traditionele media.","138,224.00","345,560.00",40.00%,10/1/08,9/30/10Proleron,Epon,"Er is een groot gebrek aan ondernemerscultuur op school en bij de leraren zelf. Het project beoogt de professionalisering van leraren en docenten op het vlak van ondernemerschapsonderwijs door het aanbieden van specifieke workshops, infosessies, kortlopende stages, kennismakingsessies en werkplekleren. Die professionalisering leidt automatisch naar een efficiënter ondernemerschapsonderwijs. Het aanbieden van deze navormingen en stages waarbij de ondernemerscompetenties bij de leraren worden aangescherpt zal gebeuren in nauwe samenwerking met de verschillende beroepsfederaties, werkgeversorganisaties en toonaangevende ondernemingen.","59,772.10","149,430.24",40.00%,2/1/09,1/31/11COCON,SYNTRA WEST,"Ondernemerscompetenties verstevigen door een individueel en collectief coachingstraject. De zwakte van menig (startende) ondernemer zit hem niet zozeer in een goede product- en vakkennis maar eerder in het gebrek aan ondernemerscompetenties. Hierdoor missen ze een aantal kansen, benutten ze hun potentieel niet ten volle en in het slechtste geval betekent dit het faillissement. Dit project beoogt ondernemingszin en ondernemerscompetenties bij te brengen aan (potentiële) starters in 3 uiteenlopende sectoren, zijnde de bouw, de voeding en de personenverzorging waarbinnen 3 beroepen als piloot dienen: brood- en banketbakker, kapper en tegelzetter.","81,682.49","204,206.22",40.00%,3/1/09,2/28/11Battle of Talents,ADDESTINO INNOVATION MANAGEMENT,"Dit project stimuleert ondernemerschap bij onderzoekers aan universiteiten en hogescholen door middel van een competitie tussen teams van verschillende universiteiten en hogescholen die door een jury beoordeeld worden op hun vermogen om kennis in te zetten en te vertalen in commerciële producten en diensten volgens het principe: kennis, kunde, kassa!","93,976.32","234,940.80",40.00%,10/1/08,9/30/10Zorg voor Ondernemerschap,VOKA - Kamer van Koophandel Limburg,"Het project focust op de niet-corebusiness van zorginstellingen, zijnde bedrijfsprocessen en het bevorderen van (intern) ondernemerschap. Ondernemerschap wordt aangemoedigd via netwerking, rolmodellen én kruisbestuiving met de private sector.","97,588.48","243,971.17",40.00%,1/1/09,12/31/10